code,title,credit,description
SKPT 121,Fundamentals of Refrigeration & A/C, 3,"Examines the physical, gas, and chemical laws of refrigeration. Develops an understanding of the theory of heat, temperatures, pressures of gases and thermodynamics. Analyzes basic refrigeration cycle and components such as vacuum pumps, gauges, and (PT) Pressure Temperature Charts. Develops an understanding of units on safety and EPA Refrigerant Certification. Credit may be earned in one of the following:"
SKPT 114,Stationary Boiler Engineering IV, 3,"This course includes air compressors of the following types: centrifugal, rotary screw, large reciprocating compressors and drives; boiler feed water chemical treatment."
SKPT 122,Refrigeration and A/C Service I, 3,"Focuses on concepts of common types of domestic refrigerators, dehumidifiers, and portable air conditioners. Develops an understanding of special references involving the essentials of construction of complete refrigeration systems. Presents theory and principles underlying repairing refrigeration appliances and practical shop work through classroom demonstrations and lab experiments. Credit may be earned in one of the following:"
SKPT 113,Stationary Boiler Engineering III, 2,"Automatic boiler operation. Forced and induced draft systems. Steam turbines and auxiliaries, auxiliary steamplant equipment, cooling towers, boiler feed water treatment and heating."
SKPT 111,Stationary Boiler Engineering I, 2,"Orientation to power plant operations including boiler safety rules and regulations. General operating procedures for various types of boilers, uses and types of fuels and their sources; elementary chemistry of combustion."
SKPT 112,Stationary Boiler Engineering II, 2,"This course includes boiler settings, combustion equipment, operation and maintenance of boilers, pumps, reciprocating steam engines, valve operating mechanisms."
SKPT 106,Pipefitters Handbook, 3,"Explores mathematical calculations including geometry and trigonometry. Includes: pipe bends, linear expansion of piping, tank capacities, leverage, methods of layout angles, pipe-fitting calculations, pipe-welding layout, and reference tables."
SKPH 101,Applied Physics, 4,"Introduces the basic physical principles involving mechanics, fluids, heat, conservation of energy, electricity, and sound. Credit may be earned in SKPH 101 or"
SKPT 101,Industrial Piping, 4,"Basic sanitation principles, terminology, materials classification, drainage systems, waste disposal system, pipe sizing and layout. Industrial piping situations involving gasoline, acid plating solutions, gases, safety, code requirements."
SKMT 231,Fundamentals of Foundry Technology, 3,"Provides an overview of all the components that make up a modern foundry. Participants will become familiar with the interrelationship between the metallurgy, melting, production engineering, core, molding, finishing, and reliability and quality control departments. Special emphasis is placed on how each department is dependent upon the other and what affect each has on the production of a quality product at a competitive cost, through the use of a statistical process control."
SKOT 192,Machine Controls II, 3,Machine Controls II is a continuation of Controls I with special emphasis placed on diagnostic troubleshooting techniques. Primary objective of the course is to enable maintenance personnel to discuss machine functions or malfunctions with machine and control system designers. The course will also benefit toolmakers and machine builders to understand the overall operation of complex machinery they build and/or assemble.
SKMT 241W,Introduction to Monitoring Controls, 3,Focuses on the theory of planned/predictive maintenance strategies and the familiarization of the technological tools available to support those strategies. Presents the theory and application of each of the technologies but is not intended to prepare for certification in any of the technologies discussed above.
SKOT 191,Machine Controls 1, 3,"Present students with mechanical background the essentials of wiring and troubleshooting controls in production machinery. Studies AC/DC circuits, fundamentals of hydraulics and pneumatics as they pertain to machine control circuitry. Emphasizes relay ladder diagrams, simple debugging and nomenclature necessary to communicate with design engineers and other trades in the installation and troubleshooting of panel wiring."
SKMT 222,Hydraulics and Pneumatics II, 3,"Advanced course in fluid power designed for machine repair, pipefitters and plumber trades. Analyzes common hydraulic and pneumatic components and circuits. Includes building of machine tool circuits and troubleshooting special systems such as hydrostatic transmissions and electrohydraulic servos, and ladder diagramming of pneumatic control circuits. Covers mathematics and graphic symbols used in troubleshooting. Credit may be earned in SKMT 102 or SKMT 222, but not both."
SKMT 220,Hydraulics and Pneumatics I, 3,"Focuses on the operation and function of fluids, pumps, compressors, valves, cylinders, motors, filters, and other components used in the power and control of machine tools, construction and agricultural equipment. Uses algebraic formulas, charts, and graphic symbols for design and diagnosis of basic circuits. Credit may be earned in only one of SKMT 101, SKMT 220 or"
SKMT 171,Sheetmetal Layout I, 3,"Analyzes and develops geometrical structures, intersections by radial and triangulation methods of sheet metal layout, the drawing of development layouts, and the forming of actual models with sheet metal. Credit may be earned in one of the following:"
SKMT 173,Sheetmetal III, 3,Continuation of Sheetmetal Layout II. Emphasis placed on the layout and construction of patterns found in the industrial plant. Special projects will be assigned.
SKMT 172,Sheetmetal II, 3,Continuation of Sheetmetal I. Projects involve fabrication of complex pieces to actual specification using tools common to the trade.
SKMT 161,Industrial Rigging and Safety, 2,"Studies the methods of safe transfer of loads and provides comprehensive easy-to-understand and reliable information of the entire field of rigging operations. Discusses techniques and methods to accomplish the rigger's task with the greatest safety for all of the workers on a project, as well as for passers-by and the public in general. Identifies sources of, organizes, and describes safety rules, regulations and practices related to job-site hazards, personal protective equipment, aerial work, hazard communication, and electrical safety. Credit may be earned in"
SKMT 151,Power Transmission, 3,"Identifies and explains safety rules, regulations, test procedures, installation, removal, and operation of belt drives, chain drives, mechanical couplings, and mechanical drive systems. Demonstrates the concepts of shaft alignment. Credit may be earned in SKMT 151 or"
SKMT 112,Ferrous Heat Treatment, 2,"Designed to acquaint students with various forms of heat treatment applied to plain carbon steels, cast iron, alloy tool steel, and stainless steel. Course will also include steel classification and machinability."
SKMT 111,Metals, 3,"Distinguishes temperature measurement by color, hardness, strengths, fatigue properties, steels, plastics, cast iron, copper, brass bronze, aluminum, their applications with respect to wear, corrosion, and design."
SKMA 112,Applied Integrated Electrical Mathematics II, 3,Develops further competency in the application of mathematics principles to electrical circuit configurations including DC and AC circuit applications. Includes trigonometry as applied to electrical-circuit theory and non-mathematical theory related to electricity and electronics.
SKMA 113,Applied Integrated Electrical Math III, 3,"This course is the third in a series of electrical mathematics and circuit analysis intended to give an electrical apprentice the necessary background to maintain and service industrial control equipment. It will include a study of capacitance, capacitive reactance, vectors, phasers. series AC circuits, power factor and three-phase systems. Trigonometry and pythagorean mathematics will be used in the computation of the phase relationships of the various quantities studied."
SKMA 111,Applied Integrated Electrical Math I, 6,"Develops competency in the application of mathematics principles to electrical circuit configurations. Includes mathematical equations and formulas necessary to solve D.C. circuit applications applied to electrical, mechanical and process industrial control equipment. Covers non-mathematical theory related to electricity and electronics."
SKMA 103,Applied Geometry and Trigonometry, 4,"Includes the following geometry topics: angles, triangles, polygons, circles, prisms, cylinders, and cones. Includes right-triangle trigonometry, radian measure, oblique-triangle trigonometry, and graphs of trigonometric functions. May receive credit in only one of the following: SKMA 103,"
SKMA 099,Pre-Apprenticeship Basic Skills, 2,"Explores basic mathematics principles. Discusses whole numbers, fractions, decimals, percentages, metric system, rational numbers, polynomials, equations, exponents, and radicals. Reviews algebra, geometry and graphical math. Introduces spatial skills and blue print reading. Examines orthographic projections, three viewdrawings, missing line(s), point and surface identification, fitting pieces together, rotated/flipped and cube unfolding and folding. Includes mechanical comprehension. Analyze physical principles, simple machines, vectors, hydraulics, liquids, density and circular motion. Completion of this course does not guarantee an apprenticeship. Does not earn credit toward graduation."
SKMA 097,Algebra I, 3,"Includes natural number, integers, first-degree equations and inequalities, special products, factoring, rational expressions and equations, graphs, and linear systems, exponents, and quadratic equations. May receive credit in only one of the following:"
SKET 280,Industrial Computer Networks, 3,"Builds on the skills developed in an introduction to PLC's and applies the concepts learned to the integration of various devices to form an industrial computer network system. Emphasis is placed on the Ethernet communication protocol. Construct a computer network, establish communications between all connected devices, and evaluate the proper operation of a control system. Develops skills of selecting, connecting, and operating sensors and transducers in an industrial environment in order to perform maintenance actions. Credit may be earned in SKET 280 or"
SKET 289,Troubleshooting, 3,Completes a comprehensive review of skills for the Industrial Electrician certificate program. Applies all of the skills covered throughout the program to evaluate problems with electrical equipment. Explains systematic troubleshooting techniques and applies them to identifying and resolving real-life situations. Selects appropriate diagnostic testing equipment and compares expected results to actual findings.
SKMA 096,Pre-Algebra, 2,"Provides preparation for algebra. Includes fractions, decimals, integers, ratios, and percentages with an introduction to equations, graphs, and functions. May receive credit in only one of the following:"
SKET 262,Industrial Robotics II, 3,"Emphasizes programming, advanced manipulation, grip load instructions, velocity, and acceleration instruction, offline editing, handling errors, and robot configuration. Discusses programming concepts and structures in the C+ programming language, industry-like applications and system integration projects. Emphasizes a hands-on approach to system analysis, critical thinking, solutions to open-ended problems, computer usage, and teamwork. Credit may be earned in SKET 262 or"
SKET 252,Programmable Logic Controllers II - AB ControlLogix, 4,"Builds on the skills developed in an introduction to PLCs and applies the concepts learned to an AB ControlLogix Programmable Logic Controller (PLC) system. Explains the hardware platform for the AB ControlLogix PLC along with the logic elements that comprise the instruction set used for programming the logic. Applies lecture subject material in the laboratory through the use of PLC training systems. Constructs control circuits from drawings, analyzes the process, makes revisions as necessary, and evaluates the proper operation of the PLC circuit. Credit may be earned in"
SKET 250,Programmable Logic Controllers II - Siemens, 4,"Builds on the skills developed in an introduction to PLCs and applies the concepts learned to a Siemens Programmable Logic Controller (PLC) system. Explains the hardware platform for the Siemens PLC along with the logic elements that comprise the instruction set used for programming the logic. Applies material taught in lecture in the laboratory through the use of PLC training systems. Constructs control circuits from drawings, analyzes the process, makes revisions as necessary, and evaluates the proper operation of the PLC circuit. Credit may be earned in"
SKET 178,Residential Wiring and Controls, 5,"Builds on the skills developed in control circuits and applies the concepts learned to residential wiring and control systems. Analyzes the wiring schematics and examine troubleshooting techniques for various devices utilized in the residential industry. Also examines programmable logic controllers, alternative energy, and environmentally friendly devices."
SKET 210,Introduction to Electronics, 4,"Identifies basic electronic devices commonly used throughout industry and relates each device to the proper symbol that is used in the electrical drawings. Describes the proper operation of an electronic circuit that is comprised of various components that are integrated together. Applies lecture material in the laboratory through the use of electronic circuit training boards. Constructs electronic circuits from drawings, analyzes the process, makes revisions to wiring as necessary, and evaluates the proper operation of the circuit. Discusses and uses troubleshooting techniques and basic test instruments. Credit may be earned in SKET 210 or"
SKET 200,HMI Programming, 4,"and applies the concepts learned to the programming of Human Machine Interface (HMI) systems. Includes topics of the programming, editing, uploading, and downloading of HMI applications. Creates HMI programs that will read data from a PLC and send information to a PLC. Designs the PLC programs to interpret the data from the HMI and send information to the HMI. Applies lecture subject material in the laboratory through the use of PLC/HMI training systems. Designs programs, analyzes the process, makes revisions to programs as necessary, and evaluates the proper operation of the PLC/HMI system."
SKET 164,Robotics Electrical Service & Troubleshooting, 3,"Identifies the electrical component of robots, theory of operation. Introduces proper troubleshooting procedures for the robot controller and manipulator. Approximately 50 percent of the course will be hands-on troubleshooting of actual robot system and controller. Credit may be earned in SKET 164 or"
SKET 162,Industrial Robotics I, 3,"Studies modern industrial robotic systems. Introduces the operation, use and safety of industrial robots. Discusses feedback mechanisms, actuators, sensors, power supplies, micro-controllers, P.C. computer control and programming. Emphasizes a hands-on approach to system analysis, critical thinking, solution to open-ended problems, computer usage, and teamwork. Credit may be earned in SKET 162 or"
SKET 160,Fire Alarm and Security Systems, 2,Develops competency in the application of the National Electrical Code (NEC) and its relationship to fire alarm systems as written by the National Fire Protection Association (NFPA). Emphasizes the discussion of fire alarm and security systems. Discusses data transfer including the use of fiber optics and wireless communications.
SKET 139,Motors, 2,"The principles of electromagnetism are discussed and applied to the theory and the operation of DC motors, AC motors, permanent magnet, and brushless DC motors. Motor components, starting requirements, characteristics, maintenance, and troubleshooting techniques are discussed in lecture and applied in laboratory exercises. Credit may be earned in"
SKET 141,Industrial Electrical Codes & Standards, 3,"Develops competency in the application of the National Electrical Code (NEC) and its relationship to industry and some residential wiring as written by the National Fire Protection Association (NFPA). Reviews the Joint Industrial Council (JIC) standards for industrial electrical mass production operations and equipment. Gives emphasis to the proper interpretation of safety issues regarding hazardous locations, electrical grounding, ground faults, fusing, motor circuit protection and controls, as well as electro-mechanical and hydraulic devices. Credit may be earned in SKET 141 or SKEL 141, but not both."
SKET 140,Motor Controls and Drives, 4,"Applies the basic principles of control circuits to an intermediate study of DC motors, AC motors, and servo motors. Performs armature reaction, CEMF, and basic motor calculations. Analyzes motor control including starting requirements, forward/reverse control, and sequencing of motors. Emphasizes the extension of motor control to drive systems including SCR armature control, field weakening, Pulse Width Modulation, and Variable Frequency Drives. Explains principles of drive operation, set-up, calibration, and troubleshooting in lecture and applies in laboratory exercises. Credit may be earned in SKET 140 or"
SKET 136,Grounding, 2,"Develops competency in the comprehension and application of the National Electrical Code (NEC) as it applies to the effective grounding and bonding of electrical devices, equipment, and systems. Examines how to properly read and interpret the NEC tables and how to properly calculate the size of the conductors for the application. Credits may be earned in"
SKET 138,Over-Current Protection, 2,This course covers the requirements for adequate protection of wiring and equipment. Disconnects and circuit breakers are explained and calculations are made to determine sizing requirements. Fuse types and characteristics are discussed and calculations are made to determine appropriate fuse sizing to protect wiring. Short circuit interrupt rating is introduced and appropriate fuse types are selected for various applications.
SKET 134,Transformers, 2,"Principles of transformers are discussed and applied to single phase transformers, three phase transformers, wye and delta connections, and isolation transformers. This course develops competency in the understanding and application of the National Electrical Code (NEC) as it applies to transformer installations. Calculations for turns ratio, voltage ratio, and current ratio are used to determine circuit relationships between voltage and current."
SKET 132,Power Distribution, 3,"The principles of electromagnetic induction are discussed and applied to the operation of DC generators, single phase AC generation, three phase alternators, and alternative power sources. Wye and delta connections will be explained and students will solve equations to determine voltage, current, and power in branch circuits. Students will distinguish various properties of conductors including type, physical size, ampacity, resistance, reactance, insulation, and temperature rating. Load requirements for branch circuits will be analyzed and appropriate wire type and size will be selected for the application. Other topics discussed include power factor correction, conductor derating, conductor identification, wire color codes, termination requirements, and conduit fill requirements."
SKET 130,Conventional Controls, 3,"Identifies control devices commonly used throughout industry and relates each device to the proper symbol that is used in the electrical drawings. Develops a thorough comprehension for the devices by describing the proper operation of a control circuit that is comprised of various components that are integrated together. Applies the subject material from lecture in the laboratory through the use of electro-pneumatic training boards. Uses drawings to construct control circuits, analyze the process, make revisions to wiring or set-up configurations, as necessary, and evaluate the proper operation of the control circuit. Credit may be earned in SKET 130 or"
SKET 122,Programmable Logic Controllers, 5,"Builds on the skills developed in SKET 130 and applies the concepts learned to Programmable Logic Controller (PLC) systems. Includes hardware topics installation procedures, wiring diagrams, system architecture, and I/O modules and software topics basic logic elements, timers, counters, program control, math functions, data manipulation, sequencers, shift registers, and file/word transfers. Includes lab activities utilizing RSLogix and RSLinx software for creating, editing, saving, downloading, and uploading programs. Applies subject material from lecture in the laboratory through the use of PLC training systems. Uses drawings to construct control circuits, analyze the process, make revisions to wiring or set-up configurations as necessary, and evaluate the proper operation of the PLC circuit. Credit may be earned in SKET 122 or"
SKET 120,AC Circuits, 2,"Introduces the basic concepts of electricity as it applies to AC circuits. Explains inductance, capacitance, and the phasor relationships between electrical signals Explains the schematic symbols for devices used in AC circuits. Determines the total impedance for series and parallel combinations of resistors, inductors, and capacitors. Uses Ohm's law, Kirchhoff's voltage law, and Kirchhoff's current law to solve combination AC circuits using phasor analysis. Also covers include series and parallel resonant frequencies, harmonics, filters, and time constants. Uses oscilloscopes and meters during lab activities to apply concepts learned during class. Credit may be earned in SKET 120 or"
SKET 107,Applied Electricity II, 2,"Furthers the study of electrical applications. Provides an in-depth study of frequency, peak-effective-average voltage, inductance, capacitance, three phase power, resistive circuits, coils, capacitors, lost power, and power factor correction."
SKET 106,Applied Electricity I, 3,"Covers basic fundamentals of electricity that include introductory schematic symbols and basic electrical circuits, Ohms law, power formulas, series and parallel circuit rules, combination circuits, magnetism, capacitance, inductance and reactance in electrical DC and AC circuits. Applies the above fundamentals to electrical circuits and electrical schematics; calculate voltage, current, resistance and wattage as they apply in an electrical circuit; interpret electrical problems on the refrigeration or heating unit. Uses the multi meter as an Ohmmeter, as a voltmeter, and as an amp meter. Credit may be earned in one of the following:"
SKET 110,DC Circuits, 2,"Introduces the basic concepts of electricity as it applies to DC circuits. Explains the basic structure of the atom and electron theory. Reviews batteries and other sources of electricity. Explains the schematic symbols for devices used in DC circuits. Determines the total resistance for series and parallel combinations of resistors. Uses Ohm's law, Kirchhoff's voltage law, and Kirchhoff's current law to solve combination DC circuits. Explains the design and application of a Wheatstone bridge. Uses meters during lab activities to apply concepts learned during class. Credit may be earned in SKET 110 or"
SKET 100,Electrical Calculations, 2,"Provides a foundation in the comprehension and analysis of computational skills required for the electrical field of study. Discusses scientific notation, metric prefixes, unit conversion, ratios, algebraic equations, right triangles, scalars, vectors, and graphing. Analyzes the sine wave by identifying characteristics that define the signal. Explains phasor representation of sine waves through the comparison of leading and lagging signals. Accomplishes addition and multiplication of phasors through the use of polar to rectangular conversions or right triangle calculations. Emphasizes entering calculations into a scientific calculator. Credit may be earned in SKET 100 or"
SKEL 138,Lineworker Level I, 6,
SKEL 134,Lineworker Climbing Techniques, 5,"Provides participants with the basic knowledge and pole climbing skills necessary to progress through the Lineworker/Electrical Utility Program. Student is responsible for climbing equipment, tools, and foul weather gear as required. Cost may exceed $200."
SKEL 136,Utility Worker Training, 5,Provides participants with the basic Ground Worker/Utility Worker knowledge and skills necessary to progress through the Lineworker/Electrical Utility Program.
SKEL 122,Advanced Controls II, 4,"Present students with basic concepts and hands-on experience with programmable digital control systems. Emphasis placed on hardware, program (software) entry, R-T-C math, documentation, trouble-shooting, communication links (generic) and peripheral equipment."
SKEL 131,AC/DC Machinery, 3,"This course is one in a series of courses on conventional industrial controls. Topics include physics of electromotive forces, armature reaction, induction, DC generator types, AC generators, DC motors, DC motor starters, transformers, AC motors and variable speed drive systems."
SKEL 121,Advanced Controls I, 5,"Topics include: vacuum and vapor tubes, resistance welding controls, induction heating, motors, inverters, polyphase rectifiers, op-amps transducers, instrumentation, closed loop controls, servo systems, temperature controls, troubleshooting."
