code,title,credit,description
ENG 111A,Writing Methods/College Composition I, 3,"Develops fluent, effective, and confident writers. Practices the process of composing; generating ideas; shaping and evaluating writing. Uses reading and language awareness to further the development of their writing. This course will transfer to universities and partially fulfill the college's English composition requirement. Credit may be earned in onlyone of"
ENG 105W,English as a Second Language, 5,"Aids the speaker of English as a second language with intermediate and advanced English language skills to communicate in academic and social settings. Includes speaking, listening, reading, composition, non-verbal communication and American culture."
ENG 111C,Writing Methods/College Composition I, 3,"Develops fluent, effective, and confident writers. Practices the process of composing; generating ideas; shaping and evaluating writing. Uses reading and language awareness to further the development of writing. This course will transfer to universities and partially fulfill the college's English composition requirement. ENG 111C is intended to only be taken in a learning community combination. Credit may be earned in only one of:"
ENG 104W,Applied Spelling Techniques, 2,Emphasizes English spelling patterns and sequences as well as techniques for approaching spelling for adult learners. Shows students how to apply critical thinking strategies to identify and meet their individual spelling needs.
ENG 111,College Composition I, 3,"Develops fluent, effective, and confident writers. Practices the process of composing; generating ideas; shaping and evaluating writing. Uses reading and language awareness to further the development of writing. Credit may be earned in only one of: ENG 111,"
EGR 290-299,Special Projects in Engineering,,
EGR 320,Mechanics of Materials, 3,"Considers effects of tension and compression, shear, torsion, bending and buckling loads on structures and machine members and their consequent effects on stress distributions and deformations. Emphasizes design as well as analysis."
EGR 221,Engineering Materials, 3,"Introduces material classification based on their structure, properties and performance in various applications. Examines the micro and macro structures of metals, polymers, glasses, ceramics and composites and their structural relationship to their properties and performance in various applications Focuses on phase diagrams, microstructural changes caused by solid-state transformations, elastic and plastic behavior, the effects of the environment, and application selection criteria."
EGR 235,Circuit Analysis, 4,"Studies simple electrical components, rules, theorems and laws applicable to AC and DC circuits. Applies Kirchoff's laws, Thevenin's and Norton's theorems, superposition, current and voltage divider rules, etc., Introduces circuit design techniques further study in transient circuits and three-phase power systems."
EGR 216,Engineering Mechanics: Dynamics, 3,"Aims at students needing a second course in mechanics for engineers. Covers kinematics and kinetics of particles and rigid bodies in 2D and 3D. Uses force/acceleration, energy and momentum methods and applications to machine elements and structures in mechanical engineering."
EGR 215,"Engineering Mechanics, Statics", 3,"Develops skill in analyzing machine elements and structures, which are in static equilibrium. Solves forces and moments in 2D and 3D problems using vector calculus, integration, and algebra/trigonometry techniques. Includes concepts of centroids and moments of inertia and applies to mechanical linkages, disks and shafts, beams in bending, screw threads, trusses, frames, and vehicles."
EMS 290-299,Special Projects in Emergency Medical Service,,
EGR 101,Engineering Design and Analysis, 1,"Applies critical thinking concepts to engineering problem solving strategies. Uses student work teams to solve a problem or develop a design on paper using the engineering design process. Uses research techniques on the Web or library, brainstorming for idea generation, criterion selection, and presents information in an oral and written format."
EGR 165,Introduction to Engineering Graphics, 4,"Studies the graphic language applied to mechanical and civil engineering design. Develops skills in orthographic projection, multi-view drawings, isometric drafting, sectioning, auxiliary views, revolutions, developments, ANSI dimensioning, and tolerancing, annotation and descriptive geometry. Uses computer-aided drafting and analysis. Credit can be earned in EGR 165 or"
EGR 100,Careers in Engineering, 1,"Studies Engineering as a profession as well as a career. Surveys the various fields such as Mechanical, Electrical, Civil, etc. Compares an engineer with a technologist. Reviews work responsibilities, ethics, the work environment, challenges, salaries. (15-0)"
EGR 166,Engineering Graphics, 4,"Studies the engineering graphic language applied to mechanical design, review of multiview and isometric drafting, and the geometry of drawing. Develops skills in using orthographic projections, sectional views, auxiliary views and revolutions. Applies dimensioning to gears, bearings, fasteners, cams, etc. Uses computer-aided methods in drafting and analysis for all topics studied. Credit can be earning in EGR 166 or"
EMS 113,Basic Emergency Medical Technician Field Experience, 2,"enables the student to apply for and take the National Registry exam to qualify for state licensing as a Basic EMT. To successfully pass this course, the student will be required to successfully complete the National Registry exam and obtain a state license. Fees for this exam and license are the responsibility of the student."
EMS 112,Basic Emergency Medical Technician III, 2,"Third in a sequence of four courses to prepare a student as a Basic EMT. Emphasizes bandaging, splinting, backboarding concerning injuries to the head & spine as well as musculoskeletal systems. To successfully pass this course, the student will be required to successfully complete the national registry exam and obtain a state license. Fees for this exam and license are the responsibility of the student."
EMS 111,Basic Emergency Medical Technician II, 4,"Second in a sequence of four courses to a prepare student as a Basic EMT. Emphasis is placed on recognition and management of environmental and medical emergencies; verbal, written and radio communications; triage, emergency childbirth; and pediatric emergencies. To successfully pass this course, the student will be required to successfully complete the national registry exam and obtain a state license. Fees for this exam and license are the responsibility of the student."
EMB 290-299,Special Projects in Electronic Media Broadcasting,,
EMS 110,Basic Emergency Medical Technician I, 4,"First in a sequence of four courses to prepare a student as a Basic EMT. Emphasis is placed on Emergency Medical Care, Medical/Legal/Ethical issues, didactic material including airway management, Patient Assessment, and general pharmacology. To successfully pass this course, the student will be required to successfully complete the national registry exam and obtain a state license. Fees for this exam and license are the responsibility of the student."
EMB 290,Production of Informational Videos, 3,"Refines and utilizes skills gained in Media Production I, II, and III with further instruction to produce, direct and post-produce specific, finished multimedia productions in the form of informational videos for specific clients or organizations. Emphasizes producing and directing and production skills to maximize effectiveness. Produces, directs and post-produces multimedia productions in the form of informational videos, including audio and video components, with specific outcomes for specific uses and audiences."
EMB 285,Directing for Public Broadcasting TV, 2,"Provides advanced, practical experience through Delta College's Public Broadcasting facilities. Gives opportunities to direct and assist with productions of on-air broadcast programs."
EMB 282,Electronic Media Broadcasting Internship II, 2,Provides advanced hands-on experience through internship with approved off-site electronic media company or organization. Requires 10 hours per week under direct supervision of onsite internship coordinator.
EMB 284,Producing for Public Broadcasting TV, 2,"Provides advanced, practical experience through Delta College's Public Broadcasting facilities. Gives opportunities to produce and assist with productions of on-air broadcast programs."
EMB 283,Electronic Media Broadcasting Internship III, 3,Provides advanced hands-on experience through internship with approved off-site electronic media company or organization. Requires 15 hours per week under direct supervision of onsite internship coordinator.
EMB 281,Electronic Media Broadcasting Internship I, 1,Provides advanced hands-on experience through internship with approved off-site electronic media company or organization. Requires 5 hours per week under direct supervision of onsite internship coordinator.
EMB 277,EMB Portfolio, 2,"with a grade of “C” or higher. Creates digital media portfolios of original work and traditional resume materials for delivery via DVD, Web, and social media. (10-20)"
EMB 279,Advanced Post Production, 3,". Expands the student’s knowledge and skill in non-linear video editing. Introduces advanced digital multimedia compositing and editing techniques and industry standard technologies, such as Apple’s Final Cut Pro, Motion, and Adobe After Effects, while providing an overview of the artistic nature of digital compositing. Students will complete a variety of advanced, individual digital video and compositing projects."
EMB 252,Studio Productions II, 2,"Promotes advanced level skills in professional television studio production method operations and equipment, switchers, lighting and related hardware with emphasis on communication utilizing visual and aural mediums. Concentrates primarily upon accelerated lighting and switching techniques, producer procedures and practices, director techniques and responsibilities, and the live broadcast of a scheduled production."
EMB 229W,"Women, Minorities, and the Media", 3,"Prerequisites: Any College Composition I course or higher with a grade of “C” or higher. Examines the depiction of women and minorities in the mass media in contexts including television, film, print, and the Web. Studies media portrayal, employment, ownership, and access. Explores the individual and societal consequences of media representation. (45-0)"
EMB 211W,Writing for Broadcast & New Media, 3,"Introduces and familiarizes the specialized writing styles in radio, TV, cable, new media and corporate/non-profit production. Includes, but is not limited to, news, promotional announcements, sports and advertisements. Emphasizes and analyzes various writing styles employed in the commercial, non-profit and corporate world and demonstrates that style through frequent writing."
EMB 255W,Media Production III, 4,"with “C” (2.0) minimum grade. Refines and utilizes skills gained in Media Production I and II with further instruction to produce and direct finished multimedia productions. Emphasizes producing and directing skills to maximize effectiveness. Produces and directs multimedia productions, including audio and video components, with specific outcomes for specific uses and audiences. Uses Television Studio and Computer labs. (60-30)"
EMB 227,Broadcast Sales, 3,"Explores basic marketing concepts in broadcast time and spot sales. Analyzes the psychological, sociological, economic, and communicative aspects of salesmanship as they apply to the broadcast industry. Prepares actual sales presentations for hypothetical clients. Brings practicing professionals in the broadcast sales field to share their experiences with the class."
EMB 175W,Genres in Film History, 3,"Examines major film styles and genres prevalent through the history of American cinema. Discusses groundbreaking works and popular film styles and analyzes their production values, editing techniques and influences on later films and other media. Researches individual directors and films and presents written critical analysis of technical and influential contributions to filmmaking."
EMB 164,Digital Imaging for Video Editors, 2,"Promotes fundamental digital imaging techniques and concepts in the preparation and development of computer graphic images specifically for video editing purposes. Concentrates on an understanding of the components of digital images, nondestructive editing tools, text and graphic preparation, image repair, color correction, and background creation to support completed video projects. Course will primarily utilize most current professional digital imaging applications."
EMB 161,"Podcasting, Online, and Mobile Media", 2,"Introduces and familiarizes student with basic elements and theories of alternative/online forms of multimedia delivery, including audio and video podcasting, mobile media devices, media enhanced blogging and media delivery through video sharing and social networking sites such as YouTube and Facebook."
EMB 154,Peripheral Multimedia Applications, 2,"Introduces and familiarizes student with operational elements of digital media, computer operating systems/platforms and peripheral multimedia applications which support and enhance digital non-linear video editing. Concentrates primarily on audio soundtracks, animated text, graphic design and proper compression for delivery to a variety of digital mediums. Emphasizes specific programs within the Macintosh OSX system."
EMB 155,Media Production II, 4,". Expands the knowledge and skill in composition of images and media, and integration of that media into finished productions. Introduces digital multimedia production, specifically Macintosh Computer systems and Final Cut Pro non-linear editors. Uses both studio and computer editing facilities to refine both audio and video production skills to develop and execute productions. Uses Television, Radio, and computer labs."
EMB 152,Studio Productions, 2,"Introduces basic television studio production methods and equipment, video cameras, switchers, audio boards, lighting and related hardware. Emphasizes developing comprehension of communication using visual and aural mediums through hands-on learning in professional studio environments. Introduces the basic production skills necessary for developing media projects. Uses television labs and studios to instruct students in basic elements in video and audio acquisition and studio production."
EMB 153,Broadcast Performance, 3,"Introduces students to broadcast performance. Emphasizes presentations before microphones and cameras. Examines dress, movement, make-up, lighting, and delivery in such major performance situations as interviews, discussions, newscasts, commercials, and product demonstrations."
EMB 151,Media Production I, 3,"Introduces basic video production methods and equipment, including non-linear editors, video cameras and supporting hardware. Emphasizes developing comprehension of communication using visual and aural mediums, and the variety of media types and formats available. Introduces the basic production skills necessary for developing media projects. Uses Television Labs, Studios and equipment to instruct students in basic elements of video and audio acquisition and production."
ET 164,Robotics Electrical Service & Troubleshooting, 3,"Identifies the electrical components of robots, theory of operation. Introduces proper troubleshooting procedures for the robot controller and manipulator. Approximately 50 percent of the course is hands-on troubleshooting of actual robot system and controller. Credit may be earned in ET 164 or"
ET 140,Motor Controls and Drives, 4,"Applies the basic principles of control circuits to an intermediate study of DC motors, AC motors, and servo motors. Performs armature reaction, CEMF, and basic motor calculations. Analyzes motor control including starting requirements, forward/reverse control, and sequencing of motors. Emphasizes the extension of motor control to drive systems including SCR armature control, field weakening, Pulse Width Modulation, and Variable Frequency Drives. Explains principles of drive operation, set-up, calibration, and troubleshooting in lecture and applies in laboratory exercises. Credit may be earned in"
ET 162,Industrial Robotics I, 3,"Studies modern industrial robotic systems. Introduces the operation, use and safety of industrial robots. Includes feedback mechanisms, actuators, sensors, power supplies, micro-controllers, P.C. computer control and programming. Emphasizes a hands-on approach to system analysis, critical thinking, solution to open-ended problems, computer usage, and teamwork. Credit may be earned in ET 162 or"
ET 136,Grounding, 2,"Develops competency in the comprehension and application of the National Electrical Code (NEC) as it applies to the effective grounding and bonding of electrical devices, equipment, and systems. Examines how to properly read and interpret the NEC tables and how to properly calculate the size of the conductors for the application. Credits may be earned in ET 136 or"
ET 134,Transformers, 2,"Principles of transformers are discussed and applied to single phase transformers, three phase transformers, wye and delta connections, and isolation transformers. This course develops competency in the understanding and application of the National Electrical Code (NEC) as it applies to transformer installations. Calculations for turns ratio, voltage ratio, and current ratio are used to determine circuit relationships between voltage and current."
ET 130,Conventional Controls, 3,"Identifies control devices commonly used throughout industry and relates each device to the proper symbol that is used in the electrical drawings. Develops a thorough comprehension for the devices by describing the proper operation of a control circuit that is comprised of various components that are integrated together. Applies the subject material from lecture in the laboratory through the use of electro-pneumatic training boards. Uses drawings to construct control circuits, analyze the process, make revisions to wiring or set-up configurations, as necessary, and evaluate the proper operation of the control circuit. Credit may be earned in"
EDU 399W,Using Classroom Assessment Techniques, 2,Introduces classroom assessment techniques (CAT's) and their use across disciplines. Develops and applies a variety of CAT's to formatively assess different types of learning and student development. Includes investigation and development of CAT's as tools for classroom research. Credit may be earned in ED 399 or EDU 399W but not both.
ET 122,Programmable Logic Controllers, 5,"and applies the concepts learned to Programmable Logic Controller (PLC) systems. Includes hardware topics installation procedures, wiring diagrams, system architecture, and I/O modules and software topics basic logic elements, timers, counters, program control, math functions, data manipulation, sequencers, shift registers, and file/word transfers. Includes lab activities utilizing RSLogix and RSLinx software for creating, editing, saving, downloading, and uploading programs. Applies subject material from lecture in the laboratory through the use of PLC training systems. Uses drawings to construct control circuits, analyze the process, make revisions to wiring or set-up configurations as necessary, and evaluate the proper operation of the PLC circuit. Credit may be earned in"
ET 100,Electrical Calculations, 2,"Provides a foundation in the comprehension and analysis of computational skills required for the electrical field of study. Discusses scientific notation, metric prefixes, unit conversion, ratios, algebraic equations, right triangles, scalars, vectors, and graphing. Analyzes the sine wave by identifying characteristics that define the signal. Explains phasor representation of sine waves through the comparison of leading and lagging signals. Accomplishes addition and multiplication of phasors through the use of polar to rectangular conversions or right triangle calculations. Emphasizes entering calculations into a scientific calculator. Credit may be earned in"
ET 120,AC Circuits, 2,"Introduces the basic concepts of electricity as it applies to AC circuits. Explains inductance, capacitance, and the phasor relationships between electrical signals. Explains the schematic symbols for devices used in AC circuits. Determines the total impedance for series and parallel combinations of resistors, inductors, and capacitors. Uses Ohm's law, Kirchhoff's voltage law, and Kirchhoff's current law to solve combination AC circuits using phasor analysis. Also covers include series and parallel resonant frequencies, harmonics, filters, and time constants. Uses oscilloscopes and meters during lab activities to apply concepts learned during class. Credit may be earned in"
EDU 399AW,Classroom Assessment Techniques, 0.5,Introduces classroom assessment techniques (CATs) and their use across disciplines. Develops and applies a variety of CATs to formatively assess different types of learning and student development. Credit may be earned in ED 399AW or EDU 399AW but not both.
EDU 398W,Writing to Learn, 1,"Introduces theory and practice of “writing to learn,” (WTL) including informal writing strategies to promote student response to lectures, readings, fieldwork, labs, discussions, etc.; rehearsal for other activities including discussions and formal writing; reflection on learning progress and problems; and dialogue with peers and instructor. Credit may be earned in ED 398 or EDU 398 but not both."
ET 110,DC Circuits, 2,"Introduces the basic concepts of electricity as it applies to DC circuits. Explains the basic structure of the atom and electron theory. Reviews batteries and other sources of electricity. Explains the schematic symbols for devices used in DC circuits. Determines the total resistance for series and parallel combinations of resistors. Uses Ohm's law, Kirchhoff's voltage law, and Kirchhoff's current law to solve combination DC circuits. Explains the design and application of a Wheatstone bridge. Uses meters during lab activities to apply concepts learned during class. Credit may be earned in"
EDU 397,Introduction to Distance Learning, 3,"Teaches strategies for distance education technology, with particular emphasis on instructional design, two-way interactive television (ITV), for application in any field. Credit may be earned in ED 397 or EDU 397 but not both."
EDU 396W,Facilitating Developmental Learning, 2,"Explores the process of assisting students in advancing from under-prepared to college-ready. Examines instructional methods conducive to promoting, developing, and sustaining student learning and success throughout the college curriculum. Synthesizes theory with best practices applicable to a variety of disciplines and learning levels. Credit may be earned in only one of the following:"
EDU 394W,Theory and Pedagogy of Learning Communities, 2,"Examines (in classroom seminars and by on-line listserv) learning communities theories and models, including concepts of interdisciplinary and community. Includes participation in on-line listserv interactive journaling about course readings and a capstone project to prepare a syllabus, one or two possible assignments, and at least one means of assessment for a proposed learning community. Designed for faculty, future teachers, and administrators. Credit may be earned in ED 394 or EDU 394 but not both."
EDU 396PW,Facilitating Developmental Learning with project, 3,"Explores the process of assisting students in advancing from under-prepared to college-ready. Examines instructional methods conducive to promoting, developing, and sustaining student learning and success throughout the college curriculum. Synthesizes theory with best practices applicable to a variety of disciplines and learning levels. Course includes individual project. Credit may be earned in only one of the following: ED 396P, ED 396, EDU 396PW, or"
EDU 395W,Introductory Theory and Methods of Reading Across Disciplines, 1,"Introduces theory and practice of reading across disciplines including theories of reading development and strategies improving reading. Student may earn credit in only one of the following: ED 395, ED 395R, EDU 395W or"
EDU 394IW,Development of Learning Community Interest Groups, 3,"Examines learning communities theories and models most closely resembling Interest Groups (often called Freshman Interest Groups and Clusters at other institutions). Discusses concepts of interdisciplinarity, community, and continuing development and evaluation of Interest Groups both individually as separate learning communities and collectively as a distinct identity. Includes participation in on-line interactive journaling about assigned and recommended readings. Develops a capstone project to plan an interest group learning community. Credit may be earned in ED 394 or EDU 394 but not both."
EDU 395RW,Introductory Theory and Methods of Reading Across Disciplines - Research Option, 2,"Introduces theory and practice of reading across disciplines including theories of reading development and strategies improving reading. Provides instruction and support in researching content area reading in individual disciplines. Leads to development of annotated bibliography about reading process and pedagogy in their discipline. Student may earn credit in only one of the following: ED 395R, ED 395, EDU 395RW or"
