code,title,credit,description
MGT 247,Principles of Retailing, 3,"Discusses store location, organization structure, and retail personnel management in detail. Presents merchandising policies and budgets, and buying and pricing merchandise. Presents in some detail retail advertising, personal selling, customer services, and loss prevention. Discusses the scope of the retailing industry, requirement of retail management as well as careers in retailing."
MGT 243,Principles of Marketing, 3,"Provides an understanding and interpretation of the marketing system and its importance in the economy and the place of the marketing function in business management. Establishes a basic understanding of the psychological, environmental, and managerial functions and presents processes that are employed in contemporary marketing."
MGT 152,Textiles, 3,"Studies natural and man-made fibers, their properties and unique characteristics. Identifies fabrics used in wearing apparel and interior design; fabric production, performance and use; final processes and finishes; the study of weaves, pattern and color."
MGT 151,Visual Merchandising, 3,"Explores display as a major component of sales promotion. Studies color and basic design principles in terms of their application to display. Analyzes functions, types, and tools of display. Designs and coordinates windows and interior displays. Covers steps in planning and coordination sales promotions. Emphasizes planning, producing and evaluating effective visual displays."
MGT 145,Principles of Sales, 3,"Emphasizes the marketing concept and the importance of personal selling for those engaged in the marketing of products, services or ideas. Includes an analysis of the steps in a sales proposal. Classroom presentations by students required."
MGT 110,Business Mathematics, 3,"Covers principles necessary for an understanding of math of the business world. Includes various methods of computing interest and bank discounts; installment buying; F.I.C.A. Federal Income Taxes and other payroll deductions; markup, cost and selling prices; various wage payment systems; sales and property taxes; insurance; measures of central tendency; and an introduction to the metric system."
MGT 245,Principles of Management, 3,"Discusses theories of management practices and explains fundamentals of administrative, executive, and staff management. Emphasizes the management functions of planning, organizing, directing, controlling, as well as preparation of information required for decision making. Covers the analysis of management problems and the synthesis of solutions."
MGT 143,Principles of Advertising, 3,"Provides a broad view of advertising from the marketing and consumer point of view. Historical background, economic and social aspects, roles of advertising, advertising stages, target marketing, media, using selected behavioral science information in advertising, and obtaining proper advertising appeal are included."
MS 290-299,Special Projects in Machine Tool Operations,,
MS 190,Precision Grinding-Cylindrical Surface, 3,"Instructs on proper selection and operation of precision cylindrical surface grinding machines. Selects proper grinding wheels, grinding machine and work holding devises for a variety of OD/ID grinding operations. Grinds previously machined and heat treated projects from prerequisite course."
MS 230,Machine Tools III, 4,"Trains in advanced set up and operation of various metal working machines to construct projects from engineering drawings. Trains in use of a variety of measuring instruments to take measurements of one ten thousandth of an inch or closer. Utilizes safety, materials, hand tools, precision measuring instruments, lathes, mills, flat surface grinders OD and ID surface grinders. Emphasizes jigs, fixturing, part location, speeds and feeds."
MS 181W,Machine Tools I, 4,"Introduces the manufacturing facility. Utilizes safety, materials, hand tools, precision instruments, drill presses, lathes, mills, pedestal grinders, and saws. Studies fundamentals and procedures to provide an understanding of manufacturing processes. Demonstrates greater knowledge of machine tool practices and applies that knowledge to educate others. Credit may be earned in MS 114, MS 181W or"
MS 182,Machine Tools II, 4,"Trains in the set up and operation of various metal working machines and construction of projects from engineering drawings. Trains in use of a variety of measuring instruments to take measurements of one thousandth of an inch or closer. Utilizes safety, mills, lathes, drill presses, saws, grinders, speeds and feeds to complete duty and task list. Credit can be earned in MS 130, MS 182 or"
MS 113,Introduction to Machining Processes, 2,"Introduces the manufacturing facility. Utilizes safety, materials, hand tools, precision instruments, drill presses, lathes, mills, grinders, and saws. Credit may be earned in MS 113 or"
MS 120,Machinery’s Handbook, 3,Focuses on learning how to use and understand the Machinery’s Handbook. Credit may be earned in either MS 120 or
LWT 290-299,Special Projects in Lifelong Wellness Theory,,
MS 185,Precision Grinding-Flat Surface, 3,"Instructs on proper selection and operation of precision flat surface grinding machines. Selects proper grinding wheels, grinding machine and work holding devises for a variety of grinding operations. Grinds previously machined and heat treated projects from prerequisite course."
LWT 260,Health Fitness Experience, 5,"Introduces Health Fitness Education and Promotion students to ""on the job"" experiences within the Health Promotion field. Includes exercise prescription, health education, health promotion administration and program development in the 300-hour internship experience. Students must have current CPR certification."
LWT 255,Health Fitness Management and Promotion, 3,"Introduces and explores the different and interesting settings in which health and fitness educators practice and the job responsibilities and opportunities within each of those settings. Emphasizes application, skill development, and professional identity and direction in health promotion occupations."
LWT 253,Ergogenic Aids in Sport, 2,"Explores substances and phenomenon that claim to improve sport performance. Discusses the purported effects, proven benefits, and risks of various ergogenic aids.Debates and discusses the ethical questions that surround using performance enhancing substances."
LWT 231W,Introduction to Athletic Training, 3,"Introduces students to the roles, responsibilities, and qualifications of a Certified Athletic Trainer (A.T.C.). Provides an overview of the basic knowledge and skills possessed by an A.T.C. including their role in the sports medicine team, nutrition, injury prevention, assessment, and treatment, as well as learning to identify emergency situations and provide direction for their management."
LWT 252,Environmental Physiology - The Limits of Human Performance, 3,"Emphasizes the physiological responses of the human body to acute and chronic bouts of varying environmental conditions. Presents the study of physiological responses to hot and cold environments, altitude, underwater and microgravity environments, and the effect of air quality on human performance."
LWT 251,Exercise Physiology, 4,"Emphasizes the physiological responses of the human body to acute and chronic bouts of exercise. Presents the study of health/fitness appraisal, exercise prescription, quantifying the energy cost of work (physical activity), identifying physiological and psychological responses to exercise, and the administration of exercise programs to diverse populations. Credit may be earned in BIO 251 or LWT 185 but not both."
LWT 230,Theory of Strength and Conditioning, 3,"Explores a variety of strength training principles and theories through the study of multiple exercise modes including free and machine weights, plyometrics, speed and agility, and cardiovascular training. Discusses specific anatomy and physiology, as well as exercise guidelines, in preparation for program development."
LWT 214,Techniques and Applications of Health Fitness Equipment, 2,"Explores a variety of Health Fitness equipment and apparatus through practical application and experience, including but not limited to dumbbells, medicine balls, stability ball, BOSU ball, resistance tubes, body bars, foam rollers, heavy ropes, body weight, selectorized machines, free weights, and plyometric boxes, Discusses specific anatomy, safe technique, modifications as well as exercise guidelines in preparation for personal training."
LWA 158,Pilates, 1,"Provides total body strengthening, stretching, and conditioning through Pilates-based mat work to achieve overall fitness and improved health. Focuses on the attainment of core strength in the abdomen and trunk. Includes specific exercises concentrating on the use of breathing patterns to help control movement, and visual imagery to engage the mind and body together. Credit may be earned in LW 158 or LWA 158 but not in both."
LWT 242,Group Fitness Instructor, 4,"Introduces the skills and knowledge needed to become a certified Group Fitness Instructor. Includes how to screen and evaluate prospective clients, design safe and effective exercise programs, instruct clients in correct exercise techniques to avoid injury, and respond to the typical questions and problems that arise in a group exercise setting."
LWT 213W,Vitamins Minerals and Health, 3,"Studies the various rating systems for the daily intake of vitamins; functions and uses of specific vitamins, minerals and other key supplements; signs of deficiency for specific nutrients; and recommends amounts of specific nutrients for average people and individuals with specific needs."
LWA 157,Step Aerobics, 1,Incorporates bench stepping to enhance cardiorespiratory endurance and muscle tone using the aerobic principle. Emphasis on the importance of fitness and a healthy lifestyle is also applied. Credit may be earned in LW 157 or LWA 157 but not in both.
LWT 240,Health Fitness Instructor/Personal Trainer, 4,"Introduces the skills and knowledge needed to become a certified personal trainer. Covers how to screen and evaluate prospective clients, design safe and effective exercise programs, identify physiological and psychological response to exercise, promote lifestyle behavior modification, quantify the energy cost of work (physical activity), and communicate effectively. Includes self-employment issues as well as legal issues."
LWA 152,Astanga Yoga, 1.5,"Introduces the basic tools used in learning Astange Yoga. Uses sequential postures, called asana, for linking together a vigorous flow of movements. Includes workout that is physically, spiritually, and mentally engaging. Credit may be earned in LW 152 or LWA 152 but not in both."
LWA 151,Kick Boxing, 1,"Presents Kick Boxing as a means of self-defense and conditioning. Provides maximum cardiorespiratory benefits, muscular endurance, speed, and agility in addition to balance, flexibility, and mind/body integration. Credit may be earned in LW 151 or LWA 151 but not in both."
LWA 153,Dance Aerobics, 1,"Provides information and skills needed to assess and improve fitness through the use of aerobic dance, exercises to music, and analysis of personal nutrition habits. Credit may be earned in LW 153 or LWA 153 but not in both."
LWA 124,Basketball, 1,"Introduces basic skills of passing, dribbling, shooting, positional play, rules, and strategy of the game. Includes special conditioning to improve individual wellness. Credit may be earned in one of the following ONLY: LWA 124, LW 123, LW 124, or LW 125."
LWA 150,Kettlebell Training, 1,"Introduces Kettlebell training concepts. Presents, develops, and practices Kettlebell training methods for muscular strength and endurance. Pre and post fitness assessment testing will be done and individual printouts will be made available."
LWA 131,Racquetball I, 1,"Introduces basic skills and rules necessary to participate in racquetball which is a competitive game played in a four-walled court by two, three, or four players using stringed racquets to serve and return the ball. Credit may be earned in LW 131 or LWA 131 but not in both."
LWA 127,Volleyball I, 1,"Introduces basic skills of handling the ball, passing, setting, spiking, net-rebound play, and blocking. Includes rules and strategy. Credit may be earned in LW 127 or LWA 127 but not in both."
LWA 156W,Stability Ball Training, 1,"Introduces fitness training concepts utilizing a stability ball. Presents training methods fro improving muscle strength, endurance, and flexibility. Also presents, develops, and practices stability ball activities that provide cardiorespiratory benefits and improved body composition. Provides effective balance training through use of the stability ball as a tool. Pre- and post-fitness assessments will also be performed and results will be explained. Credit may be earned in LW 156W or LWA 156W but not in both."
LWA 122,Fencing I, 1,"Introduces foil fencing, its basic fundamentals, techniques, rules, and safety measures. Credit may be earned in one of the following ONLY: LWA 122, LW 122, LW 201, or LEA 201."
LWA 154W,BOSU Ball Training, 1,"Introduces fitness training concepts utilizing a BOSU ball. Presents training methods for improving muscle strength, endurance, balance, agility, and flexibility. Presents, develops, and practices BOSU ball activities that provide cardiorespiratory benefits and improved body composition. Pre- and post-fitness assessments will also be performed and results will be explained."
LWA 118,Sports Judo, 1,"Introduces the rules, skills, and courtesies in sports judo, as well as the special conditioning required. Credit may be earned in one of the following ONLY: LWA 118, LW 117, LW 118, or LW 119."
LWA 119,Jiu-jitsu, 1,Introduces the fundamental movements of Jiu-jitsu. Provides opportunity in sport specific strength and conditioning. Pre- and post-fitness assessment testing will be administered.
LWA 115,Aikido, 1,"Provides an introduction to a non-aggressive martial art stressing use of spiritual energy, self-cultivation, mutual respect, and skills of self-defense. Credit may be earned in LW 115 or LWA 115 but not in both."
LWA 114,Tae Kwon Do II, 1,Provides an opportunity to utilize advanced techniques in a non-contact martial art class at the intermediate level. This course is mainly designed for yellow stripe through sixth gup color belts. Credit may be earned in LW 114 or LWA 114 but not in both.
LWA 110,Jogging For Fitness, 1,"Introduces jogging as a means to obtain or improve current levels of health or conditioning. Emphasizes jogging to impact cardiorespiratory health. Uses aerobic endurance activities involving training techniques, skilled pacing, weights, calisthenics, proper stretching, and nutritional information to provide a complete exercise program. Credit may be earned in LW 110 or LWA 110 but not in both."
LWA 108,Weight Training, 1,"Introduces a systematic program of body conditioning and development through the use of weight exercises to improve individual wellness. Credit may earned in only one of the following: LWA 108, LW 107, LW 108, or LW 109."
LWA 111,Circuit Training, 1,"Maintains and improves physical fitness levels. Uses weights, calisthenics, and endurance exercises in different combinations to provide complete workouts in a limited amount of time. Credit may be earned in LW 111 or LWA 111 but not in both."
LWA 106,Athletic Conditioning, 1,"Designed to improve current level of fitness. Uses weight, circuit, plyometric, and endurance exercises to improve power, balance, and agility. Incorporates the five health-related components of fitness: cardiorespiratory endurance, muscle strength and endurance, flexibility, and body composition. Credit may be earned in LW 106 or LWA 106 but not in both."
LW 290-299,Special Projects in Lifelong Wellness,,
LW 221W,Fitness and Wellness, 2,"Promotes understanding and experience of the direct correlation between positive lifestyle habits and wellbeing through a series of classroom lectures that cover a wide variety of wellness topics and disease prevention with application of these concepts through participation in aerobic conditioning, resistance training, diet analysis, and health assessments. Successful completion of LW 221W meets the Wellness graduation requirement."
LW 223W,Wellness in Technical Trades, 2,"Correlates positive lifestyle habits and wellbeing. Covers a wide variety of wellness topics and disease prevention. Applies concepts through participation in aerobic conditioning, resistance training, diet analysis, CPR, AED, & First Aid Training and health assessments. Successful completion of LW 223W meets the Wellness graduation requirement and is highly recommended for all Technical Trades programs."
LW 222,The Science of Nutrition and Exercise, 3,"Presents nutrition science as a key element for optimal living and health. Plans and reviews diets, principles, food nutrients, metabolism, and diet analysis. Evaluates health effects of nutrition. Introduces fitness and wellness principles and integrates with nutrition through various conditioning exercises."
LWA 113,Tae Kwon Do I, 1,"An introduction to non-contact martial arts stressing technique and qualities of respect, self-discipline, and skills of self-defense. Credit may be earned in LW 113 or LWA 113 but not in both."
LW 220W,Lifelong Wellness, 1,Promotes student understanding and experience of the direct correlation between positive lifestyle habits and well being through a series of classroom lectures that cover a variety of wellness topics and disease prevention. Credit may be earned in only one of the following: LW 220W or
LW 206A,Occupational Wellness 1, 1,"Introduces wellness concepts, behavioral patterns, and activities that can be incorporated into the lifestyles of those working in a wide variety of occupational settings."
LIB 290-299,Special Projects in Library Skills,,
LSP 290-299,Special Projects in Legal Support Professional,,
LIB 195W,Library Research Skills, 2,Develops information literacy for success with college-level academic research. Credit may be earned in LIB 195W or
LWA 101,Fitness for Life, 1,Introduces basic concepts underlying fitness and wellness as they relate to optimal healthful living using a wide variety of aerobic conditioning and resistance training techniques. Credit may be earned in LW 101 or LWA 101 but not in both.
LSP 280W,Legal Writing, 1.5,"Develops techniques for presentation of technical material in formal and informal written reports, letters, or other current forms of business communication in a legal context."
LSP 262,Legal Support Internship III, 3,Completion of all Legal Support Professional required courses is highly recommended. Requires one hundred twenty (120) hours of work experience in a law or law-related office.
LSP 261,Legal Support Internship II, 2,Completion of all Legal Support Professional required courses prior to this course is highly recommended. Requires eighty (80) hours of work experience in a law or law-related office.
LSP 240,Domestic Relations, 2,"Studies the theoretical and practical aspects of family law with an emphasis on Michigan family law including dissolution of marriage, child custody, support, property settlements, judgments and the role of the Friend of the Court. Presents basic techniques in obtaining facts from clients in order to prepare and draft complaints, answers, financial affidavits and verified statements."
LSP 250,Corporate Law, 2,"Describes the nature of corporations, partnerships, and proprietorships with an emphasis on the corporate structure including formation and dissolution, amending Articles of Incorporation and by-laws, shareholders’ and directors’ meetings, corporate equity and debt securities, as well as employment and shareholders agreements."
LSP 260,Legal Support Internship I, 1,Completion of all Legal Support Professional required courses prior to this course is highly recommended. Requires forty (40) hours of work experience in a law or law-related office.
LSP 235,Criminal Law and Procedure, 3,"Studies formal legal processes involved in criminal practice from arrest through post-trial motions, sentencing, and appeal. Describes constitutional rights of the accused and the definitions of various criminal offenses. Credit may be earned in LAS 235 or LSP 235 but not in both."
LSP 253,Bankruptcy Law, 3,"Illustrates the legal aspects of the bankruptcy law and demonstrates the practical approach to working in this area. Reviews Federal Bankruptcy Law including different types of bankruptcy chapters, exemptions, dischargeable and nondischargeable debts, preferences, the role of the Bankruptcy Trustee, and preparation of petitions and schedules in bankruptcy. Emphasizes the effective use of the Legal Support Professional."
LSP 230,Civil Litigation, 3,"Studies the analysis, evaluation, and preparation of the various stages of a civil matter for litigation and trial using Michigan Rules of Civil Procedure and Rules of Evidence. Includes an efficient and systematic approach to fact investigation, drafting pleadings, discovery, and file control. Studies the pretrial stages of a lawsuit with emphasis upon trial preparation including motions in limine, witness preparation, and jury voir dire, concluding with trial and post-trial motions."
LSP 220,Environmental Law, 2,"Surveys issues pertaining to environmental law. Emphasizes the process of integrating environmental policies into the social system, implementing environmental policies through the legal system, and accommodating environmental values with economic realities, traditional property rights, and national energy policy. Credit may be earned in LAS 220 or LSP 220 but not both."
LSP 150,Real Estate Law, 2,"Introduces the principles of real estate law. Describes the process and procedures involved in the buying and selling of real estate, mortgage loans and leasing. Examines the legal support professional's role in assisting the lawyer with preparing or evaluating surveys and legal descriptions, deeds of conveyance, title search reports, agreements, closing and leases. Credit may be earned in LAS 150 or LSP 150 but not in both."
LSP 210W,Estate and Trust Administration, 2,"Studies the administration of a decedent's estate from initial conference through the closing of an estate and the distribution of assets. Emphasizes preparation of proper probate documentation, preparation of proper tax returns including federal estate tax returns and fiduciary returns, and explanation of Michigan inheritance tax. Credit may be earned in LAS 210 or LSP 210W but not both."
LSP 110W,Legal Ethics and Responsibilities of the Legal Assistant, 3,"Provides an overview of the various roles, responsibilities, and problems found in Legal Support Professional careers, and the legal ethics, legal terminology, and basic skills needed. Introduces legal forms and procedures, as well as computer skills and computer programs. Places substantial emphasis on the importance of legal ethics for the Legal Support Professional through study of the State Bar of Michigan Rules of Professional Conduct, the Michigan Code of Judicial Conduct, and the National Association of Legal Assistants Code of Ethics and Professional Responsibility. Addresses preparation for the CLA examination, the importance of communication skills, keeping track of deadlines, calendars, and mailing procedures. Credit may be earned in LAS 110W or LSP 110W but not in both."
LSP 115,Principles of Substantive Law, 3,"Introduces the dynamics of the law and legal process, including the origin and development of the law, types of law and the judicial system. Examines substantive legal subjects including contracts, torts, property, criminal and business related subjects. Emphasizes recognition of legal issues and the understanding of legal terminology. Credit may be earned in LAS 115 or LSP 115 but not in both."
LSP 105W,Law Office Management, 1,"Provides an overview of the day to day operations in a legal environment. Addresses various roles, responsibilities, and problems found in the management of a law office or other legal environment. Uses a hands-on approach to address an industry-level working knowledge of a legal business or organization."
SCI 290-299,Special Projects in Interdisciplinary Science,,
SCI 299,Food Science and Nutrition, 3,"Introduces the fundamental concepts in digestion and metabolism at the cellular, organ system and organismal levels (seeds, yeast, gold fish, and plants). Reviews and implements laboratory research techniques involved in quantitative analysis of food ingredients. Explores the following topics: Enzyme kinetics, balanced/healthy diet, physical fitness, popular weight loss programs, and food diversity and society. Includes a field trip to local restaurants."
SCI 249,Scientific Research Development, 1,"Exposure to the process of developing and refining a scientific question as the basis for scientific experimentation. Identification of an area of scientific interest, background knowledge in the field and research methods. Development of a research proposal that involves research and rationale, models of data that will be produced, budgetary evaluation, materials needed, time required and equipment to be used. Beneficial to all science majors in Biology, Chemistry, Physics and Engineering."
LSP 120,Legal Research, 1.5,"Develops legal research techniques for both state and federal case law, statutes and administrative regulations. Emphasizes basic legal reasoning and writing skills for logical, organized problem solving. Familiarizes students with the most frequently used reference materials as well as online, commercially available legal databases including development of search queries. Credit may be earned in LAS 120 or LSP 120 but not both."
