code,title,credit_hours,description
CRIJ 3300,Faith and Justice,3,"Explores the interaction of our country's retributive justice system with our faith's call for justice, 
including examination of justice themes as applied to economic, immigration, trafficking and 
slavery, peacemaking, social, restorative, environmental, prison ministry, civil and voting rights, and 
related justice efforts.

Prerequisites: CRIJ 1301

Corequisites: "
CRIJ 3301,The Faithful Lawyer,3,"Explores the conflict among ethical, moral, and faithful conduct for attorneys licensed by the state, 
the outcomes expected by public and private clients, the vocational stress produced by professional 
demands and boundaries, and our faith's call to do justice, to love mercy, and to walk humbly with 
our God.

Prerequisites: CRIJ 1301

Corequisites: "
CRIJ 3302,Criminal Law,3,"Designed to provide a basic concept of criminal law and to provide legal ground work for those 
who seek to enter the criminal justice system. This course will focus on the impact of statutes and 
case law on criminal justice system practitioners; included are the 4th, 5th, 6th, 8th and 14th 
Amendments as they affect the accused, the convicted, and the employees working in the criminal 
justice system as well as issues of arrest, search and seizure, admittance of evidence and the rights 
of the accused. Serves as a legal update of current changes in the law.

Prerequisites: CRIJ 1301

Corequisites: "
CRIJ 3304,Criminal Investigations,3,"examination of criminal investigation fundamentals including the establishment of a crime scene 
perimeter, unified command, and various methods of crime scene searches, collection and 
preservation of evidence, interviews, interrogation, case preparation, and the familiarization with 
specific instrumentation in crime detection and evidence selection for evidentiary value.  This 
course will also introduce areas of administrative law and its impact on the function of 
bureaucracies and public agencies.

Prerequisites: CRIJ 1301

Corequisites: "
CRIJ 3305,Forensic Science and Criminalistics,3,"Explores forensic science from the biological, chemical, and criminalistics perspective, including 
application from the crime scene to the court process; uses laboratory methods of instruction; 
examines evidence, court procedures, legal and ethical issues, and the role of forensic science in 
the field of criminal justice; and distinguishes appropriate techniques based on crime typology.

Prerequisites: CRIJ 1301

Corequisites: "
CRIJ 3306,Management in Law Enforcement,3,"A study of management functions in a modern criminal justice organization, the internal and 
external environmental factors affecting organizational efficiency, and the application of 
quantitative and behavioral science. The function of the leader and principles of management are 
 
 
viewed from an integrative perspective, including line and staff interactions and relationships. 
Theories of management, authority and responsibility, issues of centralization and decentralization, 
planning, organizing, staffing, directing and controlling will also be studied in the course.

Prerequisites: CRIJ 1301

Corequisites: "
CRIJ 3309,Gangs & Organized Crime,3,"Examines both gangs and organized criminal groups.  Traces the origins and historical development 
of the activities known as ""organized crime”.  Focuses on American gangs, both youthful street 
gangs and militaristic prison gangs with strict hierarchy. Topics include the history of gangs, gang 
and gang member characteristics, gang life, and strategies of gang control. The link between youth 
street gangs, prison gangs, and other deviant collectivities will be explored.

Prerequisites: CRIJ 1301

Corequisites: "
CRIJ 3310,Juveniles in Criminal Justice,3,"An in-depth study of the juvenile justice system. Topics covered are the development of delinquent 
behavior, victimology, initial handling and proper referrals, preventive police techniques, special 
police problems with juveniles, juvenile law, and related juvenile justice agencies.  Plea bargains, 
juvenile probation, restorative vs. rehabilitative models and other best practices in juvenile justice 
will also be discussed.

Prerequisites: CRIJ 1301

Corequisites: "
CRIJ 3311,Criminology,3,"Explores issues such as crime causation and the involvement of the criminal justice and corrections 
systems in these issues.  Provides an analysis of the major criminological theories from the 
predominant “schools” of criminological thought; including the classical theories and rational 
choice; positivism and trait theories, psychoanalytic theories, social structure, social process, and 
social bonds theories.  Particular focus upon the evolution of the theories from the classical and 
positivism schools of thought to the modern choice and trait theories, as well as the evolution of the 
sociological theories. Cross-listed with SOC 3311.

Prerequisites: CRIJ 1301

Corequisites: "
CRIJ 3312,Criminal Profiling,3,"Explore the interwoven biological, psychological and social antecedents and correlates of criminal 
behavior. Psychological issues and their relation to criminal and anti-social behavior will be studied.   
An overview of profiling techniques; provides a definition of the modus operandi and signature 
aspects of serial crimes with a focus on serial rape, arson, and murder investigations and the tactics 
and techniques of using methods of both inductive and deductive reasoning to solve cases which 
pose the greatest threat to both law enforcement and the public.

Prerequisites: CRIJ 1301

Corequisites: "
CRIJ 3313,White Collar Crime,3,"Explores domestic and international white collar crime, agencies tasked with investigating and 
prosecuting white collar crime, applicable criminal laws, underlying sociological and criminological 
theories, the criminals who commit such crimes, and victim impact.

Prerequisites: CRIJ 1301

Corequisites: "
CRIJ 3314,Ethics in Criminal Justice,3,"Presents ethical issues that arise in the three major areas of criminal justice: police, courts, and 
corrections as case studies with discussion of their application. General philosophical theories of 
ethics from both historical as well as biblical accounts will be discussed and an elaboration provided 
about the codes of ethics that operate to control the institutional and personal behavior of police, 
courts and correctional systems.

Prerequisites: CRIJ 1301

Corequisites: "
CRIJ 3316,Victimology and Victim Rights,3,"This course has the dual purpose of looking at the impact of crime upon victims and on our legal 
system, and conducts a brief overview of the crime victim role, criminal-victim relationships (either 
passive or active), and societal reaction to victimization, including crisis-intervention centers, court 
related victim/witness services, restitution and compensation.

Prerequisites: CRIJ 1301

Corequisites: "
CRIJ 3320,Homeland Security,3,"Designed to introduce the student to the scope of issues facing the American public, the private 
sector and law enforcement on securing the country against threats posed by domestic and 
international terrorist groups, students will be given an overview of different terrorist and extremist 
groups to understand their goals, objectives and modus operandi. Threats to American interests 
abroad will be analyzed.  Emphasis will be given to prevention, preparedness, and response. The 
roles of local, state and federal agencies in homeland security and critical infrastructure and key 
resource (CIKR) protection are examined.

Prerequisites: CRIJ 1301

Corequisites: "
CRIJ 3322,Roots of Terrorism,3,"Understanding terrorism as a political crime. Focus is on the historical aspect of terrorism and how 
the use of terrorism as a tool of the weak has evolved from its use by the Jews in Roman times, by 
radical ancient Muslims, and then to its current contextual use by the French, Russian, Irish, and 
Basque movements and finally the modern radical Islamic terrorist groups.  Various methods of 
attack from ancient poisons to modern bombing techniques culminating with the aircraft used 
during the attacks of 9/11 will be compared and contrasted to symmetrical and other asymmetrical 
forms of combat.

Prerequisites: CRIJ 1301

Corequisites: "
CRIJ 3330,Sociology and Psychology of Terrorism,3,"This course helps the student in understanding terrorism as a political crime. The focus includes an 
examination of the sociological and psychological aspects of terrorist behavior; it includes portions 
on the different tactics of terrorism recruitment and attacks as well as the social psychology and 
religious aspects of terrorist group recruiting and formation to give the student a well-rounded 
understanding of the use of terrorism as a tool or tactic.

Prerequisites: CRIJ 1301

Corequisites: "
CRIJ 3335,– Social Science Methods,3,"This course focuses on the use of quantitative and qualitative research methodology that is most 
commonly utilized by social science practitioners. It will emphasize the use of techniques and 
 
 
ethical constructs that are typically employed by those working in social science fields. Cross-listed 
with POLS 3335.

Prerequisites: CRIJ 1301.

Corequisites: "
CRIJ 3377,– Gender & Crime,3,"Gender disparities in contemporary patterns of crime, victimization, and incarceration will be 
explored. Focus will be on key concepts, major theories, and empirical research studies around 
gender and crime.

Prerequisites: CRIJ 1301

Corequisites: "
CRIJ 3388,– Race and Punishment,3,"The social construct of race has played a central part in the inception and dramatic expansion of the 
U.S. criminal justice system over the past 50 years.  This course will explore the causes and 
consequences of this expansion of the carceral state.  The course will examine how race shapes, 
and is shaped by the carceral state by investigating how racialized social systems create inequalities 
in the delivery of punishment historically.

Prerequisites: CRIJ 1301

Corequisites: "
CRIJ 4305,Crime Mapping & Intelligence,4,"An analysis of intelligence techniques and serves as a broad overview of military and crime analysis 
techniques and methodologies.  The fundamental (steps of the analytic process) and philosophies 
beginning with traditional Military Intelligence and the movement that has led to Intelligence Led 
Policing will be discussed.  Uses of analysts and systems to assist in investigations as they examine 
crime patterns and resolve community crime problems will be discussed.  Analytical techniques 
including link diagrams, telephone tolls, and visual investigations will be discovered along with a 
theoretical and practical introduction to the benefits of crime mapping and the spatial analysis of 
crime.

Prerequisites: CRIJ 1301

Corequisites: "
CRIJ 4350,Criminal Justice Capstone,4,"Examines the emerging trends in policing, from Homeland Security and Intelligence Led Policing to 
Crisis Intervention and Community Policing, and balances the theoretical goals of the police with 
their realistic expectations.  Culminates in the development and production of a senior-level 
research paper grounded in relevant criminal justice literature regarding one of those topics. 
Emphasis is placed on the integration of knowledge acquired in previous courses and its practical 
application to problem sets provided throughout the class as projects.

Prerequisites: CRIJ 1301

Corequisites: "
CAI 6320,Curriculum Theory,6,"Examines major curriculum philosophies that have influenced educators within the last century. 
Students will analyze four educational visions (Scholar Academic, Social Efficiency, Learner 
Centered and Social Reconstruction). Students will reflect on their personal educational 
philosophies.

Prerequisites: None

Corequisites: "
CAI 6321,Strategies for Professional Development,6,"Designed to engage students in the examination of current research and trends in professional 
development for campus and district instructional staff. Students will have the opportunity to learn 
about development, implementation and evaluation of campus and district-level professional 
development and will explore adult learning strategies and motivation.

Prerequisites: None

Corequisites: "
CAI 6322,Curriculum Design,6,"Examines the impact of 21st Century Standards on the development, implementation and 
evaluation of state and local curricula.

Prerequisites: CAI 6320

Corequisites: "
CAI 6323,Research IV - Proposal,6,"Focuses upon preparation of the dissertation proposal which will include selection of topic, 
development of problem statement and research hypotheses/questions, initial review of literature, 
design of study, and significance and limitations of study.

Prerequisites: None

Corequisites: "
CAI 6324,Assessment of Student Learning,6,"Provides students with the tools to develop, maintain, and evaluate an effective student learning 
assessment process. Exploration of the assessment process will include: how to write appropriate 
learning objectives, the utilization of learning goals, formative and summative assessment, the 
differentiation of testing formats and what they really assess, the utilization of rubrics for improved 
instruction and feedback, and an understanding of the values of writing ethical assessments to meet 
the needs of all students.

Prerequisites: None

Corequisites: "
CAI 6325,Contemporary Issues,6,"Explores the issues in curriculum and instruction which are current as well as those that continue as 
ongoing issues in education. Topics such as teacher accountability, a centralized curriculum, equity 
and access, high-stakes testing, and culturally responsive teaching are among the topics to be 
explored. This will be an evolving course driven by the issues that affect educators.

Prerequisites: None

Corequisites: "
CAI 6351,Program Evaluation,6,"Examines different theoretical models of evaluation and will evaluate an educational program by 
constructing and administering instruments, analyzing the data gathered, determining the worth of 
the program, writing an evaluation report, and presenting the report to the personnel of the 
program evaluated, including presentation for the class.

Prerequisites: None

Corequisites: "
CAI 6352,Supervision & Leadership,6,"Examines research related to the effective supervision of curriculum and instruction at the school, 
district, and system levels

Prerequisites: None

Corequisites: "
CAI 6335,Practicum I,6,"The first of two semesters of fieldwork of the Ed.D. Curriculum & Instruction program, wherein 
students will spend time with one or more mentors in a campus or central office setting and record 
hours in each of the applicable program objectives.

Prerequisites: None

Corequisites: "
CAI 6336,Practicum II,6,"The second of two semesters of fieldwork of the Ed.D. Curriculum & Instruction program, wherein 
students will spend time with one or more mentors in a campus or central office setting and record 
hours in each of the applicable program objectives.

Prerequisites: None

Corequisites: "
ECE 3320,Early Childhood Education Curriculum Methods and Materials,3,"This course will examine organization, materials, curriculum, and methods in preschool, 
kindergarten, and primary education.  Techniques in working with primary age students will be 
emphasized. Therefore, course meetings and learning experiences are interactive and participatory. 
Fieldwork at a local school in an early childhood setting is required as part of this course.

Prerequisites: Admission to the Teacher Ed Program

Corequisites: "
ECO 2301,Introduction to Macroeconomics,2,"Macroeconomics is the social science that studies the way societies, in the aggregate, allocate 
scarce resources to unlimited wants.  Topics of the course include introductions to: supply and 
demand, Gross Domestic Product, inflation, recession, unemployment, aggregate private 
investment, government fiscal policy, monetary policy, international trade, and the effects that each 
of these have on the nation's economy in the classical, Keynesian, and monetarist frameworks.

Prerequisites: None

Corequisites: "
ECO 2302,Introduction to Microeconomics,2,"Microeconomics is the social science that studies the ways individual economic agents allocate 
scarce resources to unlimited wants. Topics of the course include introductions to: supply and 
demand, elasticity of supply and demand, consumer behavior, firm behavior, competition, 
monopoly, oligopoly, and monopolistic competition, resource markets, market failures, antitrust 
policy, and issues of economic equity.

Prerequisites: None

Corequisites: "
EDU 1201,Intro to Education,1,"An introduction to the roles and responsibilities of the teacher, the characteristics of America’s 
schools and curriculum, and selected issues facing today's teachers. Observation/activities will 
focus on the child as learner, teaching strategies, management procedures, classroom climate, and 
roles of the teacher. Fieldwork required. Required of all education major.  Fulfills Experiential 
Learning requirement. Requires time log and reflections to be submitted when applying for 
admission into the Teacher Education Program

Prerequisites: None. Course Fee: $55

Corequisites: "
EDU 2304,Children’s Literature,2,"A survey of the evolution of children's literature, and the exploration, analysis, and evaluation of 
significant literature for children's needs, interests, and capabilities. Emphasis is given to the study 
of the various genres of children's literature and styles of illustration. Suggestions are shared for 
elementary level storytelling, oral reading, and literacy projects. Extensive documented reading of 
children's books is required.

Prerequisites: None

Corequisites: "
EDU 2310,Intro to Exceptional Learners,2,"This course focuses on the foundation of special education. Students will be introduced to basic 
theories and concepts related to identification and classification of exceptional learners, legislation 
and litigation in special education, best practices for classroom instruction for exceptional learners, 
and factors that promote effective consultation and collaboration with families, educators, and other 
professionals. 15 hours of fieldwork required.

Prerequisites: Grade of ‘C’ or higher in EDU 2201.

Corequisites: "
EDU 2320,Teaching Culturally & Linguistically Diverse Students,2,"This course explores best practices in teaching culturally and linguistically diverse students. It is 
designed to build pre-service teachers’ understanding of the influences of culture and home 
language(s) on language development and prepare them to assess and address the linguistic 
strengths and needs of students. This course is required of all Education students.

Prerequisites: None

Corequisites: "
EDU 2323,Educational Technology,2,"This class is designed to familiarize students with the Technology Applications Standards and 
Competencies for Texas teachers and help prepare them to effectively use technology in planning 
and delivering instruction. Required of all education majors. Fulfills Technology requirement for 
teacher education students.

Prerequisites: Admission to the Teacher Education Program

Corequisites: "
EDU 2343,Educational Psychology,2,"Educational Psychology is designed to introduce psychological principles, theories, and 
methodologies to issues of teaching and learning in schools. Topics include learning theory, learner 
characteristics, intelligence, creativity, motivation, measurement and evaluation, and models of 
teaching for all learners. Examination of cognitive, social, moral development of students as they 
 
 
interact in the learning process also takes place. This course is required of all education students.

Prerequisites: PSY 1311 Introduction to Psychology

Corequisites: "
EDU 3261,Vocation of the Christian Educator,3,"The topics of this course center on the systemic development of the Lutheran tradition of education 
in America.  Emphasis will be placed on the present status of The Lutheran Church—Missouri 
Synod system of formal education as it has grown into the world’s second largest non-public system 
of education.  This course also emphasizes the tasks and function of the Christian educator in the 
role of commissioned minister status. Required of students seeking a Lutheran Teacher Diploma.

Prerequisites: None

Corequisites: "
EDU 3311,Teaching Strategies & Assessment,3,"Instructional techniques and strategies that emphasize practical application of the teaching/learning 
process to include writing of instructional objectives and lesson plans, delivery strategies, and 
grouping practices based on learning theory and learning styles as well as multiple intelligences.  
Includes formal and informal assessment, measurement and evaluation of curriculum, teaching 
strategies and student learning in the elementary classroom with an emphasis on the use of 
technology.

Prerequisites: Admission to the College of Education

Corequisites: "
EDU 3331,Teaching Physical Education,3,"Students will discover effective methods and techniques for teaching physical education while 
integrating the dimensions of wellness for healthy living. Major components of the course include 
writing instructional objectives and lesson plans, applying principles of organization and class 
management, and incorporating delivery strategies unique to physical education. Satisfies the 
Wellness requirement for the Common Experience. Cross-listed with KIN 3333.

Prerequisites: Grade of ‘C’ or higher in KIN 2301 or KIN 2302, or Admission to the Teacher Education

Corequisites: "
EDU 3333,Teaching Religion,3,"This course is designed to prepare students for the teaching ministry. Emphasis will be the 
concepts, content, materials, and strategies necessary in teaching religion in the elementary, 
middle, secondary, and special education classrooms. Integration of the Christian faith into all 
aspects of parish and school ministry will be covered. Fieldwork in Lutheran schools affiliated with 
the Lutheran Church-Missouri Synod is required for all students seeking a Lutheran Teacher 
Diploma. Fieldwork in Christian schools is required for all students seeking a Christian Teacher 
Diploma. Fulfills Experiential Learning requirement.

Prerequisites: Admission to the Teacher Education Program

Corequisites: "
EDU 3340,Societal Relationships & Classroom Management,3,"This course will explore the vital and necessary interrelationships between the three elements 
present in the overall education of students or learners: school, home, and community. This course 
will also explore methods of effective classroom management strategies. This course is required of 
all education students.

Prerequisites: SPED 3301

Corequisites: "
EDU 4101,Teacher Education Seminar,4,"This course prepares teacher education students to meet the qualifications to enter their second 
fieldwork practicum. Students will prepare for and meet standards on their TexES pedagogy and 
content exams and complete all Texas teacher trainings required to be recommended for 
certification. Graded as Credit/No-Credit.

Prerequisites: Admission to the Teacher Education Program (2).

Corequisites: "
EDU 4601,Teacher Residency,4,"Teacher candidates will develop their teaching skills under the mentorship of a highly qualified 
teacher with the support of a university supervisor in a yearlong co-teaching placement using a 
gradual release model.  This course is taken in conjunction with the second practicum and repeated 
with clinical teaching. Graded as Credit/No-Credit.

Prerequisites: Students must apply for residency and be approved by the program coordinator. Course Fee:

Corequisites: "
EDU 4300,Secondary Content Methods,4,"Application of classroom management and instructional strategies specific to the individual content 
area. In addition to academic study in their content area, students will observe master teachers, 
develop, deliver, and reflect on lesson plans, build professional relationships, and collaborate with 
their cooperating teachers in preparation for clinical teaching. Fieldwork required.

Prerequisites: Benchmark 3 (Methods Checkpoint) or Program Director approval.

Corequisites: "
EDU 4301,Urban Immersion Seminar,4,"This two-week interactive immersion seminar is designed to expose students to diverse classroom 
settings in another city. Students will visit and lead in the classroom, arrange and participate in city 
excursions, share devotions, and reflect on their experiences. Students will engage in approximately 
40 hours of fieldwork experiences observing classes and will complete reflections, participate in 
discussions and complete assignments after the observations. Students who successfully complete 
the Urban Immersion Seminar may apply up to 25 of their field experience hours toward the 
required hours in one of their subsequent practicum classes: RDG 3326 or 4327 (Interdisciplinary 
Studies majors) or RDG 3342 or EDU 4300 (Education Content Curriculum majors). Graded as 
Credit/No-Credit.

Prerequisites: Benchmark 3 (Methods Checkpoint). Course Fee: $700.

Corequisites: "
EDU 4305,Mathematical Methods-Elementary,4,"Methods and strategies of teaching: logic, sets, relations, functions, operations, numeration systems, 
number theory, rational numbers, real numbers, informal geometry, measurement, probability, and 
statistics. Technology used to support math curriculum is explored. Fieldwork required. Fulfills 
Experiential Learning requirement.

Prerequisites: Admission to the Teacher Education Program. Co-requisite courses: EDU 4307 and RDG

Corequisites: "
