code,title,credit_hours,description
ACC 2301,Fundamentals of Financial Accounting,2,"Students will study the accounting cycle, financial statements, accounting analysis, assets, liabilities,
capital and analysis of financial statements.

Prerequisites: None; College Algebra or Intro to Statistics strongly recommended.

Corequisites: "
ACC 2302,Fundamentals of Managerial Accounting,2,"Students will study accounting for partnerships and corporation owner’s equity, management
accounting, and developing information for production decision making.

Prerequisites: ACC 2301

Corequisites: "
ACC 3301,Intermediate Accounting I,3,"Provides in-depth knowledge of basic accounting principles and procedures including analysis of 
traditional accounting statements to discern organizational strengths and weaknesses.

Prerequisites: ACC 2301 and ACC 2302

Corequisites: "
ACC 3302,Intermediate Accounting II,3,"A continuation of ACC 3301.

Prerequisites: ACC 2301, ACC 2302, and ACC 3301

Corequisites: "
ACC 3320,Fundamentals of Taxation,3,"Introduction to the role of taxes in contemporary society and their impact on individuals and 
business entities with emphasis on Federal income taxation.

Prerequisites: ACC 2301 and ACC 2302.

Corequisites: "
ACC 3370,Auditing Theory and Practice,3,"Principles and procedures applied by independent auditors and internal auditors, responsibilities of 
auditors, development of audit programs, accumulation of evidence, statistical and EDP auditing 
applications and reporting.

Prerequisites: ACC 2301 and ACC 2302

Corequisites: "
ACC 3382,Fraud Examination,3,"Develops an understanding and appreciation of the major methods employees use to commit 
occupational fraud.  Students will learn how and why occupational fraud is committed, how 
fraudulent conduct can be deterred, and how allegations of fraud should be investigated and 
resolved.

Prerequisites: ACC 2301 and ACC 2302

Corequisites: "
ACC 4310,Accounting Internship,4,"Provides students with job searching skills, on-the-job work experience and training related to 
academic education and long-term goals. May be repeated once for credit as an elective, but only 
three credit hours will count toward any accounting major. Fulfills experiential learning 
requirement.

Prerequisites: ACC 3301, ACC 3302, and 6 additional hours of upper level Accounting coursework

Corequisites: "
ACC 4380,Advanced Financial Accounting,4,"Accounting problems in respect to multiple ownership, consolidated financial statements and 
partnership accounts; modern currency translations; segmental reporting, and advanced accounting 
theory.

Prerequisites: ACC 2301, ACC 2302, ACC 3301 and ACC 3302

Corequisites: "
ASL 1401,American Sign Language I,1,"American Sign Language (ASL) is the language of the Deaf community in the United States and 
Canada. The course also treats Deaf culture.  This course, together with ASL 1402, meets 
 
 
requirement for modern language.

Prerequisites: None

Corequisites: "
ASL 1402,American Sign Language II,1,"American Sign Language (ASL) is the further study of the language of the Deaf community in the 
United States and Canada.  American Sign Language I and II (ASL 1401 and ASL 1402) together 
meet the requirement for modern language.

Prerequisites: Successful completion of ASL 1401

Corequisites: "
ART 1302,Survey of Art History,1,"This class is designed as a survey of the history of Western art from ancient through contemporary 
times, with emphasis on the major artists and works of art. It will also introduce some of the major 
methodologies used to approach topics in art history. Class time will be divided between slide 
lectures and in-class discussions over the readings.

Prerequisites: None

Corequisites: "
ART 1305,Introduction to Art History: Modern,1,"This course covers the history of visual art from the Renaissance to the present. It is taught with a 
European-American perspective, and includes painting, sculpture, architecture and other major 
areas of study.

Prerequisites: None

Corequisites: "
ART 1306,Drawing Media,1,"Basic drawing using graphite as the primary media. Will also include some or all of the following: 
charcoal, ink, metal point, monoprint, and oil sticks.

Prerequisites: None

Corequisites: "
ART 1308,Introduction to Photography,1,"Basic photography course with emphasis upon technical skill development, camera use and 
operation, digital operation methods and techniques.

Prerequisites: None

Corequisites: "
ART 1315,Art Theory and Practice,1,"A survey which includes study of art history, art criticism, aesthetics, and studio production, 
including study and use of all principles and elements of art in a variety of media, practicing critical 
evaluation of art production in progress; and development of knowledge and skills for personal 
growth.

Prerequisites: None

Corequisites: "
ART 2310,Glass – Fusing and Slumping,2,"An introduction to the sculptural qualities of glass through fusing and slumping processes. Class 
content will emphasize the process of ideation and design utilizing surface, translucency, and 
 
 
transparency. May be repeated for credit with instructor permission.

Prerequisites: None. Course Fee: $45

Corequisites: "
ART 2320,Ceramics,2,"Study of hand building techniques, clay bodies, and glazes using low fire clay. May be repeated for 
credit.

Prerequisites: None. Course Fee: $45

Corequisites: "
ART 3308,Color,3,"This color course offers a new interdisciplinary model connecting diverse experiences and practical 
tools to navigate the complex network of color codes we inhabit. Exploration of color theories 
includes the practical use of color in its many different everyday engagements.

Prerequisites: None

Corequisites: "
ART 3312,Painting,3,"Study of oil painting techniques, color theory, design application, and styles of various well-known 
artists. May be repeated for credit.

Prerequisites: None. Course Fee: $45

Corequisites: "
ART 4306,Art as Vocation,4,"This course prepares you in professional concerns of aesthetics, studio practices, exhibitions, and 
working with art institutions. Emphasis will be placed on developing an audience, marketing art, 
planning programs/events, financial planning, writing proposals/grants, and art industry 
management. Readings will explore artistic vocation with a Biblical, historical, theological, and 
contemporary perspective.

Prerequisites: Successful completion of any 6 credit hours of ART

Corequisites: "
ART 4312,Painting II,4,"In this course you will continue to increase your skills in oil painting. You will have the opportunity 
to develop your ideas concerning genres of landscape, still life and the figure, while exploring and 
expanding your interests in abstraction, representation, collage and digital applications.

Prerequisites: Successful completion of ART 3312

Corequisites: "
BIO 1101-1106,Field Biology,1,"BIO 1101-1106 are a series of mini-course field experiences to study the ecosystems of selected 
areas of Texas; some courses require good physical conditioning due to strenuous hiking activity. 
Field Biology may be repeated for credit under each separate number; the same number course 
may not be repeated for credit. Up to three of these one-hour courses in any combination may be 
used as a non-lab Natural Science within the core. These courses require a special course fee to 
cover travel and special equipment. Fulfills one (1) credit hour of Experiential Learning

Prerequisites: Consent of instructor. Course Fee: $150

Corequisites: "
BIO 1101,Field Biology East and Southeast Texas,1,"BIO 1101-1106 are a series of mini-course field experiences to study the ecosystems of selected
areas of Texas; some courses require good physical conditioning due to strenuous hiking activity.
Field Biology may be repeated for credit under each separate number; the same number course
may not be repeated for credit. Up to three of these one-hour courses in any combination may be
used as a non-lab Natural Science within the core. These courses require a special course fee to
cover travel and special equipment. Fulfills one (1) credit hour of Experiential Learning

Prerequisites: Consent of instructor. Course Fee: $150

Corequisites: "
BIO 1102,Field Biology Rio Grande Valley,1,"BIO 1101-1106 are a series of mini-course field experiences to study the ecosystems of selected
areas of Texas; some courses require good physical conditioning due to strenuous hiking activity.
Field Biology may be repeated for credit under each separate number; the same number course
may not be repeated for credit. Up to three of these one-hour courses in any combination may be
used as a non-lab Natural Science within the core. These courses require a special course fee to
cover travel and special equipment. Fulfills one (1) credit hour of Experiential Learning

Prerequisites: Consent of instructor. Course Fee: $150

Corequisites: "
BIO 1103,Field Biology Southwest Texas,1,"BIO 1101-1106 are a series of mini-course field experiences to study the ecosystems of selected
areas of Texas; some courses require good physical conditioning due to strenuous hiking activity.
Field Biology may be repeated for credit under each separate number; the same number course
may not be repeated for credit. Up to three of these one-hour courses in any combination may be
used as a non-lab Natural Science within the core. These courses require a special course fee to
cover travel and special equipment. Fulfills one (1) credit hour of Experiential Learning

Prerequisites: Consent of instructor. Course Fee: $150

Corequisites: "
BIO 1104,Field Biology Panhandle and Northwest Texas,1,"BIO 1101-1106 are a series of mini-course field experiences to study the ecosystems of selected
areas of Texas; some courses require good physical conditioning due to strenuous hiking activity.
Field Biology may be repeated for credit under each separate number; the same number course
may not be repeated for credit. Up to three of these one-hour courses in any combination may be
used as a non-lab Natural Science within the core. These courses require a special course fee to
cover travel and special equipment. Fulfills one (1) credit hour of Experiential Learning

Prerequisites: Consent of instructor. Course Fee: $150

Corequisites: "
BIO 1105,Field Biology Central Texas,1,"BIO 1101-1106 are a series of mini-course field experiences to study the ecosystems of selected
areas of Texas; some courses require good physical conditioning due to strenuous hiking activity.
Field Biology may be repeated for credit under each separate number; the same number course
may not be repeated for credit. Up to three of these one-hour courses in any combination may be
used as a non-lab Natural Science within the core. These courses require a special course fee to
cover travel and special equipment. Fulfills one (1) credit hour of Experiential Learning

Prerequisites: Consent of instructor. Course Fee: $150

Corequisites: "
BIO 1106,Field Biology Guadalupe Mountains,1,"BIO 1101-1106 are a series of mini-course field experiences to study the ecosystems of selected
areas of Texas; some courses require good physical conditioning due to strenuous hiking activity.
Field Biology may be repeated for credit under each separate number; the same number course
may not be repeated for credit. Up to three of these one-hour courses in any combination may be
used as a non-lab Natural Science within the core. These courses require a special course fee to
cover travel and special equipment. Fulfills one (1) credit hour of Experiential Learning

Prerequisites: Consent of instructor. Course Fee: $150

Corequisites: "
BIO 1401,Principles of Biology,1,"General concepts of biology with emphasis on man in God's world. This course meets the core 
natural science requirement for non-science majors. Students should be co-enrolled in the 
laboratory part of the course, BIO 1401L.

Prerequisites: None. Course Fee (BIO 1401L): $45

Corequisites: "
BIO 1402,General Zoology,1,"The anatomy, physiology, behavior and ecology of major animal groups. Students should be co-
enrolled in the laboratory part of the course, BIO 1402L.

Prerequisites: None. Course Fee (BIO 1402L): $85

Corequisites: "
BIO 1403,Cellular and Molecular Biology,1,"Modern concepts of cellular functions at the molecular level. This course meets the core natural 
science requirement. Students should be co-enrolled in the laboratory part of the course, BIO 
1403L.

Prerequisites: Successful completion of CHE 1341 and 1141, or CHE 1431, with a grade of ‘C’ or higher.

Corequisites: "
BIO 2403,General Botany,2,"The structure, function, reproduction, taxonomy and ecology of plants. Students should be co-
enrolled in the laboratory part of the course, BIO 2403L.

Prerequisites: None. Course Fee (BIO 2403L): $75

Corequisites: "
BIO 2411,Anatomy & Physiology for Healthcare I,2,"Introduction to the study of human anatomy and physiology for healthcare majors. Begins with an 
overview of the chemical basis of life and reviews cellular structure, function and metabolism. 
Course continues with coverage of tissues and five systems (skin and the integumentary system, 
skeletal system including joints, muscular system, cardiovascular system, and respiratory system) 
and how they are interconnected, with a particular focus on health. This course may not be used to 
meet either prerequisites or requisites in majors from the School of Natural and Applied Sciences. 
Students should be co-enrolled in the laboratory part of the course, BIO 2411L.

Prerequisites: Completion of high school Biology and Chemistry or equivalent; preferred completion of

Corequisites: "
CHE 1341,and 1141. Course Fee (BIO 2411L): Varies by course modality.,1,"BIO 2412 Human Anatomy Physiology for Healthcare II 
A continuation of the study of human anatomy and physiology for healthcare majors. The course 
will cover the remaining six systems (nervous system including somatic and special senses, 
endocrine system, lymphatic system, digestive system, urinary system, and reproductive system) 
and how they are interconnected, with a particular focus on health. This course may not be used to 
meet either prerequisites or requisites in majors from the School of Natural and Applied Sciences. 
Students should be co-enrolled in the laboratory part of the course, BIO 2412L.

Prerequisites: Successful completion of BIO 2411 Human Anatomy and Physiology for Healthcare.

Corequisites: "
BIO 2413,Microbiology for Health Sciences,2,"The Microbiology for the Health Sciences class provides an overview of the microbial world. Topics 
include the basic characteristics of fungi protozoans, bacteria, and viruses. Special emphasis is 
placed on topics and applications that relate to human health. This course is intended as a 
prerequisite for entry into the nursing program. This course may not be used to meet either 
prerequisites or requisites in majors from the School of Natural and Applied Sciences.

Prerequisites: None; Anatomy & Physiology I or Cellular & Molecular Biology strongly suggested. Course

Corequisites: "
BIO 3302,Tropical Biology,3,"A study of the biology and ecology of tropical ecosystems that includes a substantial field 
component offered during a semester break or summer. This course also includes a study of 
environmental concerns and conservation efforts in tropical ecosystems. The field component 
requires extensive physical exertion and “roughing it.” Additional fee for course paid at time of 
registration.  Fulfills Experiential Learning requirement.

Prerequisites: Consent of the instructor

Corequisites: "
BIO 3303,Native Plants,3,"Identification, natural history, economic importance, and ecology of plants native to Central Texas.

Prerequisites: None

Corequisites: "
BIO 3310,Nutrition,3,"A study of the nutrients and other substances in foods and the body's handling of them. Nutrient 
requirements associated with various life stages and the impact of various disorders and diseases 
upon nutrition will also be explored.

Prerequisites: Completion of a college level laboratory science course

Corequisites: "
BIO 3350,Biopsychology,3,"An introduction to the structure and function of the nervous system and the relationship between 
psychological processes and the brain in humans and other animals. Cross-listed with PSY 3350.

Prerequisites: PSY 1311 or PSY 1311H. BIO 1403 and BIO 3412 strongly suggested

Corequisites: "
BIO 3370,Ecology of the Pacific Northwest,3,"A study of the unique wildlife, ecological relationships, and environmental concerns in a variety of 
aquatic and terrestrial habitats of the U.S. Pacific Northwest.  The course includes substantial 
 
 
independent work throughout the semester and culminates with a field experience typically held in 
Oregon, Washington, and California that requires substantial hiking, outdoor data collection, and 
journaling. Additional fee for course paid at time of registration. Fulfills Experiential Learning 
requirement.

Prerequisites: Consent of instructor

Corequisites: "
BIO 3401,General Microbiology,3,"The structure, physiology, culture, and control of bacteria and other microbes. Students should be 
co-enrolled in the laboratory part of the course, BIO 3401L.

Prerequisites: BIO 1403 with a grade of ‘C’ or higher. Course Fee (BIO 3401L): $85

Corequisites: "
BIO 3403,General Ecology,3,"A study of those factors which affect the abundance, biodiversity and distribution of organisms. 
Includes ecological theory, mathematical modeling, and natural history and field techniques. 
Students should be co-enrolled in the laboratory part of the course, BIO 3403L This course is cross-
listed with ESC 3403/ESC 3403L.

Prerequisites: BIO 1402 or BIO 2403 with a grade of ‘C’ or higher. Course Fee (BIO 3403L): $75

Corequisites: "
BIO 3404,Genetics,3,"An introduction to classical, molecular, developmental and population genetics with an emphasis 
on genetic analysis. Students should be co-enrolled in the laboratory part of the course, BIO 3404L.

Prerequisites: BIO 1401 or BIO 1403 with a grade of ‘C’ or higher. Course Fee (BIO 3404L): $75

Corequisites: "
BIO 3406,Animal Behavior,3,"An introduction to the study of animal behavior. Cross-listed with PSY 3406.

Prerequisites: Any Natural Science course with a grade of ‘C’ or above. Course Fee: $75

Corequisites: "
BIO 3411,Human Anatomy and Physiology I,3,"An introduction to the study of human anatomy and physiology. Beginning with a quick overview of 
the chemical basis of life and a review of cells and cellular metabolism. The remainder of the course 
will cover tissues and five systems (skin and the integumentary system, skeletal system including 
joints, muscular system, cardiovascular system, and respiratory system). Students should be co-
enrolled in the laboratory part of the course, BIO 3411L.

Prerequisites: BIO 1403 with a grade of ‘C’ or higher. Course Fee (BIO 3411L): $85

Corequisites: "
BIO 3412,Human Anatomy and Physiology II,3,"A continuation of the study of human anatomy and physiology. The course will cover the remaining 
six systems (nervous system including somatic and special senses, endocrine system, lymphatic 
system, digestive system, respiratory system, urinary system, and reproductive system) and related 
topics.  Note: Students who have already completed BIO 2401 Human Anatomy and Physiology are 
not allowed to take this course for credit unless approved by the Coordinator of the Biology 
Department. Students should be co-enrolled in the laboratory part of the course, BIO 3412L.

Prerequisites: BIO 3411 with a grade of ‘C’ or higher. Course Fee (BIO 3412L): $85

Corequisites: "
BIO 3420,Developmental Biology,3,"An introduction to both classical and modern developmental biology including molecular and 
genetic analysis of development. Students should be co-enrolled in the laboratory part of the 
 
 
course, BIO 3420L.

Prerequisites: BIO 1403 with a grade of ‘C’ or higher. Course Fee (BIO 3420L): $75

Corequisites: "
BIO 3430,Biochemistry,3,"An overview of the macromolecules and small molecules that are the key to all living systems.  
Topics covered include protein structure and function, enzyme mechanisms, kinetics and 
regulation, membrane structure and function, bioenergetics, hormone action, intermediary 
metabolism, including pathways and regulation of carbohydrate, lipid, amino acid, and nucleotide 
biosynthesis and breakdown. Students should be co-enrolled in the laboratory part of the course, 
BIO 3430L. This course is cross-listed with CHE 3430/CHE 3430L.

Prerequisites: BIO 1403 with a grade of ‘C’ or higher, and credit or concurrent enrollment in  CHE 2401.

Corequisites: "
BIO 4330,Exercise Physiology,4,"This class is a study of the physiological responses of the body to exercise. Emphasis is on the 
application of the physiological principles deemed most important for understanding physical 
training. Note: This course does not count for core physical education/wellness requirements.

Prerequisites: Grade of ‘C’ or higher in BIO 3411.

Corequisites: "
BIO 4410,Biological Science Research,4,"A research course in which students will work as a team to complete research in an area of the 
biological sciences as set forth by the instructor. Students will learn how to critically read scientific 
papers and interpret data. All aspects of proposal writing will be explored during this course. The 
course will culminate with presentation of the students and groups research findings in both oral 
and written formats. Fulfills Experiential Learning requirement.

Prerequisites: Biology majors with senior standing or by permission of instructor. Course Fee: $85

Corequisites: "
BADM 1303,Intro to Population Health,1,"This course introduces students to the study of population health and what it means to live a long 
and healthy life. It includes examining the factors that can influence health and wellness as well as 
the various fields all connected to health. The course is interdisciplinary. It covers a broad range of 
issues including health communication, environmental health, infectious diseases, social health, and 
how to improve your community as well as your own life. This is an exciting eye-opening course 
that any student interested in his/her well-being or the well-being of others can take. Cross-listed 
with PUBH 1303.

Prerequisites: None

Corequisites: "
BADM 1310,Intro to Business and Entrepreneurship,1,"This introductory course is designed to help students advance their knowledge of both business 
and entrepreneurship. This course helps students to develop their critical thinking skills in solving 
contemporary business issues. The course looks at various entrepreneurial ventures and business 
disciplines from a variety of perspectives to provide a foundation for business development. 
Students will be introduced to a variety of careers as well as practical and professional skills.

Prerequisites: None

Corequisites: "
BADM 2310,Global Business and Communication,2,"This course introduces the modern business enterprise with an emphasis on the interdependence of
the business functions in a global environment. Topics include the cross-border impacts of culture, 
communication, politics, and law on trade, investment, marketing, management, and accounting 
and financial systems.

Prerequisites: None

Corequisites: "
BADM 3311,Principles of Management,3,"Course is a survey of management philosophy, theories, and practices. Topics include management 
functions of planning, decision making, organizing, staffing, communicating, motivating, leading, 
and controlling. This course will also consider organizational behavior, international management 
and the global economy. This course has a writing component.

Prerequisites: None

Corequisites: "
BADM 3314,Essentials of Global Public Health,3,"Examines the main functions of public health; disease prevention and health promotion. Students 
will learn the history and philosophy of public health, its core values and functions across the globe 
and in society. Students will examine the factors that impact health and how productivity is 
influenced by health outcomes since prevention is more cost effective than cure. Students will learn 
about working in both clinical care settings as well as institutions that promote population health. 
Case studies will be used. Cross-listed with PUBH 3314.

Prerequisites: None

Corequisites: "
BADM 3315,Comparative Health Care Systems,3,"Examines the healthcare delivery system of the United States, its fundamental characteristics and 
organization as well as differences in the healthcare systems of other countries. Students will learn 
about the various agencies involved in health and access to healthcare will be reviewed. Students 
will have a better understanding of the composition of health workers in the United States and other 
countries. Innovative technologies and best practices will be studied. Cross-listed with PUBH 3315.

Prerequisites: None

Corequisites: "
BADM 3321,Business Law,3,"Background and role of law in business and society. Specific commercial law topics addressed 
include Uniform Commercial Code, business torts, property, contract sales, debit/creditor relations, 
and agency.

Prerequisites: None

Corequisites: "
BADM 3323,"Globalization, Trade and Health Policy",3,"Examines the increasing interdependence of the world with greater connectivity affecting the speed 
of access to information. Key focus will be on the dimensions of globalization including trade in 
food, pharmaceutical products, tobacco as well as healthcare personnel and the shift in patterns of 
disease. Case studies will be used. Cross-listed with PUBH 3323.

Prerequisites: None

Corequisites: "
