code,title,credit,description
ACC 104,Computerized Accounting,3,Description Emphasizes a fundamental understanding of corporate and cost accounting. Topics
ACC 105,Fundamentals of Accounting,3,"Description This is a course designed for students who want a working knowledge of accounting,"
ACC 130,Managerial Accounting,3,"Description This course studies management tools for business decision making, including study"
ACC 152,Payroll Accounting,3,Description Provides an understanding of the laws that affect a company's payroll structure and
ACC 160,Principles of Accounting I,3,Description This course is designed to help the students develop a basic understanding of
ACC 170,Principles of Accounting II,3,Description This course is a continuation of ACC 160 Principles of Accounting I. It is a study of
ACP 100,Introduction to Coatings & Paint Technology,3,"Description The objective of this course is to discuss the fundamentals of paint composition,"
ACP 101,Surface Preparation & Coatings,4,Description This course is a study of surface preparation from various coating and painting
ACP 102,Performance & Durability of Coatings,3,Description The objective of this course is to discuss facts and findings affecting performance
ACP 103,Color Technology,3,Description This course is a study of the fundamentals of visual color match evaluation and of
ACP 104,Specialized Coatings Processes,3,Description This course is a study in special coatings for aerospace structures. Topics include
ACP 105,Specialized Detailing,3,"Description This course provides instruction in the equipment, material, and techniques used in"
ACP 106,Aerospace Coatings & Materials,3,Description This course covers advanced technologies for coating materials and applications.
ACP 107,Aerospace Program Management,3,Description This course will introduce basic program management skills and techniques. Topics
ACP 110,Integrated Assembly Capstone Project,4,Description This course addresses the full spectrum of the Coating Technicians role within the
ACP 111,Technical Co-Operative Project,4,Description Students will work on a part-time basis in a job directly related to applied
ACP 115,Introduction to Airbrush,3,Description This course is designed as an introduction to airbrush paint. The ability to draw is not
ACP 120,Intermediate Airbrush I,3,Description This course deals with promoting advanced technique skills that have been
ACP 121,Surface Preparation & Coatings II,3,Description This course is designed to enhance the students understanding of surface
ACP 124,Specialized Coatings Processes II,4,Description This course is designed to enhance the students understanding of aviation coatings
ACP 125,Intermediate Airbrush II,3,Description This course deals with the continued progression of advanced technique skills that
ACP 160,Advanced Airbrush,3,Description This course deals with refining advanced technique skills that have been
ACR 112,HVAC Fundamentals,4,Description This course is designed to introduce students to the HVAC industry. Topics
ACR 113,Electrical Fundamentals,4,Description Students will be introduced to basic electrical theory for DC and AC systems. The
ACR 116,Workplace Skills,1,"Description Upon successful completion of this course, the student should be able to identify the"
ACR 117,Intro to Mechanical Refrigeration,4,Description The students will learn the basics of the refrigeration system and its components.
ACR 118,Electrical Fundamentals II,3,Description Students will be introduced to motor theory and explore motor applications. This
ACR 119,Advanced Electrical Theory for HVAC,2,Description Advanced Electrical Theory for HVAC is a continuation of Electrical Fundamentals I
ACR 121,Heating System Fundamentals,3,Description This course will provide students a firm understanding of combustion and how it is
ACR 122,Heating System Fundamentals II,3,Description The Heating System Fundamentals II course is designed to walk students through
ACR 123,Heat Loads and Duct Sizing,2,Description The course will teach students to analyze heat flow characteristics as they study
ACR 124,Advanced Heating Systems,3,Description This course will introduce students to electric furnaces and hydronic heating with an
ACR 126,EPA 608,1,Description This course prepares students for the certification exam required by federal and
ACR 127,Heat Pumps,4,"Description The student will learn basic functions of heat pump designs, charging, and trouble"
ACR 128,Commercial HVAC,4,Description This course will introduce students to the commercial applications of various HVAC
ACR 129,Commercial HVAC Lab,4,"Description This course continues the introduction to commercial HVAC systems through handson training. Students will perform basic maintenance, repairs and troubleshooting on"
ACR 140,Sheet Metal Fabrication I,3,"Description Upon successful completion of this course, the student will be able to identify the"
ADN 110,Concepts of Professional Nursing: Transitioning from LPN to RN,3,Description This course focuses on the transition from a Licensed Practical Nurse (LPN) into the
ADN 120,Introduction to Nursing Concepts,1,Description This course introduces students to a core set of concepts critical to professional
ADN 130,Foundational Concepts in Nursing,6,Description This course introduces students to concepts under the category of Client Centered
ADN 140,Pharmacological Concepts in Nursing I,2,Description The purpose of this course is to examine pharmacotherapeutic agents used in the
ADN 150,Professional Nursing Concepts I,4,Description This course introduces students to concepts under the categories of Professional
ADN 160,Client Care Concepts I,6,Description This course focuses on the care of clients across the lifespan with concept-related
ADN 170,Pharmacological Concepts in Nursing II,2,Description This course is a continuation of Pharmacological Concepts in Nursing I. The purpose
ADN 180,Client Care Concepts II,6,"Description This course builds on Client Care Concepts I, focusing on the care of clients across"
ADN 190,Professional Nursing Concepts II,4,Description This course requires students to continue appraising concepts under the categories
ADN 200,Client Care Concepts III,6,"Description This course builds on Client Care Concepts I and II, focusing on the care of clients"
ADN 210,Transition to Practice,4,Description This course facilitates the transition of the student to the role of a professional nurse.
AER 106,Aerospace Manufacturing Tooling Orientation,1,"Description This course provides an overview of the Tooling safety hazards, traits employers"
AER 111,Tap and Die,1,Description This course provides knowledge and technical skills on taps and dies. Topics include
AER 115,Aerostructures Assembly,6,Description Students will master the techniques associated with aerospace mechanical
AER 116,Hand and Power Tools for Aerospace Tooling,1,Description This course provides technical knowledge on hand power tools used by a toolmaker
AER 126,Tooling Capstone,4,Description This course provides the specific technical knowledge and skills necessary to utilize
AER 135,Quality Assurance Orientation,1,Description This course provides an overview of the Quality Assurance Program. The course
AER 140,Assembly Mechanic Orientation,1,Description This course provides an overview of the technical and mechanical knowledge and
AER 150,Assembly Overview I,3,Description This course is designed to provide the student with a general overview of assembly
AER 155,Aerospace Plumbing,2,Description This course is designed to develop basic theory and knowledge of aircraft fluid lines
AER 157,Advanced Assembly,3,Description This course is the second of two courses designed to provide students with real
AER 165,Electrical Assembly Mechanic Orientation,1,Description The electrical certificate educational program is a tremendous opportunity for you to
AER 166,Electrical Hand Tools,1,Description This course familiarizes the student with various hand tools and connectors used in
AER 167,Basic Drilling & Riveting/Ground Stud Installation,2,Description This course familiarizes the student with power tools and acquired skills used in
AER 168,Wire Installation Drawings,1,Description This course familiarizes with the various drawings utilized in aerospace wire bundle
AER 169,Crimping & Cables,2,Description This course familiarizes the student with specifications and skills required to strip
AER 170,Fiber Optics for Aerospace,1,Description This course familiarizes the student with the advantages and disadvantages of the
AER 175,Wire Bundle Basics,1,"Description This course familiarizes the student with wiring in airplanes, wire and cable basics,"
AER 180,Soldering,1,Description The soldering course acquaints the student with the proper way to safely perform
AER 185,Wire Bundle Installation,2,Description This course familiarizes with the requirements for wire bundle installation culminating
AFV 110,Electrical I,3,Description In this course students will: Complete service work orders; describe the relationship
AFV 120,Electrical II,5,Description In this course students will: Perform battery diagnosis; perform battery service;
AFV 125,Manual Transmission/Transaxle & Drive Train,4,Description This course contains competencies that can be used in their entirety within a single
AFV 130,Suspension and Steering I,3,Description In this course students will: document fundamental suspension system concerns;
AFV 135,Introduction to Alternative Fuels,3,Description Students will use various sources in the alternative fueled vehicle industry to learn
AFV 140,Engine Repair,4,Description Through a variety of learning and assessment activities students can: explore the
AFV 145,Hybrid Systems & Maintenance,3,Description This course introduces the student to the features of the Internal Combustion Engine
AFV 150,Electric/Fuel Cell Technology,1,Description This course is designed to help prepare the student to enter the automotive repair
AFV 155,High Voltage Battery Technology & Management,3,Description This course introduces the student to high voltage battery technology: electrical
AFV 160,Brakes I,3,Description In this course students will Perform system pressure and travel calculations utilizing
AFV 165,"Introduction to CNG and LPG Conversion, Installation & Maintenance",1,Description This course introduces students to CNG and LNG as forms of alternative fuels. It will
AFV 170,Automotive Computer Systems,3,Description In this course students will: Perform automotive computer system diagnosis; perform
AFV 175,Automatic Transmission Repair,4,Description This course contains competencies that can be used in their entirety within a single
AFV 180,Heating & Air Conditioning,4,Description This course contains competencies that can be used in their entirety within a single
ALH 101,Medical Terminology,3,Description Presents basic principles of medical word-building. The study develops
ALH 105,First Aid & CPR,3,Description This course is designed to show the student how to deal with respiratory
ALH 110,Principles of Nutrition,3,Description Designed to help students increase their knowledge concerning their personal state
ALH 115,Pharmacology,3,Description This course will provide the basic pharmacology principles with an emphasis on a
ALH 121,Legal and Ethical Issues in Healthcare,3,Description This course introduces various ethical and moral issues in the context of healthcare
ALH 130,Emergency Preparedness for Health Professionals,1,Description This course is designed to provide health care professionals with an orientation for
ALH 131,"Diseases, Disorders & Diagnostic Procedures",2,Description Course focuses on diseases and disorders by body systems that are frequently
ALH 135,Spanish for Health Care Providers,1,Description This workshop is designed to provide health care providers with basic and practical
ALH 155,Pharmacology for Allied Health,3,Description Focuses on knowledge and skills necessary for safe and therapeutic drug therapy.
ALH 175,Pathophysiology,4,Description This course focuses on the essential mechanisms of disordered function which
AMT 011,Materials & Processes,,Description This course is designed to develop correct and safe usage of aircraft hardware with
AMT 018,Engine Airflow and Fire Protection Systems,,"Description This course is designed to develop correct safety practices, comprehensive"
AMT 020,Airframe Inspection,,"Description This course is designed to develop correct safety practices, comprehensive"
AMT 105,Technical Mathematics,2,Description This course is designed to provide the technical math principles required for the
AMT 107,Aircraft Drawings,1,Description This course is designed to develop theory and knowledge of blueprint reading skills
AMT 109,Physics,2,"Description This course is designed to develop the basic principles, fundamentals, and technical"
AMT 111,Materials & Processes,3,Description This course is designed to develop correct and safe usage of aircraft hardware with
AMT 112,Assembly & Rigging,3,"Description This course is designed to develop correct safety practices, comprehensive"
AMT 113,Basic Electricity,4,Description A course designed to provide the technical skills to apply the electrical and electronic
AMT 115,Weight & Balance,2,Description This course is designed to calculate and apply aircraft weight and balance principles
AMT 120,Airframe Inspection,3,"Description This course is designed to develop correct safety practices, comprehensive"
AMT 123,Cleaning & Corrosion Control,1,Description This course is designed to develop basic theory and knowledge of cleaning and
AMT 125,Fluid Lines & Fittings,1,Description This course is designed to develop basic theory and knowledge of aircraft fluid lines
AMT 127,Ground Operations & Servicing,1,Description This course is designed to develop safe skills and technical knowledge in Ground
AMT 131,General Review & Test,,Description Upon completion of the General curriculum this course is designed to prepare the
AMT 133,"Regulations, Research & Documentation",3,Description This course is designed to develop basic theory and knowledge of maintenance
AMT 136,Propellers,3,"Description This course is designed to develop correct safety practices, comprehensive"
AMT 151,Aircraft Electrical Systems,5,"Description This course is designed to develop correct safety practices, comprehensive"
AMT 153,Hydraulic & Pneumatic Power Systems,2,"Description This course is designed to develop correct safety practices, comprehensive"
AMT 154,"Landing Gear, Position, & Warning Systems",3,"Description This course is designed to develop correct safety practices, comprehensive"
AMT 159,Aircraft Fuel Systems,2,"Description This course is designed to develop correct safety practices, comprehensive"
AMT 165,Cabin Atmosphere Control Systems,2,"Description This course is designed to develop correct safety practices, comprehensive"
AMT 166,"Fire, Ice & Rain Control",1,"Description This course is designed to develop correct safety practices, comprehensive"
AMT 167,Aircraft Welding,1,"Description This course is designed to develop correct safety practices, comprehensive"
AMT 172,"Communication, Navigation, & Instruments",2,"Description This course is designed to develop correct safety practices, comprehensive"
AMT 179,Aircraft Sheet Metal & Non-Metallic Structures,8,"Description This course is designed to develop correct safety practices, comprehensive"
AMT 182,Aircraft Coverings and Finishes,2,"Description This course is designed to develop correct safety practices, comprehensive"
AMT 186,Airframe Review & Test,2,Description Upon completion of the Airframe curriculum this course is designed to prepare the
AMT 187,General I,4,"Description This course develops correct safety practices, comprehensive knowledge, and"
AMT 188,General II,4,"Description This course develops correct safety practices, comprehensive knowledge, and"
AMT 189,General III,5,"Description This course develops correct safety practices, comprehensive knowledge, and"
AMT 190,General IV,5,"Description This course develops correct safety practices, comprehensive knowledge, and"
AMT 200,Reciprocating Engines,7,"Description This course is designed to develop safety practices, comprehensive knowledge and"
AMT 210,Engine Fuel Systems,3,"Description This course is designed to develop correct safety practices, comprehensive"
AMT 212,"Engine Ignition, Starting and Electrical Systems",5,"Description This course is designed to develop correct safety practices, comprehensive"
AMT 213,Engine Lubrication Systems,2,"Description This course is designed to develop correct safety practices, comprehensive"
AMT 218,Engine Airflow and Fire Protection Systems,3,"Description This course is designed to develop correct safety practices, comprehensive"
AMT 224,Engine Maintenance and Operation,5,"Description This course is designed to develop correct safety practices, comprehensive"
AMT 227,Turbine Engines,6,"Description This course is designed to develop safety practices, comprehensive knowledge and"
AMT 231,Powerplant Review & Test,2,Description Upon completion of the Power plant curriculum this course is designed to prepare
AMT 233,Airframe I,4,"Description This course develops correct safety practices, comprehensive knowledge, and"
AMT 234,Airframe II,4,"Description This course develops correct safety practices, comprehensive knowledge, and"
AMT 235,Airframe III,5,"Description This course develops correct safety practices, comprehensive knowledge, and"
AMT 236,Airframe IV,5,"Description This course develops correct safety practices, comprehensive knowledge, and"
AMT 237,Airframe V,5,"Description This course develops correct safety practices, comprehensive knowledge, and"
AMT 238,Airframe VI,5,"Description This course develops correct safety practices, comprehensive knowledge, and"
AMT 239,Airframe VII,4,"Description This course develops correct safety practices, comprehensive knowledge, and"
AMT 251,Accelerated Certification - General/Powerplant,3,Description This review course assists the student in preparation for FAA testing for the
AMT 252,Accelerated Certification - General/Airframe/Powerplant,5,Description This review course assists the student in preparation for FAA testing for the
AMT 253,Powerplant I,4,"Description This course develops correct safety practices, comprehensive knowledge, and"
AMT 254,Powerplant II,5,"Description This course develops correct safety practices, comprehensive knowledge, and"
AMT 255,Powerplant III,5,"Description This course develops correct safety practices, comprehensive knowledge, and"
AMT 256,Powerplant IV,6,"Description This course develops correct safety practices, comprehensive knowledge, and"
AMT 257,Powerplant V,5,"Description This course develops correct safety practices, comprehensive knowledge, and"
ART 100,Art Appreciation,3,Description This course is designed to develop a personal appreciation of art. By combining a
BIO 100,Biology Review,1,Description This course is designed to help the students increase their knowledge concerning
BIO 110,Principles of Biology,5,"Description An introduction to fundamental biological concepts that includes molecular biology,"
BIO 120,Environmental Biology,3,Description An interdisciplinary study of the environment investigating how nature works and
BIO 125,Science Prospectus,3,Description An interdisciplinary study of how science influences all aspects of human life.
BIO 130,Biology I,5,"Description A study of the fundamental concepts in cellular and molecular biology, that lead to"
BIO 135,Biology II,5,Description A study of the fundamental concepts of biology as they apply to levels of
BIO 145,Human Anatomy & Physiology I,4,Description This course represents the first of an eight (8) credit hour Anatomy & Physiology
BIO 146,Human Anatomy & Physiology II,4,Description This course represents the second of an eight (8) credit hour Anatomy and
ARU 125,Advanced Assembly,4,Description Provides students with instruction in advanced assembly techniques including
ARU 110,Composite Fabrication,4,Description This course will begin with the fundamentals of composite theory in an interactive
ARU 115,Sheetmetal Assembly,4,"Description Provides instruction in the fundamentals of sheetmetal assembly, meeting set"
ARU 120,Composite Repair I,4,Description This course begins with an understanding of the inspection process during repair
ARU 130,Electrical Assembly,4,Description This course will provide students with hands-on experience with shop grade test
ARU 135,Electronics Basics,4,Description The student will learn methods of construction and repair of avionics system wiring
ARU 140,Composite Repair II,4,Description Students will expand on process an techniques introduced in composite repair I.
ARU 145,Machining Basics,4,"Description Students will learn to identify basic lines, views, and abbreviations used in blueprints,"
ARU 150,Advanced Measuring Instruments,4,"Description In this course, students will learn advanced measuring techniques that allow them to"
ARU 155,Aerospace Paint,4,"Description Students will learn the fundamentals of paint composition, application, and"
ARU 160,Process Mechanic,4,"Description Students will be trained in a variety of process including: masking, grinding,"
ARU 165,Aviation Fundamentals of Quality,4,Description This course is designed to familiarize the students with the concepts and practices of
ARU 170,Aviation Assembly Core,7,"Description In this course, students will engage with the critical aspects of Aviation"
AVC 102,Precision Instruments,1,Description This course provides students with the knowledge and skills needed to utilize
AVC 103,Geometric Dimensioning & Tolerancing,1,Description Provides an understanding of the basic terms and principles of Geometric
AVC 104,Quality Control Concepts,1,Description This course covers quality assurance principles including the history of the quality
AVC 105,Aircraft Familiarization,1,Description This course is designed to provide an introduction to the world of aviation. Using an
AVC 107,Fundamentals for Aerospace Manufacturing,1,Description This course provides an overview of the materials and processes used in
AVC 108,Aircraft Systems & Components,4,Description This course is designed to provide the aviation student with an in-depth knowledge
AVC 110,Safety/OSHA 10,1,Description The 10- Hour General Industry Outreach training Program is intended to provide
AVC 112,Blueprint Reading,2,Description This course is an introduction to reading and interpreting blueprints. Topics include
AVC 117,Hand & Power Tools,4,Course Information
AVC 120,Introduction to Sealing,1,"Description This course provides an introduction to basic sealing principles; including tools,"
AVC 125,Bonding and Grounding,1,"Description This course provides an overview of electrical bonding and grounding theory,"
AVC 127,Aviation Assembly Core,7,Description This course provides students with the core knowledge necessary to be successful
AVC 135,Hand Tools,1,Description This course provides an introduction to the various hand tools used in aerospace
AVC 137,Precision Measuring,2,Description This course provides students with the knowledge and skills needed to utilize
AVC 140,Electrical Bonding & Grounding,1,Description This course provides the specific technical and manufacturing skills and knowledge
AVC 145,Power Island,1,Description This course provides the technical knowledge and skills necessary to operate power
AVC 150,Human Factors,1,Description This course provides students with an overview of the impact of human factors on
AVC 155,Aircraft Manufacturing Advanced Fastening Practices,1,Description This course provides an overview of the knowledge and technical skills required for
AVC 160,Aircraft Control Surface Rigging,1,Description This course provides an overview of the knowledge and technical skills required to
AVC 165,Technical Writing,1,Description This course provides students with an overview of the process used to create
AVC 170,Conflict Resolution,1,Description This course provides the basics of good communication skills. Topics include the
AVC 190,Aerospace Applied Learning,4,Description The Aerospace Applied Learning course represents an educational strategy linking
AVT 101,Electricity & Electronics I,4,Description This course is designed to introduce the student to the fundamental concepts of
AVT 103,Avionics,3,Description This course is designed to give an overview of the entire avionics field. All Major
AVT 105,Avionics Systems & Troubleshooting,5,"Description This course introduces the student to avionics testing and troubleshooting. First,"
AVT 108,Wiring & Cannon Plug Lab,2,Description The student will learn methods of construction and repair of avionics system wiring
AVT 110,"Communication, Navigation & Surveillance Systems I",5,Description This course and its associated laboratory section is the first of two courses which
AVT 112,"Communication, Navigation & Surveillance Systems II",4,Description This course and its associated laboratory section continues the study of typical
AVT 122,Aircraft and Electronics for NCATT Applications,4,Description This class helps student increase the knowledge and skills required to troubleshoot
AVT 131,Electricity and Electronics II,4,Description This course is the continuation of AVT 101 and is designed to introduce the student
AVT 137,Fundamentals of Flight,3,Description The Fundamentals of Flight students will learn the basic forces acting on aircraft in
AVT 145,Troubleshooting Essentials,3,Description The Troubleshooting Essentials course instructs today’s Avionics technicians on a
AVT 150,UAS Operations,3,Description This course is an introduction to small unmanned aircraft systems (UAS) including
AVT 155,Advanced Wiring,3,Description The Advanced Wiring course will instruct students in the fabrication and installation
