code,title,credit,description
BIO 150,Human Anatomy & Physiology,5,Description A detailed study of the structure and function of the human body. Laboratory work
BIO 151,Anatomy & Physiology Enhancement,1,Description This course provides for an elaboration of either the anatomy or the physiology of
BIO 160,Microbiology,5,"Description An introduction to microorganisms and their morphology, physiology, genetics and"
CAT 101,CATIA Part Design & Sketcher,4,"Description This course provides an introduction to the 3D EXPERIENCE platform, including"
CAT 102,CATIA Drafting,4,Description This course covers the creation of engineering drawings. Students will be introduced
CAT 103,CATIA 3D Tolerancing & Annotations,4,"Description This course is for those interested in model based definition, where the 3D model is"
CAT 105,CATIA Assembly Design,4,Description This course covers the use of multiple parts to create an assembly. This includes
CAT 110,CATIA Wireframe & Surfaces,4,Description This course is an extension of the part environment which covers the use of
CAT 115,CATIA Prismatic Machining,4,Description This course is the beginning manufacturing course. This course covers the
CAT 120,CATIA ENOVIA LCA,3,Description This course provides students with a thorough background in the Enterprise
CAT 122,CATIA ENOVIA DMU,2,Description This course is intended for students who want to learn to view and analyze CAD
CAT 124,CATIA Surface Machining,3,Description This course is a continuation in the manufacturing environment. This course covers
CCP 100,Introductory Craft Skills,3,Description This course is the Core Curriculum for Introductory Craft Skills under the National
CCP 105,Carpentry Basics,4,Description This course is the curriculum for Carpentry Basics under the National Center for
CCP 110,"Floors, Walls, & Ceiling Framing",4,Description This course is the floor and wall framing curriculum under the National Center for
CCP 115,Roof Framing,3,Description This course covers the various kinds of roofs and instruction for laying out rafters for
CCP 120,"Windows, Doors, & Stairs",3,"Description This course is the curriculum for Windows, Doors, & Stairs under the National Center"
CCP 124,Exterior Envelope,3,Course Information
CCP 125,Commercial Drawings,2,Description This course is the curriculum for Commercial Drawings under the National Center for
CCP 128,Interior Systems,2,Description This course is the curriculum for Interior Systems under the National Center for
CCP 130,Roofing Applications,3,Description This course is the curriculum for Roofing Applications under the National Center for
CCP 134,Introduction to Concrete Construction,3,Description This course is the curriculum for Intro to Concrete Construction under the National
CCP 135,Thermal and Moisture Protection,1,Description This course is the curriculum for Thermal and Moisture Protection under the National
CCP 138,Advanced Framing,3,Description This course is the curriculum for Advanced Framing under the National Center for
CCP 140,Exterior Finishing,2,Description This course is the curriculum for Exterior Finishing under the National Center for
CCP 144,Advanced Finish and Trim,3,Description This course is the curriculum for Advanced Finish under the National Center for
CCP 145,Cold-Formed Steel Framing,1,Description This course is the curriculum for Cold-Formed Steel Framing under the National
CCP 147,Carpentry Blue Print Reading,2,Description This course is designed to give students knowledge of blueprint reading as it relates
CCP 148,Vertical and Horizontal Formwork,3,Description This course is the curriculum for Vertical and Horizontal Formwork under the
CCP 150,Drywall Installation and Finishing,2,Description This course is the curriculum for Drywall Installation and Finishing under the National
CCP 153,Carpentry Technical Drafting,1,"Description This course includes instruction in sketching and lettering, use of drafting equipment"
CCP 154,Finishing Concrete,2,Description This course is the curriculum for Finishing Concrete under the National Center for
CCP 155,FEMA Doors & Hardware,1,Description This course is the curriculum for Doors and Door Hardware under the National
CCP 170,Suspended Ceilings,1,Description This course is the curriculum for Suspended Ceilings under the National Center for
CCP 175,"Window, Door, Floor, and Ceiling Trim",2,"Description This course is the curriculum for Window, Door, Floor, and Ceiling Trim under the"
CCP 180,Cabinet Installation,1,Description This course is the curriculum for Cabinet Installation under the National Center for
CCP 185,Carpentry Internship I,3,Description In this course students will have the opportunity to link classroom/ lab theory with an
CCP 187,Carpentry Internship II,3,Description This course is a continuation of Carpentry Internship I in which students continue their work in experiential
CED 108,Word Processing,3,Description Emphasizes an intensive use of word processing software to create and revise
CED 115,Computer Applications,3,Description This course introduces students to the fundamental concepts and operations
CED 116,Advanced Word,2,Description Upon completion of this course students should understand the basic concepts of
CED 117,Advanced Excel,2,Description Upon completion of this course students should understand the basic concepts of
CED 118,Advanced PowerPoint,2,Description Upon completion of this course students should understand the basic essentials of
CED 120,Advanced Computer Applications,3,Description This course enhances computer literacy and meets the needs of students in
CFT 101,Introduction to Composites,2,Description This course provides students with the fundamentals of composite theory in an
CFT 106,Composite Finish Trim,2,Description This course provides students with an understanding of the processes and
CFT 107,Composite Assembly,2,Description Composite Assembly teaches the fundamentals of joining composite structures.
CFT 112,Composite Assembly I,1,Description Composite Assembly teaches the fundamentals of joining composite structures.
CFT 113,Composite Assembly II,1,Description Composite Assembly II continues the topics learned in Composite Assembly I. In
CFT 130,Composite Fabrication Methods /Applications,2,Description Fundamentals of composite structure fabrication methods and applications will be
CFT 135,Overview of Composite Inspection,1,Description This course is designed to provide students with an understanding of the inspection
CFT 140,Composite Inspection,2,Description This course is designed to provide students with an understanding of the inspection
CFT 141,Disassemble & Damage Removal Techniques,3,Description This course provides student with the knowledge required to safely and effectively
CFT 142,Composite Repair,4,Description This course is designed to provide students with the knowledge and techniques used
CFT 143,Complex Composite Repairs,3,Description This course is designed to provide the student with hands on experience working
CFT 144,Electrical Bonding Repair,1,Description This course will provide students with the knowledge and skills used in electrical
CHM 110,General Chemistry,5,"Description An introduction to chemistry that includes the study of matter, atoms, molecules,"
CHM 125,Chemistry I,5,"Description An introduction to inorganic chemistry with emphasis on atomic structure, molecular"
CHM 135,Chemistry II,5,"Description A continuation of CHM 125 Chemistry I. A presentation of the properties of solutions,"
CLD 118,Cloud Fundamentals,3,Description This course covers cloud services from a business perspective. This includes the
CLD 121,Object-Oriented Programming (JavaScript),3,Description JavaScript is a scripting language of the web. As the web evolves from a static to a
CLD 122,Introduction to Web Development,3,Description This course introduces students to basic web design using HTML (Hypertext Markup
CLD 123,DevNet I,3,Description The DevNet I course introduces the methodologies and tools of modern software
CLD 126,Test Driven Development (JavaScript),3,Description Programmers shouldn’t have to guess whether the software is working correctly.
CLD 129,Programming Foundations (Swift iOS),3,Description Programming Foundations (Swift iOS) will introduce students to the basics of
CLD 131,Continuous Integration Continuous Deployment - CICD,3,"Description Continuous delivery (CD) answers two difficult questions: ""How do we release"
CLD 137,C# Programming Language,3,Description C# is one of the most widely used general-purpose programming languages. As a
CLD 138,Object-Oriented Programming (Python),3,"Description Python is an interpreted, object-oriented, high-level programming language with"
CLD 141,Test Driven Development (Python),3,Description Programmers shouldn’t have to guess whether software is working correctly. They
CLD 143,Web Application Development I (HTML/CSS),3,Description CSS is a stylesheet language that allows you to control the appearance of your
CLD 147,Website Production & Management (Word Press),3,"Description This course is designed to teach students the necessary skills to build, customize,"
CLD 152,Web Application Development II (REACT),3,Description React is a JavaScript library for building user interfaces to fetch rapidly changing
CLD 153,Multi-Cloud Administration,3,"Description Cloud administrators must have an understanding of cloud services and architecture,"
CLD 156,Advanced Web Development (PHP),3,Description This course is designed to provide students with advanced skills in the area of Web
CLD 158,Multi-Cloud Development Services,3,"Description Cloud computing impacts all careers, and an awareness of the opportunities"
CLD 166,Cloud Application Development I (REACT on AWS),3,"Description Traditionally, companies have built and deployed web applications where they have"
CLD 168,AWS Cloud Practitioner,3,"Description To date, when it comes to market share Amazon Web Services currently holds"
CLD 169,Machine Learning and AI Foundations with Predictive Analytics,3,Description There is a lot to learn to stay on top of a rapidly expanding universe of AI and
CLD 170,Cloud Application Development II (Serverless REACT on AWS),3,Description Traditionally companies have built and deployed web applications where they have
CLD 175,Information Technology Internship,3,"Description In this course, students will have the opportunity to link classroom/lab theory with an"
CLD 177,AWS Solutions Architect Associate,3,"Description AWS certification is one of the most in-demand in the market, as it allows students to"
CLD 182,Microsoft Azure Administrator,3,Description Microsoft Azure is one of the leading enterprise-grade cloud computing platforms. In
CLD 185,Virtual Private Cloud Administration,3,"Description Most leading private clouds provide similar features. So, how can IT professionals"
CLD 187,Cloud Native Infrastructure (Kubernetes),3,Description Container technology caught the public’s attention with the introduction of Docker in
CLD 188,Cloud Data and DevOps Specialist (AWS),3,Description Amazon Web Services (AWS) is one of the most widely used cloud platforms and
CLD 191,Microsoft Enterprise O365 Administration,3,Description Microsoft 365 offers enterprises a complete business solution around cloud-based
CLD 193,Cloud DevOps Engineer I,3,Description DevOps is not a framework or a workflow. It's a culture that is overtaking the
CLD 196,Cloud DevOps Engineer II,3,Description DevOps is not a framework or a workflow. It's a culture that is overtaking the
CNU 010,Certified Nurse Aide Update,1,Description This course is for students who originally certified as a Nursing Assistant in the State
CPR 001,CPR for Healthcare Providers,1,Description Designed for practitioners whose primary work environment is in a clinical setting or
CWG 103,Blue Print Reading for Welders,2,Description Blue Print Reading for Welders gives instruction in the universal language of drawing
CWG 105,Welding Safety & Orientation,1,Description The primary purpose of this course is to introduce and familiarize new students with
CWG 110,Welding Applications,4,"Description In this course student will learn the basic elements of SMAW, GMAW and GTAW."
CWG 115,SMAW,3,"Description Through classroom and/or lab/shop learning and assessment activities, students in"
CWG 116,SMAW II,4,Description This course is designed to give students learning opportunities in the form of
CWG 120,GMAW,3,"Description Through classroom and/or shop/lab learning and assessment activities, students in"
CWG 121,GMAW II,4,"Description Through classroom and/or shop/lab learning and assessment activities, students in"
CWG 125,GTAW,3,"Description Through classroom and/or lab/shop learning and assessment activities, students in"
CWG 126,GTAW II,4,"Description Through classroom and/or shop/lab learning and assessment activities, students in"
CWG 130,Robotic Welding,1,Description This course is designed to give students learning Robotic Welding opportunities in
CWG 141,Oxy Acetylene Welding & Cutting,2,Description The Oxy-Acetylene Welding and Cutting Course is designed to introduce students to
CWG 145,Fabrication & Design,2,Description This course is designed to provide students with the opportunity to apply fabrication
CWG 149,Materials & Testing,2,Description Provides knowledge and skills in the areas of metallurgy and weld testing. Teaches
CWG 155,Flux Cored Arc Welding,4,"Description Through classroom and/or shop/lab learning and assessment activities, students in"
CWG 160,Welding Internship,4,Description The internship represents an educational strategy linking the classroom with the
CWG 242,SMAW D1.1 Qualification,4,Description Assists students in preparing to take the shielded metal arc welding (SMAW)
CWG 243,GMAW D1.1 Qualification,4,Description Assists students in preparing to take the gas metal arc welding (GMAW) qualification
ENG 010,College Reading Skills,3,Description This course is designed to equip students for success in the writing required during
ENG 020,Basic Writing Skills,3,"Description Enables students to construct complete simple, compound and complex sentences"
ENG 030,English,3,Description Designed to equip students for success in the writing required during academic
ENG 035,PACER English,5,"Description This course is designed to equip students for success in the writing, reading, and"
ENG 040,Bridge to College English,1,Description Bridge to College English is for students testing in the 46-68 range on the
ENG 100,Composition I Lab,1,Description This lab is designed for students to work in an adaptive setting based on their skills
ENG 101,Composition I,3,Description This course is designed to improve the reading and writing skills of students. The
ENG 110,Introduction to Literature,3,"Description This course is an introduction to the short forms of literature, designed to develop"
ENG 120,Composition II,3,Description This course is designed to immerse students in the study and practice of persuasive
ENG 205,Introduction to Creative Writing,3,Description In this course students will combine the writing and revising of original works with the
ENG 211,Introduction to Writing for Digital Media,3,"Description In this course, students will explore the writing genres associated with digital media"
FSI 101,King Air Maintenance Practical,3,Description This course is designed to provide Maintenance Technicians hands on training with
DAS 113,Dental Materials I,4,Description Covers identification of materials used in general dentistry; physical and chemical
DAS 114,Dental Radiology I,3,Description Fundamental concepts to acquire and utilize diagnostic intraoral radiographic
DAS 116,Introduction to General Anatomy and Physiology,2,Course Information
DAS 119,Dental Anatomy,2,"Description Demonstrate a fundamental knowledge of tooth and oral anatomy, head and neck"
DAS 120,Dental Science,2,"Description Students are provided with knowledge and basic dental pharmacology, management"
DAS 122,Chairside Assisting I,4,Description Introduction to the dental health profession and dental assisting. Provides students
DAS 140,Chairside Assisting II,2,Description Continuation of DAS122 Chairside Assisting I. This course will provide a foundation
DAS 147,Dental Practice Management,3,Description This course will provide instruction in additional business office procedures with an
DAS 148,Dental Materials II,2,Description This course is a continuation of DAS113 Dental Materials I and includes identification
DAS 149,Infection Control for Dental Practice,2,Description Introductory principles of microbiology: classification and characteristics of microbes
DAS 150,Clinical Experience,7,Description This course gives students the opportunity to apply and practice the principles and
DIS 150,Directed Individual Studies,4,Description Provides the instructor and student an opportunity to develop special learning
DMK 110,Introduction to Media Arts,3,"Description Offers an introduction to media arts and the interconnectedness of audio, film,"
DMK 120,Basic Digital Editing,3,"Description Introduction to skills, principles and ethics of using audio, images and video to tell"
DMK 125,Community Building and Management,3,Description Students will be equipped with the knowledge and skills needed to create and
DMK 135,Social Media Marketing and Management,3,"Description Students will be equipped with the relevant knowledge, perspective and practical"
DMK 140,Introduction to Audio/Visual Production,3,Description This course will provide students with the skills associated with production and
DMK 150,Search Engine Optimization & Marketing,3,Description This course is designed to introduce the student to the core concepts of Search Engine Optimization (SEO)
DMK 160,Introduction to Analytics,3,Description This course is designed to introduce students to the core concepts of digital analytics. The course will
DMK 163,Introduction to Digital Advertising,3,"Description Introduction to the skills, principles, and design of digital advertising that drives"
DMK 170,Digital Marketing Capstone,4,"Description In this project-based course, students will apply the skills and knowledge acquired throughout the Digital"
DMK 175,Digital Marketing Internship,4,Description The internship represents an educational strategy linking the classroom with the acquisition
ECO 105,Principles of Macroeconomics,3,Description This course explores the fundamental aspects of the United States economy
ECO 110,Principles of Microeconomics,3,Description Attention will be given to the methods of producing the goods and services that our
EDU 120,Introduction to Teaching,3,Description This is a preparation course introducing students to the field of teaching. Topics
EDU 121,Introduction to Teaching – Field Experience,1,Description This course provides an opportunity for hands-on experiences in a PreK-12
EDU 140,Children's Literature,3,Description This course introduces students to the literary and visual styles in Children’s
EDU 160,Educational Technology,3,Description This course will introduce students to a variety of technology used in educational
EDU 180,Educating Exceptional Students,3,Description This course introduces students to the strengths and needs of learners with
EDU 200,Classroom Management,3,Description This course will introduce students to best practices in classroom management and
EDU 210,Assessing Student Learning,3,Description This course will examine approaches to assessment and evaluation of student
EDU 220,Introduction to Teaching – Field Experience,1,Description This course provides an opportunity for hands-on experiences in a PreK-12
EDU 230,Art in the Elementary Classroom,3,Description Understanding visual artistic processes as they relate to the growth and
EDU 240,Music in the Elementary Classroom,3,Description This course is designed to prepare students for teaching music to children in grades
ELT 101,Fundamentals of Electronics Technology,3,Description This course is designed to introduce the student to the electronics profession through a review
ELT 103,Introduction to Programming,3,"Description This course is an introduction to computer concepts, logic, and computer"
ELT 105,DC Electronics,2,Description This course is designed to introduce the student to the fundamental concepts of
ELT 106,DC Electronics Lab,2,Description This laboratory course is designed to introduce the student to the fundamental
ELT 108,Fundamentals of Small UAS Operations,3,Description This course is an introduction to small unmanned aircraft systems (UAS) including
ELT 110,AC Electronics,2,Description This course is designed to introduce the student to the fundamental concepts of
ELT 111,AC Electronics Lab,2,Description This laboratory course is designed to introduce the student to the fundamental
ELT 115,Digital Electronics Fundamentals,2,Description This course is designed to provide students with the concepts and terminology
ELT 120,Solid State Electronics,2,Description This course is designed to introduce the student to the fundamental concept and
ELT 121,Solid State Electronics Lab,2,Description This course is designed to introduce the student to the fundamental concept and uses of
ELT 125,Introduction to Avionics,2,Description This course is designed to give an overview of the entire avionics field. All major
ELT 127,Wiring & Cannon Plug Lab,2,Description The student will learn methods of construction and repair of avionics system wiring
ELT 129,Advanced Wiring,4,Description The Advanced Wiring course will instruct students in the fabrication and installation
ELT 130,Avionics Systems & Troubleshooting,2,Description This course introduces the student to avionics testing and troubleshooting. Students
ELT 131,Avionics Systems & Troubleshooting Lab,2,Description This course is the laboratory component of ELT 130. The student will operate the
ELT 132,Fundamentals of Flight,3,Description The Fundamentals of Flight students will learn the basic forces acting on aircraft in
ELT 134,Principles of Troubleshooting,2,Description The Principles of Troubleshooting course instructs today’s aircraft maintenance
ELT 135,"Communications, Navigation, and Surveillance Systems I",2,Description This course and its associated laboratory section is the first of two courses which
ELT 136,"Communications, Navigation, and Surveillance Systems I Lab",3,Description This course is the laboratory component of ELT 135. The student will operate CAD
ELT 137,"Communications, Navigation, and Surveillance Systems II",2,Description This course and its associated laboratory section continues the study of typical
ELT 138,"Communications, Navigation, and Surveillance Systems II Lab",3,Description This course is the laboratory component of ELT 137. The student will construct and
ELT 140,Aircraft and Electronics for NCATT Applications,2,Description This class helps student increase the knowledge and skills required to troubleshoot
ELT 145,Integrated Circuits and Systems,2,"Description This course is designed to introduce the student to the uses of commerciallyavailable integrated circuit devices including operational amplifiers, oscillators, and"
ELT 146,Integrated Circuits and Systems Lab,2,Description This course is designed to introduce the student through lab experiments to the
ELT 150,Antennas and Wave Propagation,2,Description This course introduces the student to the basic principles of transmission lines and
ELT 151,Antennas and Wave Propagation Lab,3,Description This laboratory course is a companion to the course on antennas and wave propagation and
ELT 155,Electronic Communication Circuits and Systems,2,Description This course introduces the basic principles and operation of system components of
ELT 156,Electronic Communication Circuits and Systems Lab,3,Description This course is a laboratory companion course designed to introduce the student to
ELT 160,Microprocessor and Microcontroller Systems,2,Description This course is designed to introduce the student to the fundamental concepts and
ELT 161,Microprocessor and Microcontroller Systems Lab,3,Description This course is a laboratory companion course in microprocessors and microcontrollers. The
ELT 165,Electronic Measurement and Instrumentation,2,Description This course is designed to introduce the student to the fundamental concepts of
ELT 166,Electronic Measurement and Instrumentation Lab,3,Description This course is a laboratory companion course designed to introduce the student to
EMS 103,EMT 1,6,Description The EMT 1 course provides students with the academic and professional knowledge
EMS 104,EMT 2,6,Description The EMT 2 course provides students with the academic and professional knowledge
EMS 105,Emergency Medical Technician,12,Description The EMT course provides students with the academic and professional knowledge
EMS 115,Tactical Medicine,3,Description This course will cover tactical emergency medicine—the practice of emergency
ENT 110,Introduction to Entrepreneurship,3,Description The purpose of this course is to familiarize students with the world of small business.
ENT 115,Entrepreneurship II,3,Description The marketplace has changed dramatically over the last 20 years. To compete and
FOL 101,Spanish I,5,Description This course is designed to help the student increase their knowledge of Spanish
FOL 110,Spanish II,5,Description This course is designed to help the student increase their knowledge of Spanish
FOL 120,Essential Spanish for the Workplace,4,Description This course provides immediate access to functional Spanish language skills and
GEO 101,Principles of Geography,3,Description This course is designed to provide the student with an introduction of how geography
GRA 101,Certified Nurse Aide,5,Description Prepares students to be caregivers in nursing homes while working under the
