code,title,credit,description
GRA 119,Medication Aide,5,Description Focuses on the knowledge and skills needed for safe medication administration in
HEM 105,Sanitation and Safety,1,"Description In this course, students will study the basic principles of bacteriology, foodborne"
HEM 110,Hospitality Math,3,"Description Reviews the fundamentals of mathematics, including calculating percent, ratios,"
HEM 115,Introduction to the Hospitality Industry,3,"Description In this course, students will gain knowledge and develop an appreciation of the"
HEM 120,Hospitality Service Techniques,3,Description Defines and describes points of service in restaurant and banquet functions.
HEM 125,Food & Beverage Management Fundamentals,3,"Description Principal analysis of directing a food and beverage operation, with the examination of"
HEM 130,Introduction to Lodging Operations,2,Description The course provides students with an overview of the lodging industry and how its
HEM 135,Hospitality Human Resource Management,3,"Description Introduces the functions of human resource management including, planning,"
HEM 140,Hospitality Financial Management,3,Description Provides an understanding of basic accounting concepts and procedures relevant to
HEM 145,Fundamentals of Excellent Customer Service,3,Description This course is designed to prepare students for the professional world of customer
HEM 150,Food and Beverage Operations,3,Description Focuses on the management of food and beverage operations in hospitality
HEM 155,Front Office Management,3,Description This course introduces students to the Lodging Operations Front Office. Topics
HEM 160,Housekeeping and Environmental Services,3,Description Examines the role of supervisory functions in the housekeeping department.
HEM 165,Revenue Management,3,Description Revenue Management is critical to the hospitality industry due to the perishable
HEM 170,Sales,3,"Description The course introduces the principles, concepts, and systems utilized in the marketing"
HEM 175,Event Catering Strategies,3,"Description This course serves as an introduction to planning catering events, responsibilities of"
HEM 180,Event Industry Fundamentals,3,Description Overview of the event management industries. This course looks at the most up to
HEM 185,Event and Meeting Contracting,3,Description An introduction to the Meeting & Events industry where by contracts are a necessary
HEM 190,Event Support Systems,3,"Description In this course, students will examine event objectives and potential sponsorship"
HEM 195,Special Events and Meetings,3,"Description In this course, students will gain hands-on experience in event planning. Students"
HEM 200,Event Project Planning,3,Description This course provides an overview of project management as identification and
HEM 205,Alcohol Beverage Law,3,"Description This course will prepare students for bartending through the emphasis on ABC Laws,"
HEM 210,Beer and Spirits,3,"Description Introduction to history and methods of production for a variety of beer, spirits, and"
HEM 215,Food and Alcohol,3,"Description In this course, students will explore the complexity of pairing food and different types"
HEM 220,Beverage Promotion,1,Description This course is designed to provide the practical knowledge needed to manage a
HEM 225,Wine Fundamentals,3,"Description Through tasting, the student will develop an appreciation of different types of wine,"
HEM 230,Mixology,4,Description Create a wide variety of classic and everyday mixed drinks in a standard bar setting.
HEM 235,Hospitality Management Internship,4,Description This is a work-based learning course which enables students to develop practical
HHA 100,Home Health Aide,2,Description Prepares the certified nurse aide (CNA) to care for clients in community and home
HIS 110,United States History to 1877,3,"Description This course traces development of the United States, 1492 to 1876, including"
HIS 120,United States History since 1865,3,Description This course is designed to provide the student with an introduction to United States
HIS 130,World History I,3,Description This course provides an introduction to the birth and development of World History to
HIS 140,Humanities Prospectus,3,"Description This course combines humanities topics including art, religion, world history and U.S."
IND 105,Industrial Automation Test Equipment,3,Description This course is designed to provide students with the necessary skills to operate the
IND 106,Direct & Alternating Current,4,Description This course introduces direct current (DC) concepts and applications and the theory
IND 109,Basic Industrial Programmable Logic Controls,4,"Description This course introduces operational theory, systems terminology, PLC installations,"
IND 111,Foundations of Manufacturing,3,Description This course is designed to teach students the non-technical side of manufacturing
IND 116,Advanced Motor Controls,3,"Description This course provides instruction in two-wire motor control circuits using relays,"
IND 117,Variable Speed Motor Control,3,"Description This course provides instruction in the fundamentals of variable speed drives,"
IND 121,Mechanical Systems Reliability,3,Description This course provides understanding of mechanical energy transmission concepts
IND 123,Industrial Fluid Power,4,Description This course provides instruction in fundamental concepts and theories for safely
IND 130,Mechanical Systems,3,Description This course provides instruction in basic physics concepts applicable to mechanics
IND 131,Industrial Programmable Logic Controls (PLC),3,"Description This course examines types, installation and troubleshooting of programmable logic"
IND 132,Industrial Process Control,3,Description This course provides understanding of different types of process control systems like
IND 139,CNC Operation for Maintenance Applications,3,Description This course will train the student in the basic manual operation of CNC Machine
IND 145,Advanced Technologies in Predictive Maintenance,3,"Description Addresses regular routine predictive, testing, checking for wear and tear and"
INF 105,A+ Certification - Essentials,3,Description This course will prepare the student for entry level work in the Information
INF 110,A+ Certification - Application,3,Description This course will prepare the student for entry level work in the Information
INF 112,Network Essentials,3,Description This course teaches the fundamentals of networking. It covers how devices
INF 113,Introduction to Programming,3,Description Programmers are in higher demand today than ever before. Get the essential skills
INF 115,Network+ Part I,3,"Description This course prepares a student for entry level installing, maintaining, troubleshooting,"
INF 116,Network+ Part II,3,Description This is a continuation of INF 115 Networking Part 1. This class prepares students to
INF 118,Cloud Fundamentals,3,Description This course covers cloud services from a business perspective. This includes the
INF 120,Security+,3,Description This course prepares students for the CompTIA Security+ Certification exam.
INF 121,Object-Oriented Programming (JavaScript),3,Description JavaScript is a scripting language of the web. As the web evolves from a static to a
INF 122,Introduction to Web Development,3,Description This course introduces students to basic web design using HTML (Hypertext Markup
INF 123,DevNet I,3,Description The DevNet I course introduces the methodologies and tools of modern software
INF 126,Test Driven Development (JavaScript),3,Description Programmers shouldn’t have to guess whether the software is working correctly.
INF 127,Linux+ Part I,3,Description This course is the first of two courses to help prepare the student for the CompTIA
INF 128,Linux+ Part II,3,Description This is the second course in a series of two courses to help prepare the student for
INF 129,Programming Foundations (Swift iOS),3,Description Programming Foundations (Swift iOS) will introduce students to the basics of
INF 131,Continuous Integration Continuous Deployment - CICD,3,"Description Continuous delivery (CD) answers two difficult questions: ""How do we release"
INF 134,Server,3,Description This course prepares students for the CompTIA Server+ Certification exam. This
INF 136,Introduction to PowerShell,3,Description Introduction to PowerShell provides an overview and application of the next
INF 137,C# Programming Language,3,Description C# is one of the most widely used general-purpose programming languages. As a
INF 138,Object-Oriented Programming (Python),3,"Description Python is an interpreted, object-oriented, high-level programming language with"
INF 141,Test Driven Development (Python),3,Description Programmers shouldn’t have to guess whether software is working correctly. They
INF 142,Introduction to Storage Solutions,3,Description This course prepares student to maintain and optimize cloud
INF 143,Web Application Development I (HTML/CSS),3,Description CSS is a stylesheet language that allows you to control the appearance of your
INF 144,Virtualization,3,Description In this course students will learn how to implement and support virtualization of
INF 146,Powershell II,3,"Description In this course, students will gain the fundamental knowledge and skills to use"
INF 147,Website Production & Management (Word Press),3,"Description This course is designed to teach students the necessary skills to build, customize,"
INF 148,Computer Support Specialist Capstone Experience,1,Description The capstone course is designed to serve as a summative evaluation of the
INF 152,Web Application Development II (REACT),3,Description React is a JavaScript library for building user interfaces to fetch rapidly changing
INF 153,Multi-Cloud Administration,3,"Description Cloud administrators must have an understanding of cloud services and architecture,"
INF 155,Digital Forensics,3,Description Digital forensics is a branch of forensic science surrounding the recovery and
INF 156,Advanced Web Development (PHP),3,Description This course is designed to provide students with advanced skills in the area of Web
INF 157,Cyber Law and Ethics,3,Description Provide students with an overview of the common laws and ethical issues associated
INF 158,Multi-Cloud Development Services,3,"Description Cloud computing impacts all careers, and an awareness of the opportunities"
INF 160,Server Security,3,"Description Server Security is designed to provide the students with concepts to develop, deploy,"
INF 161,Introduction to Networks,3,Description Begin preparing for a networking career with this introduction to how networks
INF 164,"Switching, Routing, and Wireless Essentials",3,Description Delve further into the world of networking with the second CCNA course in a 3-
INF 165,Advanced Cyber Security,3,Description Advanced Cyber Security is designed to enhance students' knowledge of security
INF 166,Cloud Application Development I (REACT on AWS),3,"Description Traditionally, companies have built and deployed web applications where they have"
INF 167,"Enterprise Networking, Security, and Automation",3,Description Large enterprises depend heavily on the smooth operation of their network
INF 168,AWS Cloud Practitioner,3,"Description To date, when it comes to market share Amazon Web Services currently holds"
INF 169,Machine Learning and AI Foundations with Predictive Analytics,3,Description There is a lot to learn to stay on top of a rapidly expanding universe of AI and
INF 170,Cloud Application Development II (Serverless REACT on AWS),3,Description Traditionally companies have built and deployed web applications where they have
INF 174,Information Technology Capstone,3,"Description In this course students, will have the opportunity to link classroom/lab theory with a"
INF 175,Information Technology Internship,3,"Description In this course, students will have the opportunity to link classroom/lab theory with an"
INF 177,AWS Solutions Architect Associate,3,"Description AWS certification is one of the most in-demand in the market, as it allows students to"
INF 180,Advanced Network Security,3,Description Advanced Network Security is designed to provide the student advanced concepts in
INF 182,Microsoft Azure Administrator,3,Description Microsoft Azure is one of the leading enterprise-grade cloud computing platforms. In
INF 185,Virtual Private Cloud Administration,3,"Description Most leading private clouds provide similar features. So, how can IT professionals"
INF 187,Cloud Native Infrastructure (Kubernetes),3,Description Container technology caught the public’s attention with the introduction of Docker in
INF 188,Cloud Data and DevOps Specialist (AWS),3,Description Amazon Web Services (AWS) is one of the most widely used cloud platforms and
INF 191,Microsoft Enterprise O365 Administration,3,Description Microsoft 365 offers enterprises a complete business solution around cloud-based
INF 193,Cloud DevOps Engineer I,3,Description DevOps is not a framework or a workflow. It's a culture that is overtaking the
INF 196,Cloud DevOps Engineer II,3,Description DevOps is not a framework or a workflow. It's a culture that is overtaking the
INT 101,Interior Design Fundamentals,3,Description This course emphasizes the fundamentals of design by exploring design elements
INT 105,Blueprint Reading for Interior Design,3,Description This is an introduction to blueprints for interior construction and service systems.
INT 110,Color Theory,3,Description This course introduces the use of color for interior design. Emphasis is on color
INT 126,Textiles,3,"Description By the end of the semester, each student will know various soft materials and"
INT 127,Materials for Interior Environments,3,Description Explorations of various hard treatments used in design are covered in this course. By
INT 141,History of Furniture & Architecture,3,Description This course provides students with the historical foundation of architecture and
INT 155,Lighting Technologies,3,Description This is an introduction to the basics of lighting technologies used in interior design:
INT 160,Design Studio I,3,Description This course provides long and short-term projects that address real life design
INT 165,Design Studio II,3,Description This course provides long and short-term projects that address real life design
INT 166,AutoCAD for Interior Design,5,Description This course introduces computer-aided drafting (CAD). AutoCAD is used to set up
INT 168,Basic Chief Architect for Interior Design,3,Description Students use the computers to learn how to utilize three dimensional software to
INT 170,Business Practices & Portfolio Development,4,"Description This course covers client contracts, presentation skills, resource development,"
INT 173,Design Studio III,3,Description This is the third course in the Design Studios series. In this course students will
INT 175,Seminars for Interior Design,2,Description This course is designed to help the student increase their knowledge concerning professional
INT 190,Drafting for Interiors,3,Description This course is designed to help the student increase their knowledge concerning
INT 192,Illustration for Interior Design,3,Description This course is designed to help the student increase their knowledge of the
INT 193,Rendering for Interior Design,3,Description This course is designed to help the student increase their knowledge of the
INT 196,Interior Design Codes & Standards,3,"Description This course is designed to focus on the most current and widely used building codes,"
INT 216,Kitchen Design,3,Description This course is designed to help the student develop skills necessary to design
INT 217,Bath Design,3,Description This course is designed to help the student develop skills necessary to design bath
INT 218,Kitchen & Bath Design,3,Description This course is designed to help the student develop special considerations
LEN 100,Lean for Operations,3,Description This course is designed to familiarize the students with the concepts and practices of
LEN 105,Lean Culture - People Systems,3,Description This course has been developed to enable the student to understand the differences
LEN 106,Value Stream Alignment,3,Course Information
LEN 109,Lean for Engineering,3,Description This course is designed to familiarize the students with the concepts and practices of
LEN 110,Lean for Services - Offices,3,Description This course will teach students the basics of both Lean and Six Sigma and how
LGM 101,Principles of Logistics and Supply Chain Management,3,Description Introduction to the field of logistics and supply chain management. Includes
LGM 102,Inventory Control,3,"Description A study of inventory control concepts and techniques. Includes, cost concepts,"
LGM 103,Contracts and Freight Claims,3,Description A study of the considerations involved in the drafting and negotiation of freight and
LGM 104,Computerized Logistics,3,Description Analysis of the use of computers in the logistics industry and an introduction to
LGM 105,Warehouse Management,3,"Description Survey of warehouse function, process, organization and operations. Includes"
LGM 106,Transportation and Traffic Management,3,Description A study of the domestic freight transportation system. Includes demand for freight
LGM 107,Introduction to Purchasing,3,Description Survey of basic purchasing functions. Includes establishing requirements and
LGM 108,International Logistics,3,Description An introduction to the role of logistics in global business. Includes the economic and
LGM 190,Logistics and Supply Chain Internship,3,"Description Culmination of logistics program. Includes guidelines and procedures for workplace learning,"
LGM 196,Independent Study in Logistics and Supply Chain Management,3,Description Independent study projects or applied special interest projects in logistics and supply
MCD 101,Introduction to CAD I,3,Description This course introduces computer-aided drafting (CAD) and examines the hardware
MCD 102,Introduction to CAD II,2,Description This course is a continuation of Introduction to CAD I. All the skills taught in
MCD 104,Blueprint Reading for Drafting,2,"Description This course introduces the basic principles of print reading. Topics include line types,"
MCD 105,Technical Drafting I,1,"Description Includes instruction in sketching and lettering, use and care of drafting equipment,"
MCD 106,Precision Measuring,2,Description This course is designed to assist multiple technical training disciplines with the
MCD 110,Principles of Tool Design,2,Description Provides an understanding of the general methods of tool design with emphasis on
MCD 112,Industrial Materials & Processes,2,"Description Includes instruction in materials, measurement, specifications, design principles,"
MCD 114,Architectural Drafting & Design,3,"Description Includes instruction in freehand drawing, basic residential planning, creative design,"
MCD 115,Machine Drafting & Design,3,"Description Includes instruction in creative design, geometric construction, auxiliaries,"
MCD 121,Descriptive Geometry,3,"Description Students use computers to study descriptive geometry as it applies to drafting, and"
MCD 122,Architectural CAD,4,"Description Students use computers to study descriptive geometry as it applies to drafting, and"
MCD 124,Advanced AutoCAD,4,Description This course explores the three-dimensional construction and viewing capabilities of
MCD 130,Basic Solidworks,3,Description Students Learn how to use the SOLIDWORKS mechanical design automation software to
MCD 132,Basic Chief Architect/Architectural Desktop,3,Description Students use the computers to learn how to utilize three dimensional software to
MCD 133,Advanced Solidworks,3,Description Students Learn how to use the SOLIDWORKS mechanical design automation software to
MCD 134,Advanced Chief Architect/Architectural Desktop,3,Description Students use the computers to learn how to utilize three dimensional software to
MCD 137,Introduction to 3D Printing,2,Description This course seeks to provide the student with a basic understanding of the industrial
MCD 140,Drafting Technology Internship,4,Description Introduces students to the application and reinforcement of drafting and
MCD 201,Geometric Dimensioning & Tolerance,3,Description The Geometric dimensioning and tolerance course is an in-depth study designed to
MCD 205,Residential Drafting,3,Description Introduces architectural drawing skills necessary to produce a complete set of
MCD 206,Commercial Drafting & Design,3,Description Introduces commercial drawing skills necessary to produce construction drawings
MCD 210,Advanced Measuring,3,Description This course is designed to assist multiple advanced technical training disciplines with
MDU 010,Medication Aide Update,1,Description Provides the continuing education required every two years by the Kansas
MEA 101,Medical Professional Issues,2,Description Reviews the role and function of the Medical Assistant. This course focuses on the
MEA 113,Medical Administrative Aspects,4,Description Provides an introduction to the administrative skills needed for a medical office.
MEA 115,Insurance Billing & Coding,3,Description Explores the medical insurance system and related billing and coding. Students
MEA 116,Pharmacology Medication Administration,2,"Description Course focus is on medication dosage calculation, preparation and administration by"
MEA 121,Patient Care II,4,Description Focuses on expanding the knowledge and skills in Patient Care I. More complex and
MEA 125,Clinical Laboratory Procedures,4,Description This course addresses the role and function of the professional in the clinical
MEA 131,Medical Assistant Practicum,6,"Description Provides the opportunity to apply clinical, laboratory, and administrative skills in a"
MFG 100,Lean Manufacturing,3,Description This course is designed to familiarize the students with the concepts and practices of
MFG 125,Manufacturing Internship,1,Description The internship represents an educational strategy linking the classroom with the
MMG 113,Print Reading,3,"Description Student will learn to identify basic lines, views, and abbreviations used in blueprints,"
MMG 115,Machining I,3,"Description Students will learn to conduct job hazard analysis for conventional mills and lathes,"
MMG 116,Quality Control & Inspection,1,Description Students are introduced to the science of dimensional metrology and its applications
MMG 126,Machining II,3,"Description Students learn to perform basic trigonometric functions, and perform other"
MMG 130,Bench Work,1,Description In this course students will learn the importance of tool management and tool
MMG 131,Metallurgy,1,Description Students learn the metallurgical terms and definitions in an effort to understand the
MMG 132,Machine Tool Processes,1,Description This course provides students with the opportunity to demonstrate process and
MMG 135,Machining Fundamentals,3,Description This course will provide students with a solid foundation in all aspects of
MMG 140,Metrology,4,"Description Students will learn the proper operation, field verification, and measuring techniques"
MMG 154,Multi-Cell Operations,4,Description In this course students will learn robotic/automation principles needed to function in
MMG 155,CNC Lathe,3,Description Introduces students to two axis computer numerical control lathes machining. The
MMG 156,CNC Operations,3,Description Students will become acquainted with the history of Numerical Control (NC) and
MMG 158,CNC Controllers,2,Description This course introduces the basic operation of CNC controllers commonly found on
MMG 160,CNC Milling I,3,Description Students will gain practical experience in setting up and performing basic operations
MMG 164,Advanced Machining Processes,3,Description In this course students will apply knowledge and skills learned throughout the
MMG 170,Mastercam Mill 2 Axis,4,Description An introductory level course for Mastercam Software. This course will cover 3D
MMG 173,G D & T for Machining,3,Description The Geometric dimensioning and tolerance course is an in-depth study designed to
MMG 175,Mastercam Mill 3D Surface,4,Description This course introduces the methods used to create toolpaths for a CNC machining
MMG 180,Mastercam 4 & 5 Axis Mill,4,Description This course introduces the methods used to create 4 and 5 Axis toolpaths for a CNC
MMG 184,Multi-Axis Milling,4,Description This course will build on the concepts learned in the CNC Milling course and teach
MMG 225,Internship/Directed Work Study,4,Description This internship course offers students opportunities to be employed in their field with
MGT 106,Introduction To Human Resources,3,Description Comprehensive view of human resources within an organization. Students examine
MGT 111,Buiness Ethics,3,Description Provides students with an overview of business ethics and ethical management
MNF 110,CNC Basics,2,Description Students will acquire knowledge of Computer Numerical Control (CNC) machines
MNF 113,Blueprint Basics For Manufacturing,2,Description This course is an introduction to reading and interpreting blueprints. Topics include
MNF 115,Forklift Operations,1,Description This course is designed to train entry level workers in the correct use of a forklift to
MNF 120,Manufacturing Processes & Production I,3,Description This course provides the introduction in a three part series of instruction which is
MNF 125,Maintenance Training,4,Description In this course the student will learn how to monitor production equipment for both
MNF 130,Manufacturing Processes & Production II,3,Description In this course students continue their study of current manufacturing processes &
MNF 135,Electrical Concepts,3,Description In this course students will be introduced to basic electrical theory as it relates to the
MNF 140,Basic PLC's,3,"Description This course introduces operational theory, systems terminology, PLC installations, and"
