code,title,credit,description
ACC 2213,Principles of Accounting I,3,"Study of the fundamentals and application of financial accounting principles that relate to business.
The topics to be covered include the accounting cycle and accounting systems for service and merchandising businesses. Three hours lecture per week."
ACC 2223,Principles of Accounting II,3,"A continuation of ACC 2213. The topics to be covered include corporate accounting concepts, managerial accounting concepts and internal business decision making. Three hours lecture per week."
AGR 1214,Animal Science,4,"Fundamental principles and practical application of livestock, dairy, and poultry science. Origin,
history, characteristics, market classes, and grades of the major breeds of livestock and poultry. Four hours lecture per week."
AGR 1313,Plant Science,3,"Scientific principles as the basis for practice in producing, handling, processing, marketing, and utilizing agronomic and horticultural crops. Three hours lecture per week."
AGR 2713,Principles of Agricultural Economics,3,"Economic principles applied to production, value, prices, credit, taxation, land tenure, marketing,
international trade, and related problems affecting agriculture. Three hours lecture per week."
AMR 1112,Foundations of Officership,2,"Introduction to the personal challenges and competencies which are critical for effective leadership
in the Armed Forces. Students will examine the role of leadership, officership, and the Army profession as well as develop life skills such as goal settings, time management, physical fitness, and stress
management. The focus is on developing basic knowledge and comprehension of Army leadership
dimensions. Includes a leadership lab and recommended physical training. One hour lecture and two
hours laboratory per week."
AMR 1122,Basic Leadership,2,"Fundamental leadership and training techniques with exposure to setting direction, map reading,
problem-solving, presenting briefs and using effective writing skills. Students will explore dimensions of leadership attributes and core leader competencies in the context of practical, hands-on, and
interactive exercises. Considerable attention is also placed on improving physical fitness. Includes
a leadership lab and physical training. One hour lecture and two hours laboratory per week."
AMR 2113,Individuals Leadership Studies,3,"Develop effective military leadership skills: problem analysis, decision making, planning and organizing, delegation and control, and interpersonal conflict resolution. Includes a leadership lab and
physical training. Two hours lecture and two hours laboratory per week."
AMR 2123,Leadership and Teamwork,3,"An application of leadership skills with emphasis on: beliefs, values, ethics, counseling techniques,
map reading, land navigation, basic first aid, and group interaction. Includes a leadership lab and
physical training. Two hours lecture and two hours laboratory per week."
ART 1113,Art Appreciation,3,A course designed to provide an understanding and appreciation of the visual arts. Three hours lecture per week.
ART 1313,Drawing I,3,"Includes the study of the basic elements and principles of organization in two dimensions and the
selection, manipulation and synthesis of these components to create an organized visual expression.
Students will apply overlapping foreshortening and diminished scale. Black and white media will be
stressed. Required of art majors. Six hours laboratory per week."
ART 1323,Drawing II,3,"Continuation of skills from Drawing I with an introduction to color and further study of composition.
Required of art majors. Six hours laboratory per week."
ART 1433,Design I,3,"Introduction to the fundamentals of two-dimensional design with emphasis in black and white media.
Required of art majors. Six hours laboratory per week."
ART 1443,Design II,3,Continuation of Design I with emphasis in color theory. Required of art majors. Six hours of laboratory per week.
ART 1453,Three-Dimensional Design,3,"To provide students with an understanding of spatial form in three-dimensions through the use of
applied design elements and principles to studio problems in mixed media. Three hours lecture per
week."
ART 1513,Computer Art,3,"An introduction to the theory and practice of using the computer to create art. A study of methods
and applications utilizing the computer and selected software applications. Three hours lecture/lab
per week."
ART 1913,Art for Elementary Teachers,3,Development of essential concepts of children’s art education in compliance with the National Standards for Arts Education. Two hours of lecture and two hours of laboratory per week.
ART 2513,Painting I,3,An introduction to painting compositions and techniques. Six hours laboratory per week.
ART 2523,Painting II,3,"A further study in the compositions, techniques, and concepts in painting. Six hours laboratory per
week."
ART 2613,Ceramics I,3,"This course is directed toward an introduction to different aspects and materials of ceramic design.
Instruction covers forming and shaping by hand and by mechanical means, various kiln operations,
understanding the nature of clay and glazes, and an appreciation of functional and non-functional
forms. Six hours laboratory per week."
ART 2623,Ceramics II,3,"Continuation of skills introduced in Ceramics I. Emphasis on individual problem solving. Six hours
laboratory per week."
ART 2713,Art History I,3,"Survey course of historical background of art forms from Prehistoric to Renaissance. Emphasis is on
painting, architecture, and sculpture as related to history. Three hours lecture per week."
ART 2723,Art History II,3,Survey courses of historical background of art forms from Renaissance to present with special emphasis on contemporary expression. Three hours lecture per week.
ART 2811,Exhibition Class III,1,A continuation of ART 1821. One hour lecture per week.
ART 2821,Exhibition Class IV,1,A continuation of ART 2811. One hour lecture per week.
BAD 1113,Introduction to Business,3,"This course is designed to introduce students to the basic concepts of business. Main topics include
current business and economic environment, entrepreneurship, marketing, management, financial
management, and business careers. Three hours lecture per week."
BAD 2113,Introduction to International Business,3,"This course is an introduction to international business concepts and practices. Emphasis is placed
on understanding cultural differences and foreign exchange markets. Three hours lecture per week."
BAD 2323,Business Statistics,3,"Introduction to statistical methods of describing, summarizing, comparing, and interpreting data to
include probability distributions, sampling, estimation, confidence intervals, and hypothesis testing.
Three hours lecture per week."
BAD 2413,Legal Environment of Business,3,"An introduction to interrelationships of law and society, jurisprudence, and business. Topics include
an introduction to law, law of contracts, agency, and employment. Three hours lecture per week."
BAD 2713,Principles of Real Estate,3,"The course is an introduction to the nature of the real estate market, types of ownership of property,
contracts, and methods of transferal of title. Three hours lecture per week."
BAD 2723,Real Estate Law,3,"Designed to give the student a general background in the law of real property and the law of real
estate brokerage. Three hours lecture per week."
BAD 2813,Business Communications,3,"This course develops written and oral communication skills for future professionals among multicultural audiences with emphasis on principles of writing business messages, generating reports
and presentations, and preparing communications for employment. Three hours lecture per week."
BAD 2853,Business Ethics,3,An exploration of the ethical problems faced in business theory and practice through which the student will recognize and analyze ethical dilemmas and implement ethical decisions within the context of today’s business environment. Three hours lecture per week.
BAD 2413,Legal Environment of Business,3,"An introduction to interrelationships of law and society, jurisprudence, and business. Topics include
an introduction to law, law of contracts, agency, and employment. Three hours lecture per week."
BAD 2713,Principles of Real Estate,3,"The course is an introduction to the nature of the real estate market, types of ownership of property,
contracts, and methods of transferal of title. Three hours lecture per week."
BAD 2723,Real Estate Law,3,"Designed to give the student a general background in the law of real property and the law of real
estate brokerage. Three hours lecture per week."
BAD 2813,Business Communications,3,"This course develops written and oral communication skills for future professionals among multicultural audiences with emphasis on principles of writing business messages, generating reports
and presentations, and preparing communications for employment. Three hours lecture per week."
BAD 2853,Business Ethics,3,An exploration of the ethical problems faced in business theory and practice through which the student will recognize and analyze ethical dilemmas and implement ethical decisions within the context of today’s business environment. Three hours lecture per week.
BIO 1111,"Principles of Biology I, Lab",1,"A laboratory course for non-science majors that contains experiments and exercises that reinforce the
principles introduced in BIO 1113 Principles of Biology I, Lecture. Two hours laboratory per week."
BIO 1113,"Principles of Biology I, Lecture",3,"A lecture course for non-science majors that provides an introduction to the basic principles of modern biology and their relevance to modern life. Emphasis is placed on the nature and history of scientific thought, basic biological chemistry, cell biology, and genetics."
BIO 1121,"Principles of Biology II, Lab",1,"A laboratory course for non-science majors that contains experiments and exercises that reinforc the
principles introduced in BIO 1123 Principles of Biology II, Lecture. Two hours laboratory per week."
BIO 1123,Principles of Biology II,3,"A lecture course for non-science majors that emphasizes survey of the diversity of life, ecology, evolution, and an overview of organ systems. Three hours lecture per week."
BIO 1131,"General Biology I, Lab",1,"A laboratory course for science majors that contains experiments and exercises that reinforce the principles introduced in BIO 1133 General Biology I, Lecture. Two hours laboratory per week."
BIO 1133,"General Biology I, Lecture",3,"A lecture course for science majors that covers the major themes of biology, the scientific method,
chemistry relevant to biological systems, cell processes including photosynthesis and cellular respiration, cell division, genetics, and molecular genetics."
BIO 1141,"General Biology II, Lab",1,"A laboratory course for science majors that contains experiments and exercises that reinforce the
principles introduced in BlO 1143 General Biology II, Lecture. Two hours laboratory per week."
BIO 1143,"General Biology II, Lecture",3,"A lecture course for science majors that expands themes and concepts introduced in BIO 1133 General Biology I, while emphasizing the diversity of life. Topics covered include evolution, classification, ecology, detailed consideration of the domains of life and viruses, including their anatomy and
physiology."
BIO 1511,"Principles of Anatomy and Physiology, Lab",1,"A laboratory course that contains experiments and exercises that reinforce the principles taught in
BIO 1513 Principles of Anatomy and Physiology I, Lecture. Two hours laboratory per week."
BIO 1513,Principles of Anatomy and Physiology,3,"A lecture course that provides an introduction to the anatomical and physiological study of the human
body at the molecular, cellular, tissue, organ, and organ system levels. Organ systems covered in this
course are the integumentary, muscular, skeletal, and nervous system. Three hours lecture per week."
BIO 1613,Nutrition,3,"A lecture course covering the nutrients for normal growth and reducing risks of major chronic diseases and applied to the selection of food for ingestion, the process of digestion, assimilation, and
absorption, and their applications for health care providers. Three hours lecture per week."
BIO 1712,Biomedical Research I,2,"This course will provide hands on instruction of the necessary skills in order to prepare students
to launch a unique investigation in the area of biomedical research. This course focuses on the
structural basics such as literature reviews, elements of a research proposal/publication/presentation,
experimental design, analysis of data, and technical skills such as micropipetting, centrifugation,
spectrophotometric analysis, etc. Two hours lecture."
BIO 1722,Biomedical Research II,2,"This course will provide students with the opportunity to perform a unique investigation in the area
of biomedical research of data, and technical skills such as micropipetting, centrifugation, spectrophotometric analysis, etc. Two hours lecture."
BIO 2211,"Introduction to Marine Science, Lab",1,"A laboratory course that contains experiments and exercises that reinforce the principles introduced
in BIO 2213 Introduction to Marine Science, Lecture. Two hours laboratory per week."
BIO 2213,Introduction to Marine Science,3,"A lecture course providing an introduction to oceanography with an emphasis on the measurement of
physical, chemical, and biological aspects of the marine environment as well as functional morphol-ogy and taxonomy of local marine biota. Three hours lecture per week."
BIO 2411,"Zoology I, Lab",1,"A laboratory course that contains experiments and exercises that reinforce the principles introduced
in BIO 2413 Zoology I, Lecture. Two hours laboratory per week."
BIO 2413,Zoology I,3,"A lecture course that includes in-depth studies of phylogeny and classification systems, protozoa and
major invertebrate phyla. Three hours lecture per week."
BIO 2511,"Anatomy and Physiology I, Lab",1,"A laboratory course that contains experiments and exercises that reinforce the principles introduced
in BIO 2513 Anatomy and Physiology I, Lecture. Two hours laboratory per week."
BIO 2513,Anatomy and Physiology I,1,"A lecture course that covers the anatomical and physiological study of the human body as an integrated whole. The course includes detailed studies of biological principles; tissues; and the integumentary, skeletal, muscular and nervous systems. Three hours lecture per week. Credit, three semester
hours. (Corequisite: BIO 2511; Prerequisite: ACT composite of 18 or higher or successful completion
of BIO 1113/1111 or BIO 1133/1131, or BIO 1513/1511 with grade of C or higher.)
BIO 2521 Anatomy and Physiology II, Lab
A laboratory course that contains experiments and exercises that reinforce the principles introduced
in BIO 2523 Anatomy and Physiology II, Lecture. Two hours laboratory per week."
BIO 2523,"Anatomy and Physiology II, Lecture",3,"A lecture course that includes detailed studies of the anatomy and physiology of the human special
senses, endocrine, cardiovascular, lymphatic, and immune, respiratory, digestive, and urinary systems, as well as reproduction and development."
BIO 2611,"Cell Biology, Lab",1,"A laboratory course that contains experiments and exercises that reinforce the principles introduced
in BIO 2613 Cell Biology, Lecture. Two hours laboratory per week."
BIO 2613,Cell Biology,3,"A lecture course providing a comparative study of cell structures among plant, animal, and bacterial
systems. Three hours lecture per week."
BIO 2921,"Microbiology, Lab",1,"A laboratory course which provides experiments that reinforce principles introduced in the lecture
to include fundamental laboratory techniques in lab safety, microscopy, culturing, and identification
of microbes, and effectiveness of antimicrobial agents. Two hours laboratory per week."
BIO 2923,Microbiology,3,"A lecture course providing a comprehensive study of the microbial agents to include taxonomy,
metabolism, physiology and genetics, concepts of pathogenesis and immunity. Three hours lecture
per week."
CHE 1113,General Chemistry Survey (Basic),3,"A basic chemistry lecture course that covers terminology, measurements, atomic structure, nomenclature, chemical equations, and basic stoichiometry. (Does not satisfy core requirements in science
and math majors). Three hours lecture per week."
CHE 1211,"General Chemistry I, Lab",1,"A laboratory course that contains experiments and exercises that reinforce the principles introduced
in CHE 1213 General Chemistry I, Lecture. Two hours laboratory per week."
CHE 1213,General Chemistry I,3,"A lecture course that covers the fundamental principles of chemistry and their application. Chemical
nomenclature, chemical reactions, stoichiometry, anatomic structure, bonding theories, energy, periodic properties, and gas laws are among the topics discussed in depth. Three hours lecture per week."
MAT 1313,or MAT 1343 (CLIC A or semester class only).,1,"CHE 1221 General Chemistry II, Lab
A laboratory course that contains experiments and exercises that reinforce the principles introduced
in CHE 1223 General Chemistry II, Lecture. Two hours laboratory per week."
CHE 1223,General Chemistry II,3,"A lecture course that covers solutions, kinetics, equilibria, thermodynamics, acid-base chemistry,
and electrochemistry. Three hours lecture per week."
CHE 1311,"Principles of Chemistry, Lab",1,"A laboratory course that contains experiments and exercises that reinforce the principles introduced
in CHE 1313 Principles of Chemistry I, Lecture. This course cannot be substituted for CHE 1211."
CHE 1313,"Principles of Chemistry, Lecture",3,"A lecture course that emphasizes basic terminology, measurement, atomic structure, periodic table,
chemical bonding, stoichiometry, energy, and states of matter. This course cannot be substituted for
CHE 1213."
CHE 2421,"Organic Chemistry I, Lab",1,"A laboratory course that provides students with techniques to characterize, identify, purify, and synthesize organic compounds, as taught in CHE 2423 Organic Chemistry I, Lecture. Two hours laboratory per week."
CHE 2423,Organic Chemistry I,3,"A lecture course that covers carbon chemistry, bonding structure and behavior, aliphatic compounds,
stereochemistry, reaction mechanisms, and an introduction to spectroscopic methods. Three hours
lecture per week."
CHE 2431,"Organic Chemistry II, Lab",1,"A laboratory course that acquaints students with important manipulations and procedures, as well
as the preparation and study of aromatic and complex organic compounds being introduced in CHE
2433 Organic Chemistry II, Lecture. Two hours laboratory per week."
CHE 2433,Organic Chemistry II,3,"A lecture course that covers spectroscopy, aromatic compounds, carbonyl compounds and other complex compounds with emphasis on reactions, and their mechanisms. Three hours lecture per week."
COE 1010,Cooperative Education Work Experience I,3,"First supervised work experience performed in a job setting related to the student’s major field of
study.
COE 1020 Cooperative Education Work Experience II
Second supervised work experience performed in a job setting related to the student’s major field of
study.
COE 1030 Cooperative Education Work Experience III
Third supervised work experience performed in a job setting related to the student’s major field of
study.
COE 1040 Cooperative Education Work Experience IV
Fourth supervised work experience performed in a job setting related to the student’s major field of
study.
COM 1423 Introduction to Broadcasting
A historical overview of the development and operation of electronic and film media, including
a brief survey of mass communication theory and effects research. Three hours lecture per week."
COM 2463,Writing for the Electronic Media,3,"Introductory course to teach the basic skills of broadcast writing, reporting and production. Three
hours lecture per week."
COM 2483,Introduction to Mass Communications,3,"A study of the history, organization, and mechanics of various mass media. Designed to help the
student understand the role of mass media in life and in society. Three hours lecture per week."
CRJ 1313,Introduction to Criminal Justice,3,"History, development, and philosophy of law enforcement in a democratic society; introduction to
agencies involved in the administration of criminal justice; career orientation. Three hours lecture per
week."
CRJ 1323,Police Administration and Organization,3,"Principles of organization and administration in law enforcement as applied to law enforcement
agencies; introduction to concepts of organizational behavior. Three hours lecture per week."
CRJ 1363,Introduction to Corrections,3,"An overview of the correctional field, its origins, historical and philosophical background, development, current status, relationship with other facets of the criminal justice system. Three hours lecture
per week."
CRJ 2513,Juvenile Justice,3,"Organization, functions, and jurisdiction of juvenile agencies. Processing, detention, and disposition
of cases. Statutes and court procedures applied to juveniles. Three hours lecture per week."
CSC 1113,Computer Concepts,3,"This is an introductory digital competency course which includes concepts, terminology, operating
systems, electronic communications, security risks, digital ethics, and applications. Concepts are
demonstrated and supplemented by hands-on computer use. Three hours lecture/lab per week."
CSC 1123,Computer Applications I,3,"This course is designed to teach computer applications to include: word-processing, electronic
spreadsheet, database management, presentation design, and electronic communications. Three hours
lecture/lab per week."
CSC 1113,highly recommended),3,"CSC 1133 Computer Applications II
This course is a continuation of CSC 1123 with concentration on advanced computer applications
and emerging technology. Three hours lecture/lab per week."
CSC 1613,Computer Programming I,3,"Introduction to problem-solving methods and algorithm development; designing, debugging, branching, looping, scope rules, functions, input/output manipulation (to include text files), simple arrays,
and a variety of applications in an object-oriented programming language. Course has lecture with
integrated lab components. Three hours lecture/lab per week."
CSC 2134,Programming I with “C++”,4,"An introduction to problem solving methods, algorithm development, designing, debugging, and
documentation in C++ language with a variety of applications including: I/O statements, operators,
conditional, looping, methods/functions, and array processing. Course has a required lab component.
Four hours lecture/lab per week."
CSC 2144,Programming II with “C++”,4,"This course is designed to be a continuation of program and algorithm development and analysis;
search/sort methods, dynamic memory management, abstract data types and object-oriented design;
designing and debugging larger programs. Course has a required lab component. Four hours lecture/
lab per week."
CSC 2623,Computer Programming II,3,"This course is a continuation of the object-oriented language from CSC 1613. This includes advanced
program development, algorithm analysis, string processing, recursion, internal search/sort methods,
simple data structures, debugging, and testing of large programs. Course has lecture with integrated
lab components. Three hours lecture/lab per week."
CSC 2833,Discrete Structures,3,"This course includes topics from logic and mathematical reasoning, set theory, recursion, cominatorics, number theory, Boolean algebra, digital logic, and graph theory, which are fundamental to the
study of Computer Science. Three hours lecture per week."
CSC 2844,Data Structures,4,"This course includes advanced data abstraction and corresponding algorithms, memory management,
searching and sorting techniques, hash tables, and algorithm analysis. Four hours lecture/lab per
week."
ECO 2113,Principles of Macroeconomics,3,"The study of a nation’s economy to include the following topics: supply and demand, production
possibilities, monetary and fiscal policies, factors of production, GDP/business cycles and economic
growth, and circular flow of market economies. Three hours lecture per week."
ECO 2123,Principles of Microeconomics,3,"The study of firms, industries, and consumers to include the following topics: supply and demand,
elasticity of demand and supply, consumer choice theory, production and cost theory, and market
structures. Three hours lecture per week."
EGR 1112,Introduction to Engineering,2,"This course provides students with an introduction to engineering as a profession. Students will be
familiarized with the various career pathways in engineering as well as planning for success in their
chosen field. Two hours lecture per week."
EGR 1122,Introduction to Engineering Design,2,"This course provides students with an overview of the engineering process ranging from design and
planning to construction and testing through projects and mentoring. Two hours lecture per week."
EGR 2413,Engineering Mechanics I: Statics,3,"A lecture course covering the equilibrium of point objects and extended objects in two and three
dimensions using vector algebra. Also discussed are distributed forces, structures, friction, and moments of inertia in two and three dimensions. Three hours lecture per week."
MAT 1613,and PHY 2313),3,"EGR 2433 Engineering Mechanics II: Dynamics
A lecture course that covers kinematics of particles and rigid bodies, kinetics of particles and rigid bodies using force-mass-acceleration, energy, and momentum methods. Three hours lecture per
week."
