code,title,credit,description
ELT 2423,Solid State Motor Controls,3,"A course that deals with the principles and operation of solid state motor control. This course includes
instruction and practice in the design, installation, and maintenance of different solid state devices for
motor control. Two hours lecture and two hours laboratory per week."
ELT 2613,Programmable Logic Controllers,3,"Use of programmable logic controllers (PLCs) in modern industrial settings. Also, the operating
principles of PLCs and practice in the programming, installation, and maintenance of PLCs. Two
hours lecture and two hours laboratory per week."
ELT 2623,Advanced Programmable Logic Controllers,3,"An advanced PLC course which provides instruction in various operations, installations, and
maintenance of electric motor controls. Also, information in such areas as sequencer, program
control, block transfer used in analog input and output programming, and logical and conversion
instructions. Two hours lecture and two hours laboratory per week."
EMS 1118,Emergency Medical Technician,2,"This course includes responsibilities of the EMT during each phase of an ambulance run, patient
assessment, emergency medical conditions, appropriate emergency care, and appropriate procedures
for transporting patients. Five hours lecture, four hours lab and three hours clinical per week. Credit,
eight semester hours. (Pre or corequisites: Current American Heart Association BLS Heath-care
Provider card.)
EMS 1142 Foundations of Paramedicine
This course includes a comprehensive review of the knowledge base and
skill set of the Emergency Medical Technician. History of EMS, wellbeing of the EMT, medical legal issues, communication and documentation will be expanded to the
role of the paramedic. This course includes the theory related to intravenous/intraosseous access,
medication administration, patient assessment, and introductory pharmacological calculations. Two
hours lecture per week."
EMS 1151,Foundations of Paramedicine - Lab,1,"A laboratory experience designed to give psychomotor experience to the theoretical concepts
developed in the lecture. Two hours lab per week."
EMS 1242,Concepts of Airway and Respiratory Medicine,2,"This course integrates complex knowledge of anatomy, physiology, and pathophysiology into the
assessment to develop and implement a treatment plan with the goal of assuring a patient airway,
adequate mechanical ventilation, and respiration for patients of all ages. Two hours lecture per week."
EMS 1251,Concepts of Airway and Respiratory Medicine - Lab,1,"This course in corequisite with the lecture portion will integrate comprehensive knowledge of
anatomy, physiology, and pathophysiology into the assessment to develop and implement a treatment
plan with the goal of ensuring a patient airway, adequate mechanical ventilation, and respirations for
patients of all ages. Two hours lab per week."
EMS 1343,Concepts of Cardiovascular Medicine,3,"This course consists of the theory, anatomy, physiology, pathophysiology and treatments associated
with the conditions of the cardiovascular system. This includes the theory of introductory, advanced,
and multi-lead electrocardiogram interpretation. Changes in the lifespan will also be included. Three
hours lecture per week."
EMS 1352,Concepts of Cardiovascular Medicine - Lab,2,"A laboratory experience designed to give psychomotor experience to the theoretical concepts
developed in the lecture. Four hours lab per week."
EMS 1514,Practicum I,4,"Using supervised rotations in a definitive care setting, the students will apply the concepts developed
in the didactic and laboratory courses to live patients. This will include, but not be limited to, rotations in the emergency department, ICU, OR, respiratory therapy, and pediatrics. Twelve hours
clinical per week."
EMS 1525,Practicum II,5,"A continuation of EMS 1514. Using supervised rotations in a definitive care setting, the student will
continue to develop assessment and treatment skills. The student will transition to field experience
upon achieving competencies in the definitive care setting. Fifteen hours clinical per week."
EMS 1742,Concepts of Neurological Medicine,2,"This course consists of the theory, anatomy, physiology, pathophysiology and treatments associated
with conditions of the nervous system. This includes conditions related to structure and those
associated with organic and non-organic brain disease. Changes in the lifespan will also be included.
Two hours lecture per week."
EMS 1751,Concepts of Neurological Medicine - Lab,1,"A laboratory experience designed to give psychomotor experience to the theoretical concepts
developed in the lecture. Two hours lab per week."
EMS 1942,Concepts of Reproductive Medicine,2,"This course consists of the theory, anatomy, physiology, pathophysiology and treatments associated
with conditions of the reproductive system. The course includes care of the newborn as part of the
concepts in reproductive medicine. Changes in the lifespan will be included. Two hours lecture per
week."
EMS 1951,Concepts of Reproductive Medicine - Lab,1,"A laboratory experience designed to give psychomotor experience to the theoretical concepts
developed in the lecture. Two hours lab per week."
EMS 2343,Medical Emergencies of the Secondary Assessment,3,"This course will integrate patient assessment and assessment findings with principles of epidemiology
and pathophysiology across the lifespan. At the conclusion of this course, the student will be able to
formulate a field impression and implement a comprehensive treatment/disposition plan for a patient
with a medical complaint. Three hours lecture per week."
EMS 2351,Medical Emergencies of the Secondary Assessment - Lab,1,"This course will integrate patient assessment and assessment findings with principles of epidemiology
and pathophysiology across the lifespan. At the conclusion of this course, the student will be
able to perform a secondary assessment in order to formulate a field impression and implement a
comprehensive treatment/disposition plan for a patient with a medical complaint. Two hours lab per
week."
EMS 2566,EMS Practicum III,6,"Under the supervision of an approved program preceptor, the student will continue to apply the
concepts developed in the didactic, laboratory, and clinical settings to the care of patients in the
environment of EMS. Eighteen hours clinical per week."
EMS 2743,Concepts of Traumatic Medicine,3,"This course will develop the basis for the pathophysiology, identification, and treatment of traumatic
emergencies including coverage of concepts related to trauma systems and shock management.
These concepts will be examined in patients across the life span. Three hours lecture per week."
EMS 2752,Concepts of Traumatic Medicine - Lab,2,"The trauma laboratory experience is designed to give psychomotor experience to the theoretical
concepts developed in the lecture. Four hours lab per week."
EMS 2912,Concepts of EMS Operations,2,"Knowledge of operational roles and responsibilities to ensure safe patient, public, and personnel
safety. Two hours lecture per week."
EMS 2942,Paramedic Capstone,2,"This course serves as a capstone experience course at the end of the Paramedic Program. This course
will include the following topics: special needs patient populations, EMS research, principles of
public health, integration of leadership, and emerging roles in EMS. Two hours lecture per week."
EMS 2952,Paramedic Capstone - Lab,2,"This course will provide the student with a final opportunity to incorporate their cognitive knowledge
and psychomotor skills through cumulative practical skill evaluations and a comprehensive Final
Examination. Four hours lab per week."
HRT 1213,Sanitation and Safety,3,"Basic principles of microbiology, sanitation, and safety for a food service operation. Implementation
of sanitation procedures, cost control, and risk reduction standards in a hospitality operation are
covered. ServSafe Sanitation Certification from the National Restaurant Association or equivalent is
offered as a part of this course. Two hours lecture and two hours laboratory per week."
HRT 2623,Hospitality Human Resource Management,3,"This course is designed to explore the principles of hospitality human resource management with
an emphasis placed on the study of human behavior and human relations in the hospitality industry.
Two hours lecture and two hours laboratory per week."
HRT 2713,Marketing Hospitality Services,3,"Introduction to practical sales techniques for selling to targeted markets and developing strategic
marketing plans for hospitality and tourism operations. Two hours lecture and two hours laboratory
per week."
IAT 1113,Introduction to Automation and Control I,3,"This course is designed to introduce students to the fundamental skills associated with safety, basic
tools, special tools, and equipment. Two hours lecture and two hours laboratory per week. Credit,
three semester hours. (Prerequisite: Instructor Approved)
IAT 1123 Electrical Wiring for Automation Control Technology
Basic electrical wiring for automation and controls including safety practices; installation and maintenance of raceways, conduit, and fittings; and three-phase service entrances, metering
devices main panels, raceways or ducts, sub-panels, feeder circuits and branch circuits according to
electrical codes. Two hours lecture and two hours laboratory per week."
IAT 1133,AC/DC Circuits for Automation and Control,3,"Principles and theories with DC and AC circuits used in the automation trade. Includes the study of
electronic circuits, laws and formulas, and the use of test equipment to analyze AC and DC circuits.
Two hours lecture and two hours laboratory per week."
IAT 1143,Fluid Power for Automation and Control,3,"This basic course provides instruction in hydraulics and pneumatics. This course covers actuators,
accumulators, valves, pumps, motors, coolers, compression of air, control devices, and circuit
diagrams. Emphasis is placed on the development of control circuits and troubleshooting techniques.
Two hours lecture and two hours laboratory per week."
IAT 1153,Motor Control for Automation and Control,3,"This course includes the installation of different motor control circuits and devices. Emphasis is
placed on developing the student’s ability to diagram, wire, and troubleshoot the different circuits
and mechanical control devices. Two hours lecture and two hours laboratory per week. Credit, three
semester hours. (Prerequisite: Instructor Approved)
IAT 1163 Manufacturing Skills for Automation and Control
Manufacturing skills is the initial course designed to provide the student with the basic skills needed
to be successful in a high-performance manufacturing environment. The course covers 5 major
areas of knowledge that are considered critical for employment in a high-performance manufacturing
company. The topics covered include: Basic Computer Literacy, Blueprint Reading, Precision
Measurement, and an introduction to manufacturing improvement methods that covers Lean
Manufacturing, Quick Changeover, 5S, Teamwork and Problem solving. Two hours lecture and two
hours laboratory per week."
IAT 1173,Control Systems I for Automation and Control,3,"This is an introductory course to provide information on various instrumentation components and
processes. Topics include analyzing pressure processes, temperatures, flow, and level. Two hours
lecture and two hours laboratory per week."
IAT 2113,Programmable Logic Controller for Automation and Control,3,"This course provides instruction in the use of programmable logic controllers (PLCs) in modern
industrial settings. The operating principles, installation and basic programming of PLCs will
be covered. Two hours lecture and two hours laboratory per week."
IAT 2123,Control Systems II for Automation and Control,3,"This course is a continuation of Control Systems I with special emphasis on application of applied
skills along with new skills to develop instrument process controls. The student will be given a
process to develop the appropriate instruments and needed diagrams, utilizing various controlling
processes and demonstrating loop troubleshooting techniques. Two hours lecture and two hours
laboratory per week."
IAT 2133,Solid State Motor Controls for Automation and Control,3,"This course provides knowledge of the principles and operation of solid state motor control, and
variable frequency drives. The design, installation, and maintenance of different solid state devices
for motor control will be introduced. Two hours lecture and two hours laboratory per week. Credit,
three semester hours. (Prerequisite: Instructor Approved)
IAT 291 (1-3) Special Project in Automation and Control Technology
A course to provide students with an opportunity to utilize skills and knowledge gained in other
Automation and Control Technology courses. The instructor and student work closely together to
select a topic and establish criteria for completion of the project. Two, four or six lab hours per week."
IST 1113,Fundamentals of Information Technology,3,"Introduces microcomputer operation, word processing, spreadsheets, database management, and
online applications. This course is designed for students with limited computer proficiency and is to
be taken by those students in addition to the courses listed in the course sequence. Two hours lecture
and two hours laboratory per week."
IST 1124,IT Foundations,4,"This course covers the diagnosis, troubleshooting, and maintenance of computer components and
interpersonal communications for IT professionals. Topics include hardware compatibility, system
architecture, memory, input devices, video displays, disk drives, modems, printers, safety and
environmental issues, communication, and professional behavior. Two hours lecture and four hours
laboratory per week."
IST 1133,Fundamentals of Data Communications,3,"This course presents basic concepts of Internet Protocol (IP) telephony, local area networks, wide
area networks, data transmission, and topology methods. Two hours lecture and two hours laboratory
per week."
IST 1134,Fundamentals of Data Communications,4,"This course presents basic concepts of Internet Protocol (IP) telephony, local area networks, wide
area networks, data transmission, and topology methods. Two hours lecture and four hours laboratory
per week."
IST 1143,Principles of Information Security,3,"This course is an introduction to the various technical and administrative aspects of information
security and assurance. This course provides the foundation for understanding the key issues
associated with protecting information assets, determining the levels of protection and response
to security incidents, and designing a consistent, reasonable information security system with
appropriate intrusion detection and reporting features. Two hours lecture and two hours laboratory
per week."
IST 1153,Web and Programming Concepts,3,"This course is an introduction to Web site development and programming logic. Students will gain
hands-on experience in the development of computer programs. Upon completion of this course, students will be able to create a Web site and post it on the Internet. Two hours lecture and two hours
laboratory per week."
IST 1154,Web and Programming Concepts,4,"This course is an introduction to Web site development and programming logic. Students will gain
hands-on experience in the development of computer programs. Upon completion of this course,
students will be able to create a Web site and post it on the Internet. Two hours lecture and four hours
laboratory per week."
IST 1163,Database and SQL Concepts,3,"This course is an introduction to the design and manipulation of relational databases. Emphasis is
placed on creation, manipulation, extraction, and display of data from existing databases. QBE and
SQL are explored. Two hours lecture and two hours laboratory per week."
IST 1183,Essentials of Information Systems Technology,3,"This course covers the diagnosis, troubleshooting, and maintenance of computer components. Topics
include hardware compatibility, system architecture, memory, input devices, video displays, dish
drives, modems, and printers. Two hours lecture and two hours laboratory per week."
IST 1193,Practical Applications in Information Systems Technology,3,"This course will provide experience with operating systems. Emphasis will be placed on support
personnel interaction (communication and professional behavior) with the platform to assist users in
business environments. Topics on safety and environmental issues are included. Two hours lecture
and two hours laboratory per week."
IST 1214,Client Installation and Configuration,4,"This course is designed to help the student install, support and troubleshoot a current client operating
system. Emphasis will be placed on common user operations as well as the network administrator’s
support of the client. Two hours lecture and four hours laboratory per week."
IST 1223,Network Components,3,"This course presents local area network and wide area network connectivity. It focuses on
architectures, topologies, protocols, and transport methods of a network. Two hours lecture and two
hours laboratory per week."
IST 1134,Fundamentals of,3,"Data Communications)
IST 1243 Network Administration Using Microsoft © Windows© Server
This course focuses on the management of a computer network using the Microsoft© Windows ©
Server network operating system. Emphasis will be placed on daily administrative tasks performed
by a network administrator. Two hours lecture and two hours laboratory per week."
IST 1254,Network Administration Using Linux,3,"This course focuses on the management of a computer network using the Linux operating system.
Emphasis is placed on installation, configuration, implementation, and administrative tasks of a
functional server. Two hours lecture and two hours laboratory per week."
IST 1263,Microsoft® Office® Applications,3,"This course will introduce an operating system and word processing, spreadsheet, database
management, and presentation software application. Two hours lecture and two hours laboratory per
week."
IST 1723,Programming in Python,3,"This course is designed to provide an introduction to programming concepts and data informatics
using Python through lecture and a series of practical hands-on exercises. Two hours lecture and two
hours laboratory per week."
IST 1314,Visual BASIC Programming Language,4,"This introduction to the Visual BASIC programming language introduces the student to objectoriented programming and a graphical development environment. Two hours lecture and four hours
laboratory per week."
IST 1414,Client-Side Programming,4,"This course offers a comprehensive understanding of programming using JavaScript. Two hours
lecture and four hours laboratory per week."
IST 1423,Web Design Applications,3,"This course involves the application of various professional and personal Web design techniques.
Students will work with the latest WYSIWYG editors, HTML editors, animation/multi-media
products, and photo editors. Two hours lecture and two hours laboratory per week."
IST 1483,Fundamentals of Virtualization,3,"This course presents basic concepts of operating-system virtualization, server virutalization, cloning,
teams, and virtual networks. Two hours lecture and two hours laboratoy per week."
IST 1513,SQL Programming,3,"This course is the first of a two-part series that offers students an extensive introduction to data server
technology, covering the concepts of both relational and object relational databases and the structured
query language (SQL). Students are taught to retrieve data and produce readable output. Two hours
lecture and two hours laboratory per week."
IST 1613,Computer Forensics,3,"This course provides an introduction to the various technical and administrative aspects of computer
forensics and laws pertaining to cybercrime. This course provides the foundation for understanding
the key issues associated with computer forensic investigations, understanding the boot processes
and disk structure for multiple operating systems, and understanding the processes related to data
acquisition during investigations. Two hours lecture and two hours laboratory per week. Credit, three
semester hours. (Prerequisite: Instructor approved)
IST 1623 Network Security Fundamentals
This course provides the fundamental understanding of network security principles, implementations,
and the concepts, models, and technologies involved in creating a secure network environment.
Topics include, but are not limited to, authentication, types of attacks and malicious code, and best
practices for securing a network environment. Two hours lecture and two hours laboratory per week."
IST 1624,Network Security Fundamentals,4,"This course provides the fundamental understanding of network security principles, implementations,
and the concepts, models, and technologies involved in creating a secure network environment.
Topics include, but are not limited to, authentication, types of attacks and malicious code, and best
practices for securing a network environment. Two hours lecture and four hours laboratory per week."
IST 1633,Wireless Security and Privacy,3,"This course provides a fundamental understanding of wireless architecture, security principles, and
the technologies and principles involved in creating a secure wireless computer network environment.
Topics include wireless hardware, protocols, encryption, and how to prevent weaknesses in wireless
technology. Two hours lecture and two hours laboratory per week."
IST 1634,Wireless Security and Privacy,4,"This course provides a fundamental understanding of wireless architecture, security principles, and
the technologies and principles involved in creating a secure wireless computer network environment.
Topics include wireless hardware, protocols, encryption, and how to prevent weaknesses in wireless
technology. Two hours lecture and four hours laboratory per week."
IST 1643,Network Defense and Countermeasures,3,"This course provides a solid foundation of network security and the understanding of the process
to create a network defense and counter defense strategy measure policy to respond to intrusion
detection. Topics include network address translation, packet filtering, proxy servers, firewalls, and
virtual private networks used to design a network. Two hours lecture and two hours laboratory per
week."
IST 1644,Network Defense and Countermeasures,4,"This course provides a solid foundation of network security and the understanding of the process
to create a network defense and counter defense strategy measure policy to respond to intrusion
detection. Topics include network address translation, packet filtering, proxy servers, firewalls, and
virtual private networks used to design a network. Two hours lecture and four hours laboratory per
week."
IST 1723,Programming in Python,3,"This course is designed to provide an introduction to programming concepts and data informatics
using Python through lecture and a series of practical hands-on exercises. Two hours lecture and two
hours laboratory per week."
IST 2213,Network Security,3,"This course provides an introduction to network and computer security. Topics such as ethics, security
policies, legal issues, vulnerability testing tools, firewalls, and operating system hardening will be
discussed. Students will receive a deeper understanding of network operations and protocols through
traffic capture and protocol analysis. Two hours lecture and two hours laboratory per week. Credit,
three semester hours. (Prerequisite: Instructor approved)
IST 2223 Network Planning and Design
This course involves applying network concepts in planning and designing a functioning network.
Emphasis is placed on recognizing the need for a network, conducting an analysis, and designing
a solution. Two hours lecture and two hours laboratory per week."
IST 1223,Network Components),3,"IST 2233 Network Implementation
This course is the culmination of all concepts learned in the network curriculum. Topics include
planning, installation, evaluation, and maintenance of a network solution. Two hours lecture and two
hours laboratory per week."
IST 2223,Network Planning,3,"and Design)
IST 2253 Advanced Network Administration Using Microsoft© Windows© Server
This course is a continuation of Network Administration Using Microsoft© Windows© Server.
Emphasis is placed on installation, configuration, and implementation of a functional server. Two
hours lecture and two hours laboratory per week."
IST 2334,Advanced Visual BASIC Programming Language,4,"This course is a continuation of the Visual BASIC Programming Language course. Four hours lecture
and two hours laboratory per week."
IST 1314,Visual,4,"BASIC Programming Language)
IST 2344 Database Programming and Design
This course will introduce programming using a database management software application.
Emphasis will be placed on menus and file maintenance. Two hours lecture and four hours laboratory
per week."
IST 1163,Concepts of Database Design),4,"IST 2454 Mobile Application Development
The emergence of a new generation of highly-capable mobile devices and platforms has opened
up opportunities for application developers. Mobile development differs from conventional desktop
development in that mobile devices operate in a constrained world with smaller screens, slower
network connections, as well as limited memory and processing power Two hours lecture and four
hours laboratory per week."
IST 2483,Web Server,3,"This course introduces students to Web, email, and proxy servers and the platforms on which they
reside. Students will be able to install and configure Web, email, and proxy servers. Two hours
lecture and two hours laboratory per week."
