code,title,credit,description
HRPO 4312,Training and Development,3,"The course will emphasize the theories of management training and development, and the practical application of these theories in today’s organizations. Special emphasis will be on current topics in the field of human resource development including, but not limited to, training self-directed work teams, managing a diverse workforce, and the practical application of designing programs in today’s environment. This will include actually designing needs analysis and training evaluation programs. The course will frame the concept of training and development within the applicable theory of adult learning."
IMED 1316,Web Design I,3,"Instruction in web page design and related graphic design issues including mark-up languages, web sites, and browsers."
HRPO 4314,Compensation Management,3,"Design and administration of compensation systems. Deals with determinants of general level of pay, pay structures, wage and salary surveys, job analysis, job evaluation, performance evaluation, benefit plans, and financial incentive systems."
HRPO 4313,Employment Law and Collective Bargaining,3,"This course will provide an overview of statutory law, constitutional law, common law (includes case law), and administrative regulations governing the employment relationship. In addition, this course examines labor relations and collective bargaining, especially the three major processes: a) union organizing (how labor unions are formed), b) bargaining (how union contracts are produced), and c) dispute resolution (how bargaining disputes and grievances are resolved)."
HRPO 2301,Human Resources Management,3,College level reading and writing
HRPO 4311,Planning and Staffing,3,"This course examines concepts, strategies, and current issues in recruitment, talent acquisition, selection, retention, and the deployment of human capital to achieve strategic goals. Topics include but aren’t necessarily limited to the strategic importance of staffing; the staffing environment; human resource planning; job analysis and design; recruitment; applicant screening; employment testing; interviews; references; decision-making; employment contracts; methods of evaluation the hiring process; deployment; and retention."
HITT 1341,Coding and Classification Systems,3,"Study of word origin and structure through the introduction of prefixes, suffixes, root words, plurals, abbreviations and symbols, surgical procedures, medical specialties, and diagnostic procedures. Formerly POFM 1313. "
HITT 2335,Coding and Reimbursement Methodologies,3,"Development of advanced coding techniques with emphasis on case studies, health records, and federal regulations regarding prospective payment systems and methods of reimbursement."
HITT 1305,Medical Terminology I,3,"Study of word origin and structure through the introduction of prefixes, suffixes, root words, plurals, abbreviations and symbols, surgical procedures, medical specialties, and diagnostic procedures. Formerly POFM 1313."
HIST 2328,Mexican-American History II,3,"A survey of the historical, economic, social, and cultural development of Mexican-American people from the late nineteenth century to the present. When paired with"
HIST 2311,History of Western Civilization I,3,"A survey of the intellectual, political, and economic history of European-based civilization from pre-history to 1648."
HIST 2327,Mexican-American History I,3,"A survey course of the historical, economic, social, and cultural development of Mexican- American people from the earliest beginnings to the late nineteenth century. When paired with"
HIST 2312,History of Western Civilization II,3,"A survey of the intellectual, political, and economic history of European-based civilization from 1648 to the present."
HIST 1302,United States History from 1877 to Present,3,College-level reading and writing.
HART 2449,Heat Pumps,4,"Studies of heat pumps, heat pump control circuits, defrost controls, auxiliary heat, airflow, and other topics related to heat pump systems. NCCER credit available."
HIST 2301,Survey of Texas History,3,"A survey course in the cultural, economic, political, and social development of Texas from the aboriginal period to the present. May be substituted for"
HIST 1301,United States History to 1877,3,College-level reading and writing.
HART 2442,Commercial Refrigeration,4,"Theory of and practical application in the maintenance of commercial refrigeration; medium and low temperature applications, and ice machines. NCCER credit available."
HART 2445,Residential Air Conditioning Systems Design,4,"A study of the properties of air and results of cooling, heating, humidifying or dehumidifying: Heat gain and heat loss calculations including equipment selection and balancing the air system. NCCER credit available."
HART 2441,Commercial Air Conditioning,4,"A study of components, applications, and installation of air conditioning systems with capacities of 25 tons or less. NCCER credit available."
HART 2380,"Cooperative Education III - Heating, Air Conditioning, and Refrigeration Technicians",3,"Career related activities encountered in the student’s area of specialization offered through an individualized agreement among the college, employer, and student. Under supervision of the college and the employer, the student combines classroom learning with work experience. Includes a lecture component."
HART 1445,Gas and Electric Heating,4,Study of the procedures and principles used in servicing heating systems including gas fired furnaces and electric heating systems. NCCER credit available.
HART 2431,Advanced Electricity,4,"Advanced electrical instruction and skill building in installation and servicing of air conditioning and refrigeration equipment including detailed instruction in motors and power distribution, motors, motor controls, and application of solid-state devices."
HART 1441,Residential Air Conditioning,4,"Components, applications, and installation of mechanical air conditioning systems including operating conditions, troubleshooting, repair, and charging of air conditioning systems. NCCER credit available."
HART 1410,Shop Practices and Tools,4,"This course is an introduction to safety, tools, tubing operations, soldering and brazing techniques, piping and electrical soldering. Wiring practices. NCCER credit available."
HART 1407,Refrigeration Principles,4,"An introduction to the refrigeration cycle, heat transfer theory, temperature/pressure relationship, refrigerant handling, refrigeration components, and safety. NCCER credit available."
EPCT 1301,Hazardous Waste Operations and Emergency Response (HAZWOPER) Training,3,"Minimum certification requirements in the Code of Federal Regulations (CFR) for a hazardous waste site worker as found in 29 CFR-1910.120 and 40 CFR-264.16. Designed for persons with responsibilities in the hazardous waste management business, the course will be an in-depth study of Hazardous Waste Operations, and will explore best practices. It will provide 40- hour certification as well as regular academic credit."
ENVR 1302,Environmental Science II,3,"A study of the fundamental principles of environmental systems including biodiversity, agriculture, urbanization, and global climate change. Energy sources, pollution, waste management, and sustainable environmental solutions will also be discussed. An emphasis will be placed on local ecosystems and individual responsibility"
ENVR 1301,Environmental Science I,3,"A study of the fundamental principles of environmental systems including environmental chemistry, ethics, and economics. Human population growth, soils, toxicology, and resource management will also be discussed. An emphasis will be placed on local ecosystems and individual responsibility."
ENVR 1102,Environmental Science II Laboratory,1,"Successful completion of, or concurrent enrollment in"
ENGY 4301,Introduction to Energy Management,3,"This course provides students with an overview of the business of the modern energy industry. The course will provide students an in-depth understanding of the petroleum, natural gas, coal, power generation and alternative fuels market segments with a focus on structure, key business drivers, and technologies. The course will also explore key business issues facing the industry including sustainability, globalization and business/government relations."
ENVR 1101,Environmental Science I Laboratory,1,"Successful completion of, or concurrent enrollment in"
ENTC 1310,Fluid Mechanics with Applications,3,"This course presents the principles of fluid mechanics and the application of these principles to practical, applied problems. Emphasis of course will be on fluid properties, measurement of pressure, viscosity and density, and flow. Fluid power components and applications will also be introduced."
ENGY 4302,"Business Management, Planning, and Analysis in Energy",3,"This course examines analytical, economic, and financial concepts of the modern energy industry as they relate to planning and decision making, with a particular emphasis on oil and gas and power generation. An introduction to concepts and tools related to energy management program, energy audit, energy accounting, economic analysis, and energy conservation measures for systems that use energy."
ENGL 2341,Forms of Literature,3,"The study of one or more literary genres including, but not limited to poetry, fiction, drama, and film. Topics will vary by semester."
ENGL 2389,Academic Cooperative,3,"The Academic Cooperative (Creative Writing and Publishing Market) is a creative writing practicum to teach advanced creative writing students the practical aspects of working in a collaborative environment towards the goal of expressing themselves through creative writing in any genre or form and to learn the practical knowledge of forming and working as an editorial committee for the school journal,"
ENGL 2331,World Literature,3,"A survey of world literature from the ancient world to the present. Students will study works of prose, poetry, drama, and fiction in relation to their historical and cultural contexts. Texts will be selected from a diverse group of authors and traditions."
ENGL 2351,Mexican American Literature,3,"A survey of Mexican American/Chicanx literature from Mesoamerica to the present. Students will study literary works of fiction, poetry, drama, essays, and memoirs in relation to their historical, linguistic, political, regional, gendered, and cultural contexts. Texts will be selected from a diverse group of authors, literary movements, and media forms. Topics and themes may include the literary performance of identity and culture, aesthetic mediation of racialization, struggle and protest, and artistic activism."
ENGL 2328,Survey of American Literature: Civil War to the Present,3,"A survey of American literature from the Civil War to the present. Students will study works of prose, poetry, drama, and fiction in relation to their historical and cultural contexts. Texts will be selected from a diverse group of authors for what they reflect and reveal about the evolving American experience and character."
ENGL 2327,Survey of American Literature: Exploration to the Civil War,3,"A survey of American literature from the period of exploration and settlement through the Civil War. Students will study works of prose poetry, drama and fiction in relation to their historical and cultural contexts. Texts will be selected from a diverse group of authors for what they reflect and reveal about the evolving American experience and character."
ENGL 2323,Survey of British Literature: Late Romantic to the Present,3,"A survey of the development of British literature from the late Romantic period to the present. Students will study works of prose, poetry, drama, and fiction in relation to their historical and cultural contexts. Texts will be selected from a diverse group of authors and traditions."
ENGL 2322,Survey of British Literature: Anglo-Saxon to the 18th Century,3,"A survey of the development of British literature from the Anglo- Saxon period to the eighteenth century. Students will study works of prose, poetry, drama, and fiction in relation to their historical, linguistic, and cultural contexts. Texts will be selected from a diverse group of authors and traditions."
ENGL 2311,Technical and Business Writing,3,"The writing of professional communication for the scientific, business, and technical fields. Intensive study of and practice in professional settings. Focus on the types of documents necessary to make decisions and take action on the job, such as proposals, reports, instructions, email messages, letters, and oral reporting. Practice individual and collaborative processes involved in the creation of ethical and efficient documents."
ENGL 2307,Creative Writing,3,"Students learn techniques of imaginative writing with practical uses for publication, art, film, and music. May include fiction, nonfiction, poetry, screen-writing, or drama. Work will be reviewed in a friendly, supportive, and open environment that champions creativity and a willingness to explore different methods of artistic output."
ENGL 1302,Composition and Rhetoric II,3,"Intensive study of and practice in the strategies and techniques for developing research-based expository and persuasive texts. Emphasis on effective and ethical rhetorical inquiry, including primary and secondary research methods; critical reading of verbal, visual, and multimedia texts; systematic evaluation, synthesis, and documentation of information sources; and critical thinking about evidence and conclusions."
ENER 1350,Overview of Energy Resources,3,Introduction to the major sectors of the energy industry. Includes a comparison of energy industry careers. The student will be introduced to the equipment and operating systems used to generate electric power from a variety of energy sources. Special attention will be given to practical application of the principles of mathematics and physics used in the plant environment.
ENGL 0201,Seminar in Reading and Writing,2,A study of reading and writing in the Accelerated Learning Program. This course provides students with supplementary support while take ENGL 1301: Composition and Rhetoric I. Enrollment is limited to students who are TSI liable.
ENGL 0471,Fundamentals of Reading and Writing,4,This course integrates basic reading and writing skills for a variety of academic courses and assignments. Students will work on sentence and paragraph structure. Students who complete the ESL sequences through Community Education should take this course.
ENER 1240,Employee Success in Industry,2,"A study of successful employee characteristics and employer expectations in industry. Topics include benefits, career management, e-communications, personal financial management, soft skills, and job hunting skills. Addresses values, inclusion, and community/environmental roles."
EMSP 2434,Medical Emergencies,4,A detailed study of the knowledge and skills in the assessment and management of patients with medical emergencies.
EMSP 2444,Cardiology,4,"Assessment and management of patients with cardiac emergencies. Includes basic dysrhythmia interpretation, recognition of 12-lead EKGs for field diagnosis, and electrical and pharmacological interventions."
EMSP 2300,Methods of Teaching-Emergency Medical Service,3,Instruction in teaching methodology for instructors of emergency medical services. Prepares EMS instructors to effectively train students in one or more of the DOT/NHTSA curriculum packages.
EMSP 2330,Special Populations,3,A detailed study of the knowledge and skills necessary to reach competence in the assessment and management of ill or injured patients in nontraditional populations.
EMSP 2360,Clinical I - Paramedic,3,"A health-related work-based learning experience that enables the student to apply specialized occupational theory, skills, and concepts. Direct supervision is provided by the clinical professional."
EMSP 2265,Practicum - Paramedic,2,"A health-related work-based learning experience that enables the student to apply specialized occupational theory, skills, and concepts. Direct supervision is provided by the clinical professional. Concurrent ACLS training."
EMSP 2305,EMS Operations,3,Concurrent enrollment in
EMSP 2161,Clinical II - Paramedic,1,"A health-related work-based learning experience that enables the student to apply specialized occupational theory, skills, and concepts. Direct supervision is provided by the clinical professional. Concurrent ACLS training."
EMSP 2206,Emergency Pharmacology,2,Concurrent enrollment in
EMSP 2135,Advanced Cardiac Life Support,1,"Skill development for professional personnel practicing in critical care units, emergency departments, and paramedic ambulances. Establishes a system of protocols for management of the patient experiencing cardiac difficulties."
EMSP 2143,Assessment Based Management,1,"The capstone course of the EMSP program. Designed to provide for teaching and evaluating comprehensive, assessment-based patient care management. Includes specific care when dealing with pediatric, adult, geriatric, and special needs patients."
EMSP 1501,Emergency Medical Technician,5,Introduction to the level of Emergency Medical Technician (EMT) - Basic. Includes all the skills necessary to provide emergency medical care at a basic life support level with an ambulance service or other specialized services.
EMSP 1438,Introduction to Advanced Practice,4,An exploration of the foundations necessary for mastery of the advanced topics of clinical practice out of the hospital.
EMSP 1356,Patient Assessment and Airway Management,3,A detailed study of the knowledge and skills required to perform patient assessment and airway management.
EMSP 1355,Trauma Management,3,A detailed study of the knowledge and skills in the assessment and management of patients with traumatic injuries.
EMSP 1147,Pediatric Advanced Life Support - Neonatal Resuscitation,1,A course in the management of the pediatric patient experiencing difficulties in medical and/or trauma related emergencies.
EMSP 1260,Clinical - EMT,2,"A health-related work-based learning experience that enables the student to apply specialized occupational theory, skills, and concepts. Direct supervision is provided by the clinical professional."
EMSP 1261,Clinical - AEMT,2,"A health-related work-based learning experience that enables the student to apply specialized occupational theory, skills, and concepts. Direct supervision is provided by the clinical professional."
EMSP 1145,International Trauma Life Support,1,"Theory and skills necessary for the management of trauma emergencies as specified by International Trauma Life Support (ITLS) guidelines. Emergency field management, systematic rapid assessment, resuscitation, packaging, and transportation of patients. Includes experience necessary to meet initial course completion requirements."
ELTN 2380,Cooperative Education III - Electrician,3,"Career related activities encountered in the student’s area of specialization are offered through a cooperative agreement between the college, employer, and student. Under supervision of the college and the employer, the student combines classroom learning with work experience. Directly related to a technical discipline, specific learning objectives guide the student through the paid work experience."
ELTN 1381,Cooperative Education II - Electrician,3,"Career related activities encountered in the student’s area of specialization are offered through a cooperative agreement between the college, employer, and student. Under supervision of the college and the employer, the student combines classroom learning with work experience. Directly related to a technical discipline, specific learning objectives guide the student through the paid work experience."
ELTN 1380,Cooperative Education I- Electrician,3,"Career related activities encountered in the student’s area of specialization are offered through a cooperative agreement between the college, employer, and student. Under supervision of the college and the employer, the student combines classroom learning with work experience. Directly related to a technical discipline, specific learning objectives guide the student through the paid work experience."
ELPT 2355,Programmable Logic Controllers II,3,Advanced concepts in programmable logic controllers and their applications and interfacing to industrial controls.
ELPT 2347,Electrical Testing and Maintenance,3,"Proper and safe use of electrical power equipment test devices and the interpretation of test results. Includes protective relay testing and calibration, direct current (DC) testing, insulation power factor testing, and medium voltage switchgear."
ELTN 1343,Electrical Troubleshooting,3,"Maintenance, operation, troubleshooting, and repair of circuits of various residential, commercial, and industrial electrical systems. NCCER credit available."
ELPT 2350,Maintenance Electrician Exam Review,3,General requirements and fundamentals of electrical maintenance with emphasis on wiring methods and electrical theory. NCCER credit available.
ELPT 2339,Electrical Power Distribution,3,"A study of the design, operation, and technical details of modern power distribution systems including generating equipment, transmission lines, plant distribution, and protective devices. Also includes calculations of fault current, system load analysis, rates, and power economics."
ELPT 2343,Electrical Systems Design,3,"Skill development in the electrical design of a commercial or industrial project including layout, types of equipment, placement, sizing of electrical equipment, and all electrical calculation according to the requirements of the National Electrical Code (NEC). NCCER credit available."
ELPT 2337,Electrical Planning and Estimating,3,"Planning and estimating for residential, commercial, and industrial wiring systems. Includes a variety of electrical techniques."
ELPT 2319,Programmable Logic Controllers I,3,"Fundamental concepts of programmable logic controllers, principles of operation, and numbering systems as applied to electrical controls. NCCER credit available."
ELPT 2323,Transformers,3,"Transformer types, construction, connections, protection, grounding and associated safety procedures. NCCER credit available."
ELPT 2305,Motors and Transformers,3,"A study of the principles of operation of single and three phase motors and transformers. Topics include transformer banking, power factor correction, and protective devices. NCCER credit available."
ELPT 2301,Journeyman Electrician Exam Review,3,Preparation for journeyman electrician licensure with emphasis on calculations and the National Electrical Code (NEC). Success in this course does not guaranty a passing score on the Journeyman Electrician Exam.
ELPT 1429,Residential Wiring,4,"Wiring methods for single family and multi-family dwellings. Includes load calculations, service entrance sizing, proper grounding techniques, and associated safety procedures. For students who have no employment experience in industrial and commercial electricity. NCCER credit available."
ELPT 1445,Commercial Wiring,4,"Commercial wiring methods. Includes overcurrent protection, raceway panel board installation, proper grounding techniques, and associated safety procedures. For students who have no employment experience in industrial and commercial electricity. NCCER credit available."
ELPT 1345,Commercial Wiring,3,"Commercial wiring methods. Includes overcurrent protection, raceway panel board installation, proper grounding techniques, and associated safety procedures. NCCER credit available."
ELPT 1321,Introduction to Electrical Safety and Tools,3,"A comprehensive overview of safety rules and regulations and the selection, inspection, use, and maintenance of common tools for electricians."
ELPT 1419,Fundamentals of Electricity I,4,"An introduction to basic direct current (DC) theory including electron theory and direct current application. Compares and contrasts DC and AC theory and applications such as power generation, distribution, transformers, and motors. For students who have no employment experience in industrial and commercial electricity. NCCER credit available."
ELPT 1357,Industrial Wiring,3,"Wiring methods used for industrial installations. Includes motor circuits, raceway and bus way installations, proper grounding techniques, and associated safety procedures. NCCER credit available."
ELPT 1329,Residential Wiring,3,"Wiring methods for single family and multi-family dwellings. Includes load calculations, service entrance sizing, proper grounding techniques, and associated safety procedures. NCCER credit available."
EDUC 2301,Introduction to Special Populations,3,"A pre-service course that provides an overview of schooling and classrooms from the perspectives of language, gender, socioeconomic status, ethnic and academic diversity and equity, along with content experiences that provides students with observational opportunities with special populations P-12."
ELPT 1319,Fundamentals of Electricity I,3,An introduction to basic direct current (DC) theory including electron theory and direct current application. NCCER credit available.
ECRD 1211,Electrocardiography,2,"In this course, students will learn fundamentals of cardiovascular anatomy and physiology including basic electrocardiography procedures, interpretation of basic dysrhythmias, and appropriate treatment modalities."
EDUC 1300,Learning Framework,3,"The course is designed to introduce students to psychological theories of learning, cognition and motivation to serve as a conceptual basis for college-level student academic strategies. Activities are designed to help the student promote and apply newly learned study strategies and skills. Credit will not be given for both"
