code,title,credit,description
TMGT 3325,"Legal Issues, Ethics and Corporate Responsibility",3,This course will provide students with a practical understanding of how federal and state laws influence management behaviors and the importance of considering the ethical and social responsibility implications associated with management decision-making in public and private sector organizations.
TMGT 3303,Communications and Conflict Resolution for Technical Managers,3,"Study and application of technical writing, business presentations, team building, interviewing, and business etiquette and professionalism. Also includes an investigation of the nature of conflict and the methods to resolve conflict with an emphasis on collaborative problem solving and mediation"
TMGT 3307,Operations Management,3,"This course is an introduction to the concepts, principles, problems, and practices of operations management. Emphasis is on managerial processes for effective operations in both goods-producing and service-rendering organizations. Topics include operations strategy, process design, capacity planning, facilities location and design, forecasting, production scheduling, inventory control, quality assurance, and project management. The topics are integrated using a systems model of operations of an organization."
TMGT 3311,Information Technology in Enterprise Management,3,"The use of information technology in commercial and industrial enterprises. Topics include the use of computers and software in communication, accounting, inventory management, production, automation, sales, and financial forecasting."
TMGT 3305,Management and Organizational Behavior,3,"This course provides a comprehensive analysis of individual and group behavior in organizations. Its purpose is to provide an understanding of how organizations can be managed more effectively and at the same time enhance the quality of employees’ work life. Topics include motivation, goal setting and rewards, job design, group dynamics, work stress, power and politics, international aspects of organizations, organizational structure, decision-making, communication, and organizational change and development."
TECM 1401,Industrial Mathematics,4,"Math skills applicable to industrial occupations. This course is designed for students who need a review in mathematics and who plan to learn a technical skill. Includes fraction and decimal manipulation, measurement, percentage, and problem solving techniques for equations and ratio/proportion applications. In addition, the essentials needed in technical and trade programs are covered in the areas of basic algebra, basic geometry, right triangle trigonometry and an introduction to the concepts of statistics."
TECA 1354,Child Growth and Development,3,"A study of the physical, emotional, social, and cognitive factors impacting growth and development of children through adolescence."
TECA 1311,Educating Young Children,3,"An introduction to the education of the young child, including developmentally appropriate practices and programs, theoretical and historical perspectives, ethical and professional responsibilities, and current issues. Course includes a minimum of 16 hours of field experiences with children from infancy through age 12."
TECA 1303,"Families, School, and Community",3,"A study of the child, family, community, and schools, including parent education and involvement, family and community lifestyles, child abuse, and current family life issues. Course includes a minimum of 16 hours of field experiences with children from infancy through age 12."
TECA 1318,Wellness of the Young Child,3,"A study of the factors that impact the well-being of the young child including healthy behavior, food, nutrition, fitness, and"
SRVY 2348,Plane Surveying,3,"Surveying instruments, basic measuring procedures, vertical and horizontal control, and traverse closure."
SPCH 1321,Business and Professional Communication,3,"Study and application of communication skills applicable to the business and professional context. Special emphasis will be given to communication competencies in speaking, collaborating, presenting, and writing in technologically mediated formats. Students will develop self-confidence in speaking, implement analytical and organizational skills, build arguments and use creativity to make persuasive and artful presentations."
SPCH 1318,Interpersonal Communication,3,"Application of communication theory to interpersonal relationship development, maintenance, and termination in relationship contexts including friendships, romantic partners, families, and relationships with co-workers and supervisors."
SPCH 1311,Introduction to Speech Communication,3,College-level reading and writing
SPAN 2312,Intermediate Spanish II,3,"The consolidation of skills acquired at the introductory level. Further development of proficiency in listening, speaking, reading, and writing. Emphasis on comprehension, appreciation, and interpretation of the cultures of the Spanish-speaking world."
SPCH 1315,Public Speaking,3,"Application of communication theory and practice to the public speaking context, with emphasis on audience analysis, speaker delivery, ethics of communication, cultural diversity, and speech organizational techniques to develop students’ speaking abilities, as well as ability to effectively evaluate oral presentations."
SPAN 2311,Intermediate Spanish I,3,"The consolidation of skills acquired at the introductory level. Further development of proficiency in listening, speaking, reading, and writing. Emphasis on comprehension, appreciation, and interpretation of the cultures of the Spanish-speaking world."
SPAN 1412,Beginning Spanish II,4,"Continued development of basic Spanish language skills in listening, speaking, reading, and writing within a cultural framework. Students acquire the vocabulary and grammatical structures necessary to communicate and comprehend at the high beginner to low intermediate level."
SPAN 1411,Beginning Spanish I,4,"Basic Spanish language skills in listening, speaking, reading, and writing within a cultural framework. Students will acquire the vocabulary and grammatical structures necessary to communicate and comprehend at the beginning level."
SOCI 2319,Minority Studies,3,"This course studies minority-majority group relations, addressing their historical, cultural, social, economic, and institutional development in the United States. Both sociological and social psychological levels of analysis will be employed to discuss issues including experiences of minority groups within the context of their cultural heritage and tradition, as well as that of the dominant culture. Core concepts to be examined include (but are not limited to) social inequality, dominance/subordination, prejudice, and discrimination. Particular minority groups discussed may include those based on poverty, race/ethnicity, gender, sexual orientation, age, disability, or religion."
SOCI 2301,Sociology of Marriage and Family,3,"A study of underlying factors which often pre-determine success or failure in courtship, mate selection, and marital adjustments; sex role identifications, handling family finances, parenthood, child training, causes of marriage failure, and post-divorce adjustments."
SPAN 1300,Conversational Spanish I,3,Basic practice and production of the spoken language. This course emphasizes speaking and listening with some minimal practice in reading and writing. Cultural topics will also be discussed. This course may be adapted for travel and/or work.
SOCI 1306,Social Problems,3,College-level reading and writing.
SOCI 1301,Introduction to Sociology,3,College-level reading and writing.
SCLM 4313,Principles of Logistics Management,3,"This course is an analysis of the logistics function as a total system including inventory, transportation, order processing, warehousing, material handling, location of facilities, customer service, and packaging. Trade-offs and the interaction of various system components are explored."
SCLM 4312,Principles of Supply Chain Management,3,"This course provides a general knowledge of supply chain management (SCM) and the associated functions necessary for efficient, cost-effective delivery of goods and services to customers. Technology, tools, and practices of modern integrated materials management and logistics are examined. Topics include, master scheduling, materials requirements planning, scheduling, enterprise resource planning, purchasing, distribution requirements planning, just-in-time, and inventory management."
SCLM 4330,Applied Quality Management in Manufacturing,3,"This course provides students with the knowledge and techniques required to improve product quality and process efficiency by identifying and measuring production process variability, which, if not successfully addressed, leads to inconsistent product quality, costly wastage, non-standardization, and other reliability and productivity problems."
SCLM 4314,Warehouse and Distribution Management,3,"Study of an organization’s warehousing and distribution systems. Topics will include warehouse layout and design, storage and handling techniques, distribution strategies, distribution requirements planning (DRP), enterprise resources planning (ERP) system, warehouse management system (WMS), performance metrics, customer service considerations, and safety concerns across various types of distribution facilities."
SCLM 4311,Purchasing and Global Sourcing,3,"This course examines the role and activities of strategic sourcing and operational purchasing. It addresses purchasing operations and structures, strategic sourcing processes and the critical supply chain elements of managing supply chain inventory, information systems, and supplier performance. It will cover inventory control, purchase orders, the importance of documentation, plus purchasing procedures."
RNSG 2361,Clinical Nursing III (LVN-ADN Track),3,"A health-related work-based learning experience enabling students to apply specialized occupational theory, skill, and concepts. Direct supervision provided by clinical professionals. Course designated for the licensed vocational nurse transitioning to professional practice."
RNSG 2360,Clinical Nursing III,3,"A health-related work-based learning experience enabling students to apply specialized occupational theory, skill, and concepts. Direct supervision provided by clinical professionals."
RNSG 2460,Clinical Nursing IV,4,"A health-related work-based learning experience enabling students to apply specialized occupational theory, skill, and concepts. Direct supervision provided by clinical professionals."
RNSG 2362,Clinical Nursing IV (LVN-ADN Track),3,"A health-related work-based learning experience enabling students to apply specialized occupational theory, skill, and concepts. Direct supervision provided by clinical professionals. Course designated for the licensed vocational nurse transitioning to professional practice."
RNSG 2221,Professional Nursing: Leadership & Management,2,"Exploration of leadership and management principles applicable to the roles of the professional nurse. Includes application of knowledge, judgment, skills, and professional values within a legal/ethical framework."
RNSG 2213,Mental Health Nursing,2,"Principles and concepts of mental health, psychopathology, and treatment modalities related to nursing care of patients and families."
RNSG 2201,Care of Children and Families,2,"Study of concepts related to provision of nursing care for children and families, emphasizing judgment and professional values within legal/ethical framework."
RNSG 2208,Maternal/Newborn Nursing and Women’s Health,2,"Study of concepts related to provision of nursing care for normal childbearing families and those at risk, and women’s health issues. Competency in knowledge, judgment, skill, and professional values within legal/ethical framework, including a focus on normal and high-risk needs for childbearing families during the preconception, prenatal, intrapartum, neonatal, and postpartum periods; and consideration of selected issues in women’s health."
RNSG 1360,Clinical Nursing II,3,"A health-related work-based learning experience for student application of specialized occupational theory, skill, and concepts. Direct supervision provided by clinical professionals."
RNSG 1343,Complex Concepts of Adult Health,3,"Integration of previous content related to common adult health needs associated with each body system, continuing development of professional nursing student as provider of patient-centered care, member of health care team, patient safety advocate, and member of a profession. Course focus is adult patients and families with complex medical-surgical health care needs in structured healthcare settings. Emphasis on knowledge, judgment, skill, and professional values within legal/ ethical framework."
RNSG 1341,Common Concepts of Adult Health,3,"Study of the general principles of caring for selected adult clients and families in structured settings with common medical-surgical health care needs related to each body system. Emphasis on knowledge judgment, skill, and professional values within legal/ethical framework."
RNSG 1301,Pharmacology,3,"Introduction to science of pharmacology with emphasis on actions, interactions, adverse effects, and nursing implications in drug classes. Topics include nursing roles and responsibilities of safe medication administration within legal/ethical framework."
RNSG 1227,Transition to Professional Nursing,2,"Content includes health promotion, expanded assessment, analysis of data, critical thinking skills and systematic problem solving process, pharmacology, interdisciplinary teamwork, communication, and applicable competencies in knowledge, judgment, skills, and professional values within a legal/ethical framework throughout the lifespan."
RNSG 1260,Clinical Nursing I,2,"A health-related work-based learning experience that facilitating student application of specialized occupational theory, skill, and concepts. Direct supervision is provided by clinical professional."
RNSG 1261,Clinical Nursing II (LVN-ADN Track),2,"A health-related work-based learning experience for student application of specialized occupational theory, skill, and concepts. Direct supervision provided by clinical professionals. Course designated for the licensed vocational nurse transitioning to professional practice."
RNSG 1244,Nursing Skills II,2,"Study of the concepts and principles necessary to perform intermediate or advanced nursing skills and demonstrate competent performance of nursing procedures. Emphasis on knowledge, judgment, skills and professional values within legal/ethical framework."
RNSG 1215,Health Assessment,2,Development of skills and techniques required for conducting comprehensive health assessments within legal/ethical framework.
RNSG 1205,Nursing Skills I,2,"Study of concepts and principles essential for demonstrating competency performing nursing procedures. Focus is knowledge, judgment, skills, and professional values within a legal/ethical framework."
RBTC 1343,Robotics,3,"Principles and applications of robots. Includes installation, interfacing, programming, maintenance, and safety of robots and robotic cells."
PTAC 2446,Process Troubleshooting,4,"Instruction in the different types of troubleshooting techniques, procedures, and methods used to solve process problems. Topics include application of data collection and analysis, cause-effect relationships, and reasoning. Laboratory instruction involves troubleshooting problems initiated by the instructor in an operating pilot plant."
RNSG 1108,Dosage Calculations for Nursing,1,"Reading, interpreting and solving calculation problems encountered in the preparation of medications. Includes safe conversion and dosage calculation using different measurement systems."
PTAC 2438,Process Technology III - Operations,4,This course combines systems into operational processes with emphasis on operations under various conditions. Topics include typical duties of an operator. Laboratory exercises include the operation of a life-size distillation unit (Process Equipment Trainer).
PTAC 2387,Internship II - Process Technology/Technician,3,"A work-based learning experience that enables the student to apply specialized occupational theory, skills, and concepts. A learning plan is developed by the college and employer. Internship positions will be provided when available, but otherwise the student must obtain their own employment which is applicable to either plant or laboratory operations. Students may register in only one internship class per semester."
PTAC 2420,Process Technology II - Systems,4,"Study of the interrelation of process equipment and process systems including related scientific principles. Laboratory exercises include operating small plants representing the following unit operations: distillation, extraction, demineralization, reactors, and waste treatment."
PTAC 2314,Principles of Quality,3,"Study of the background and application of quality concepts. Topics include team skills, quality tools, and economics and continuous improvement."
PTAC 2386,Internship I - Process Technology/Technician,3,"A work-based learning experience that enable the student to apply specialized occupational theory, skills, and concepts. A learning plan is developed by the college and employer. Internship positions will be provided when available, but otherwise the student must obtain their own employment which is applicable to either plant or laboratory operations. Students may register in only one internship class per semester."
PTAC 1454,Industrial Processes,4,Grade of “C” or better in
PTAC 1432,Process Instrumentation I,4,"Study of the instruments and instrument systems used in the chemical processing industry including terminology, primary variables, symbology, control loops, and basic troubleshooting."
PTAC 1408,"Safety, Health, and Environment I",4,"Development of knowledge and skills to reinforce the attitudes and behaviors required for safe and environmentally sound work habits. Emphasis on safety, health, and environmental issues in the performance of all job tasks and regulatory compliance issues. Course topics will be reinforced through plant scenarios performed at the Process Equipment Trainer."
PTAC 1410,Process Technology I- Equipment,4,Instruction in the use of common process equipment. Laboratory exercises include the operation and maintenance of process equipment.
PTAC 1308,"Safety, Health, and Environment I",3,"Development of knowledge and skills to reinforce the attitudes and behaviors required for safe and environmentally sound work habits. Emphasis on safety, health, and environmental issue in the performance of all job tasks and regulatory compliance issues. Course topics will be reinforced through plant scenarios performed at the Process Equipment Trainer."
PSYC 2316,Psychology of Personality,3,"A study of various factors and conditions related to successful human adjustments, including parent-child relations, personality defense mechanisms, psychoanalytic concepts, anxiety states, and methods of personality adjustment."
PTAC 1302,Introduction to Process Technology,3,"Introduction to chemical and refinery plant operations. Topics include process technician duties, responsibilities and expectations; plant organizations; plant process and utility systems; and the physical and mental requirements of the process technician."
PSYC 2308,Child Psychology,3,"A study of basic principles of psychology including the relationship of the physical, emotional, and mental factors in the growth of the human personality, and the importance of the first ten years on patterning adult behavior."
PSYC 2314,Life Span Growth and Development,3,"The study of the relationship of the physical, social and mental factors of growth and development throughout the life span."
PSYC 2307,Psychology of Adolescence,3,"The psychological problems of the normal teenage individual, including the consideration of the ways and means of aiding youth to meet these problems constructively."
PSYC 2301,General Psychology,3,"An introductory course dealing with the elementary principles of human behavior. Designed especially for those students majoring in the social or biological sciences, in pre-medicine, or in education."
WTRD 4303,Emerging Issues in Human Resource Training,3,The course prepares the student to identify the emerging issues that will affect the human resources and training professional. Students will explore current trends and technologies related to human resource and training (HRT).
PSYC 1300,Learning Framework,3,"The course is designed to introduce students to psychological theories of learning, cognition and motivation to serve as a conceptual basis for college-level student academic strategies. Activities are designed to help the student promote and apply newly learned study strategies and skills. Also listed as"
WTRD 4304,Workplace Learning and Development,3,This course provides students with the core skills necessary to facilitate group interactions through the use of process tools for facilitators and practical decision-making for change. The course will first explore facilitation and understanding the facilitator’s role within a group. Students will then investigate and discuss the stages of facilitation from assessment to feedback and will examine the dynamics of facilitation for groups.
WTRD 4301,Strategic Training and Development,3,"The course provides the student with 21st-century developments in training, research and practice including the strategic role of training and the use of new technologies. The course will help develop essential skills for improving and empowering organizations through high-caliber training and development processes."
WTRD 4302,Principles of Adult Learning,3,"The course examines the nature and processes of adult learning, particularly emphasizing learning within organizations. Topics include theories on how adults learn, learning styles, assessing learning, developing thinking skills in adults, and training methodologies."
WLDG 2451,Advanced Gas Tungsten Arc Welding (GTAW),4,"Advanced topics in GTAW welding, including welding in various positions and directions. NCCER credit available."
WLDG 2513,Intermediate Welding Using Multiple Processes,5,"Instruction using layout tools and blueprint reading with demonstration and guided practices with some of the following welding processes: oxy-fuel gas cutting and welding, shield metal arc welding (SMAW), gas metal arc welding (GMAW), fluxcored arc welding (FCAW), gas tungsten arc welding (GTAW), or any other approved welding process. NCCER credit available."
WLDG 2452,Advanced Flux Cored Arc Welding (FCAW),4,Advanced concepts of flux cored arc welding of structural and fabricated steel products. Skill development in multi-pass fillet and v-groove welding. Students will be able to perform safety inspections of equipment and accessories; and perform multi-pass fillet and v-groove welds in various positions. NCCER Credit Available.
WLDG 2447,Advanced Gas Metal Arc Welding (GMAW),4,"Advanced topics in GMAW welding, including welding in various positions and directions. NCCER credit available."
WLDG 2406,Intermediate Pipe Welding,4,"A comprehensive course on the welding of pipe using the shielded metal arc welding (SMAW) process. Position of welds will be 1G, 2G, 5G, and 6G using various electrodes. Topics covered include electrode selection, equipment setup, and safe shop practices. NCCER credit available."
WLDG 2443,Advanced Shielded Metal Arc Welding (SMAW),4,Advanced topics based on accepted welding codes. Training provided with various electrodes in shielded metal arc welding processes with open V-groove joints in all positions. NCCER credit available.
WLDG 2413,Intermediate Welding Using Multiple Processes,4,"Instruction using layout tools and blueprint reading with demonstration and guided practices with some of the following welding processes: oxy-fuel gas cutting and welding, shield metal arc welding (SMAW), gas metal arc welding (GMAW), fluxcored arc welding (FCAW), gas tungsten arc welding (GTAW), or any other approved welding process. NCCER credit available."
WLDG 2380,Cooperative Education III - Welding Technology,3,"Career related activities encountered in the student’s area of specialization are offered through an individualized agreement among the college, employer, and student. Under supervision of the college and the employer, the student combines classroom learning with work experience. Includes a lecture component."
WLDG 1457,Intermediate Shielded Metal Arc Welding (SMAW),4,A study of the production of various fillets and groove welds. Preparation of specimens for testing in various positions. Students will be able to identify principles of arc welding; describe arc welding operations of fillet and groove joints; explain heat treatments of low alloy steels; and explain weld size and profiles; prepare test plates; perform fillet welds in the overhead position; perform air carbon arc weld removal; perform bevel groove welds with backing plates in various positions; and demonstrate use of tools and equipment. NCCER Credit Available.
WLDG 2352,Advanced Flux Cored Arc Welding,3,Advanced concepts of flux cored arc welding of structural and fabricated steel products. Skill development in multipass fillet and v-groove welding.
